id,string
0,elɐ ʃɔbɐe̯ ʃɔbɐɾ hɐt̪ot̪ <> ɔʃɔhɐe̯ mɐnuʃ ɐce?
1,ke͡u̯ kɐɾo ɪjɐ nɐ͡ɪ̯।
2,"elɐ o͡ɪ̯ ɟe, kɐ͡ɪ̯lkɐ bɛtɐe̯ ɪpot̪ɐɾɪ ɐnce, khɐ͡ɪ̯coŋ, ɪpot̪ɐɾɪ ete phɪɾɪɟot̪ t̪hu͡ɪ̯coŋ, ɐ͡ɪ̯ɟkɐ elɐ khɐ͡ɪ̯m।"
3,ɐɾ mu͡ɪ̯ ɐgot̪ kɪ koɾcɪnu?
4,"<> ɐgeɾ kɔt̪ɐ bɐd̪ d̪e͡o̯, elɐ nɐ͡ɪ̯।"
5,ɐgeɾ d̪ɪn bɦulɪ ɟɐ͡o̯।
6,"ɐget̪o kɛmon ɪnkɐm ɐchɪlo, ɐget̪o ɟɛmon hɐt̪ot̪ tɛkɐ ɐchɪlo, kɛmon nɐɽɐcɐɽɐ koɾcen, ɐge t̪omɐɾ, elɐ ɐce?"
7,ɐge t̪omɐɾ ɟɪnɪʃ-pɐtɪɾ d̪ɐmɔ͡o̯ kɔm ɐchɪlo।
8,"ɛkɔn mone koɾo, tɛkɐ͡ɐ̯lɐ ʃɐhɪnok, ʃɐhɪnɪɾ mɐjok, phɪɾoɟeɾ bɔ͡u̯jok, o͡ɪ̯ phɪɾoɟeɾ betɪk, phɪɾoɟek"
9,"ɐɾ ɐge tekɐ ɐlɐ ɐʃɪlo khɐl, kɐe̯?"
10,ɟɐe̯ bɐɟɐɾ nɪjɐ hɐt̪ geʃɪl ɐɾ ɐcchɪlo।
11,d̪u͡ɪ̯tɐ tekɐ t̪ɐɾɪ ɐʃɪl।
12,ɐllɐhoɾ kɐche hɐɟɐɾ ʃukɐɾ moɾ kono ɟɪnɪseɾ thɛkɐ nɐ͡ɪ̯।
13,bɔ͡u̯ nojɐe̯?
14,<> t̪omɐɾ kɪʃeɾ e͡ɪ̯ thɛkɐ t̪omɐɾ <>
15,"ɐllɐh, ɐllɐh ɟẽ ɟomɪn nɐ͡ɪ̯ hɐt̪ pɐjeɾ upoɾ d̪ɪjɐ e͡ɪ̯ ʃukɐɾ cɐlɐe̯ e͡ɪ̯tɐe̯ ɐllɐhoɾ kɐcche।"
16,lɐkho ʃukɾɪjɐ।
17,e͡ɪ̯ bɐɽeɾ ɟonne ɔʃɔhɐe̯ hunu hɔe̯ bɐbɐ।
18,kɐ͡ɪ̯jo kɪchu d̪ɪle nɐ hɔe̯।
19,e͡ɪ̯ ɛt̪onɐ ɛkhonɐ <> kɐ͡ɪ̯ kɪ d̪ɪbe?
20,o͡ɪ̯llɐ nohɐe̯ kɔt̪ɐ।
21,kɐɾo।
22,o͡ɪ̯ɟe kɔɾmophɔl d̪eʃeɾ mɐlɪk ɐllɐh ɟɐɾ kɔɾmo ɟɛmon t̪ɐk phɔl t̪ɛmon d̪ebe।
23,t̪ɛmon d̪ebe।
24,phesbukɔt̪o bole d̪ɪʃe bole kɐ͡ɪ̯lkɐ bole।
25,kɪ d̪ɪʃe?
26,ɐ̃kɐʃtɐ bole lɐl ho͡ɪ̯ʃe।
27,kɐlɪ phesbukɔt̪o ɔnekɟɔne d̪ɪʃe etɐ।
28,kɪ t̪ɐ kɪ?
29,"o͡ɪ̯ɟe t̪ɐɾɐɾ ɟẽ, t̪ɐɾɐɾ <> t̪ɐɾɐɾ ɟẽ ʃed̪ɪn bɐ hɪl nɐ।"
30,t̪ɐɾɐɾ ɟẽ ʃed̪ɪn bɐ hoʃɪl।
31,<> ɐʃole e͡ɪ̯t̪ɐ ho͡ɪ̯lo ʃɐmne d̪uɾbɦɔk d̪ɛkhɐ d̪ɪbe t̪ɐɾ ɛkt̪ɐ lɔklon।
32,ɐɾe etɐ bol ɟekon ɛktɐ lɔlon mu͡ɪ̯ t̪o ko͡ɪ̯ʃu d̪ekhɪjɐ।
33,"kɐ͡ɪ̯lkɐ bole, t̪ɐmɐn ɐʃɐʃ bole ɪjɐ ho͡ɪ̯be।"
34,"e͡ɪ̯ ɟonne ɔneke ko͡ɪ̯ce ɟe, ɛk bɔcɔɾeɾ khɐbɐɾ mɔɟut̪ ɾɐkhɐɾ ɟonne।"
35,<> ɐllɐ!
36,"ɾoɟɐ monoɾo d̪ɪnot̪, khɐbɐɾ kɪcu mɔɟut̪ ɾɐkhɐɾ ɟonne।"
37,ʃɔɾkɐɾe?
38,"ʃɔɾkɐɾ nɐ, bɪbɦɪnno ɟɔne bolt̪eche ɐɾ kɪ।"
39,"d̪ɦuɾ, o͡ɪ̯gɔlɐ kɔt̪ɐ ko͡ɪ̯ʃ nɐ, ʃɔɾkɐɾ <>"
40,"ʃɔɾkɐɾe d̪ee̯ nɐ͡ɪ̯ <> e͡ɪ̯ ʃono, ɛkɔn e͡ɪ̯ ɟe, bɔɾt̪omɐneɾ ɟug।"
41,"ɟɐmɾɐ moɟut̪ ɾɐkhe, t̪ɐmɾɐe̯ ɛkɔn khɐbɐɾ pɐe̯ nɐ।"
42,e͡ɪ̯tɐe̯ ɟɐnɪ ɾɐko।
43,"ʃe͡ɪ̯tɐ t̪o pɐe̯ nɐ, kɪnt̪u ɔneke͡ɪ̯ ko͡ɪ̯ce ɐɾ kɪ, ɟe ʃukɾbɐɾ, pot̪hom ɾɔmɟɐn ʃukɾbɐɾ, mɐɟeɾ ɾɔmɟɐn ʃukɾbɐɾ"
44,"ɛktɐ cɪnt̪hɐ d̪ɛkhɐ gelo ɐkɐʃɔt̪o e͡ɪ̯tɐ ho͡ɪ̯lo d̪uɾbɦɔkkheɾ ɛktɐ lɔɟon, etɐ hɔjɾt̪o mohɐmd̪ ʃɐllɐllɐhu ɐlɐ͡ɪ̯hɪ ʃɐlɐm nɪɟe bole kɔjɐ ge͡ɪ̯ʃe।"
45,"ʃoɟɐɾbɐɾ, ʃoɟɐɾbɐɾ t̪o pɔɾbe bɐɟɔt̪o zɪbone ɾɔmɟɐn ʃoɟkɾobɐɾe pɔɾe nɐ͡ɪ̯।"
46,<> po͡ɪ̯ɽcche t̪o ʃol t̪ɐɾɪkh।
47,pɔɽche t̪o।
48,<> pɔneɾo t̪ɐɾɪkh pɔɾbe nɐ ʃukɾobɐɾ।
49,ʃolo t̪ɐɾɪk ʃolo।
50,ʃolo t̪ɐɾɪk koɾben?
51,"ho,et̪ɪ pot̪om ɾɔmɟɐn ʃukɾobɐɾ ho͡ɪ̯lo nɐ?"
52,t̪ɐ͡ɪ̯le mɐɟeɾ ɾɔmɟɐnɔ͡o̯ ʃukɾobɐɾ ɐ͡ɪ̯ʃe।
53,"mɐɟeɾ, put̪ɪd̪ɪn t̪o koɾt̪e ɐcɪ, ʃukɾobɐɾ t̪o, <> ɐɾe mɐɟeɾ ɾɔmɟɐneɾ kɔt̪ɐ ko͡ɪ̯ce।"
54,mɐɟeɾ ɾɔmɟɐn monoɾo pɐɾ ho͡ɪ̯le?
55,"ho,h।"
56,"ʃolo ɾoɟɐ, ʃe͡ɪ̯tɐ ʃukɾobɐɾ poɽbe?"
57,"e͡ɪ̯ t̪o ɐgeɾ belɐ͡o̯, e͡ɪ̯ mok dɐkpɐɾ nɐgoce, mu͡ɪ̯ kɔ͡o̯, oɾe ɐllɐ!etɐ ʃɔbɐ͡ɪ̯ d̪ɛkce, ʃɔbɐ͡ɪ̯ mɐne d̪ɛkpe etɐ͡o̯ ko͡ɪ̯ce।"
58,ʃɔbɐɾ coke poɽbe।
59,"<> e͡ɪ̯gɔlɐ ʃono, moʃɔɾmɐnok e͡ɪ̯gɔlɐ kɪcu kowɐ ɟɐbɐnnɐe̯, zɐɾ kɐɾon,"
60,"o͡ɪ̯ ɟe, ɛkbɐɾ ho͡ɪ̯lo cɐ̃d̪eɾ mɔd̪d̪e kɪ?"
61,oɾe ɐllɐ!
62,o͡ɪ̯ ɟe ʃɐ͡ɪ̯d̪ɪ boʃɪ ɐce।
63,e͡ɪ̯gɔlɐ kowɐ ɟɐe̯ nɐ।
64,"t̪ɐ͡ɪ̯ ɟe ɛkbɐɾe nɐfɔɾmɐnɪ, ɟɐmɾɐ e͡ɪ̯tɐ bɪʃʃɐʃ ko͡ɪ̯ɾbe।"
65,e͡ɪ̯tɐ bɔlɐ ɟɐbe nɐ।
66,"ɐɾe otɐ ɛktɐ, bɦujɐ ɛktɐ ɪjɐ͡o̯ ɾɔtɐ͡ɪ̯chɪlo।"
67,o͡ɪ̯ɟe ʃɐ͡ɪ̯d̪ɪ pɐgoɾɪ d̪ɪjɐ boʃɪ ɐce।
68,o͡ɪ̯ ɟe ɐt̪owɐɾ ɐchɪlo nɐ?
69,moɾ ʃɐt̪e e͡ɪ̯ ɟe kɐɟɪjɐ e͡ɪ̯khɐn nɪjɐ।
70,kɔe̯ kɪ?
71,"kɔe̯ bole, ɐʃole o͡ɪ̯tɐ ʃɐ͡ɪ̯d̪ɪ।"
72,bole t̪u͡ɪ̯ moʃɔlmɐne nowɐ͡ɪ̯ʃ।
73,"<> ɐllɐɾ kɐce ɐɾɐd̪onɐ koɾɪ ɐɾ, mɔjnɐ kote gelo?"
74,ɐllɐ ɟe kɪ koɾbe!
75,ɐce ude।
76,"kɛmon, ɐllɐe̯ ɟod̪ɪ ɪmɐn ɐmɐne ɟod̪ɪ mɐnuʃ koɾɐe̯, ʃe͡ɪ̯tɐ ɐllɐɾ kɐce bɪʃɐl।"
77,ʃe <> bɪjɐ koɾce?
78,"ho, ɐɟhɐɾ bɪjɐ koɾce, phɪɾ chɐ͡o̯wɐ ho͡ɪ̯ce ujɐɾ।"
79,"ɐɟhɐɾ bɪjɐ koɾce phɪɾ moɾe ho͡ɪ̯lo ɪjɐk d̪ɦɔn, moɾ o͡ɪ̯ ɟɛtɐt̪o bo͡ɪ̯neɾ bɪjɐ hɔe̯ nɐ͡ɪ̯?"
80,"t̪ɐɾe nonod̪ok bɪjɐ koɾce, d̪ɛkco mu͡ɪ̯।"
81,"o͡ɪ̯ ɟe, omɐɾ bɐɽɪt̪o ɟe ɐchɪlo।"
82,ɐɾe omɐɾ bɐɽɪt̪o nojɐe̯।
83,ɐɾe kon ɐt̪owɐɾeɾ kɔt̪ɐ kon?
84,ete ɟe phɐɾɐmot̪ ɐchɪlo।
85,"ho, ʃe͡ɪ̯ ɐt̪owɐɾeɾ kɔt̪ɐ kon <> nɐ,nɐ o͡ɪ̯ ɪcɐkɐt̪puɾeɾ ɐt̪owɐɾ।"
86,"o, ʃe͡ɪ̯ ɐt̪owɐɾ bɪjɐ koɾe nɐ͡ɪ̯।"
87,"bɪjɐ koɾce, dɪvɔʃ ho͡ɪ̯ce, ɐbɐɾ"
88,"e͡ɪ̯ŋkɐe̯ ɪcɐkɐt̪puɾeɾ ɐt̪owɐɾ, ɪcɐkɐtpuɾ ɐt̪owɐɾ।"
89,"elɐ o͡ɪ̯ ɟe, ujɐɾ cɐcot̪o bɦɐ͡ɪ̯, ɟɛtɐt̪o bɦɐ͡ɪ̯।"
90,o͡ɪ̯ ɐt̪owɐɾeɾ ʃɐt̪e ujɐɾ mɪle nɐ͡ɪ̯।
91,"nɐ go, ɟɐ͡ɪ̯।"
92,ɐ͡ɪ̯ɟkɐ kɪ khɐ͡o̯wɐ-d̪ɐ͡o̯wɐ kɪ koɾce?
93,"ɐ͡ɪ̯ɟkɐ ho͡ɪ̯lo dɐ͡ɪ̯l, dɪm, dɐ͡ɪ̯l, ɐbɐɾ phɪɾ bɦɔt̪t̪ɐ-t̪t̪t̪ɐ, mɐc ɐce।"
94,kɪnt̪u ʃo͡ɪ̯d̪d̪ɐe̯ t̪o o͡ɪ̯ dɪm-dɐ͡ɪ̯l ɐɾ
95,"e͡o̯ t̪o, cɐcɪ ɾoɟɐ t̪hɐke nɐ?"
96,"nɐ, ʃo͡ɪ̯d̪d̪oɟɐt̪, ɐɾ ɾɐ͡ɪ̯t̪o, ʃɪheɾɪɾ ʃɔmɐe̯, ʃɪheɾɪɾ ʃɔmɐe̯, cɐcɪ ɾoɟɐ t̪hɐke nɐ?"
97,"hum, t̪hɐke।"
98,ɾoɟɐ t̪hɐ͡ɪ̯kkɐnnɐe̯?
99,"ʃɪheɾɪɾ ʃɔmɐe̯ ɛkbɐɾ e͡o̯ koɾɪm, bɐ͡ɪ̯gon o͡ɪ̯gole bɦɐɟɪm, dɪm bɦɐɟɪm।"
100,"o͡ɪ̯ ɟe, ge͡ɪ̯ce ɾo͡ɪ̯।"
101,"kɐ͡ɪ̯lkɐ mɐc ɐnd̪ɪm, lɐ͡u̯ d̪ɪjɐ।"
102,lɐ͡u̯konɐ kɐ͡ɪ̯tpɐɾ nɐ͡ɪ̯gbe।
103,"o͡ɪ̯, phɪɾd̪uʃɪɾ mɐ͡o̯ lɐ͡u̯ d̪ɪjɐ ɐcce, o͡ɪ̯kkhɐn ɐnd̪ɪbɐɾ kɔ't̪o।"
104,kɛ ɾe͡ɪ̯?
105,"phɪɾd̪uʃɪɾ mɐ͡o̯ kɐ͡ɪ̯lkɐe̯ nɪjɐ ɟɐbe, nɐ ɐ͡ɪ̯ɟkɐe̯ nɪjɐ ɟɐ͡ɪ̯be?"
106,mɐc nɐ͡ɪ̯?
107,lɐ͡u̯ khɐbɐnnɐe̯।
108,mɐc nɪjɐ ɐ͡ɪ̯ʃo hɐp keɟɪ ɟɐjɐ।
109,"kɐ͡ɪ̯lkɐ mok nɪjɐ ɟɐbɐɾ ko͡ɪ̯lo, mu͡ɪ̯ kunuŋ, mɐc t̪hu͡ɪ̯coŋ, mu͡ɪ̯ kɔŋ mɐ͡ɪ̯nʃok d̪e͡o̯ <> hɐmɐk d̪ɪlo nɐ kɛ?"
110,lɐ͡u̯?
111,lɐ͡u̯ khɐn?
112,lɐ͡u̯ nɐ͡ɪ̯ t̪o।
113,<> ɔ͡ɪ̯knɐe̯ mu͡ɪ̯ nɪjɐ genu hɔe̯।
114,lɐ͡u̯ khɐn t̪oɾɐ?
115,mɐc t̪hu͡ɪ̯coŋ।
116,khɐe̯ nɐ?
117,"ɐmɐke bolt̪e, lɐ͡u̯ ɐnɐ lɐgbe।"
118,"lɐ͡u̯, ʃɐd̪eɾ lɐ͡u̯।"
119,o͡ɪ̯ mɪnuɾ mɐ͡o̯’ɾoɾ lɐ͡u̯ ɐce।
120,o͡ɪ̯ ɐnd̪ɪle mu͡ɪ̯ omɐɾ t̪hɐkɪ nɪjɐ ɟɐ͡ɪ̯m।
121,omɐɾ lɐ͡u̯ ʃeɟe nɐ।
122,ebɐɾ lɐ͡u̯ phɪɾ d̪ɛkho t̪o kɔjtɐ bɐɟe?
123,<> bɪcɪɾ mɐɾ lɐ͡u̯ phɪɾ gulgule hɔjɐ ɟɐe̯।
124,ʃɐɽe cɐ͡ɪ̯ɾte bɐɟe।
125,"<> ɛkeke <> ho͡ɪ̯le͡o̯ gulgule, ɛkek pɔcɐ ho͡ɪ̯le͡o̯ ɐɾo gulgule।"
126,e͡ɪ̯lle ɟɐt̪ nɐ͡u̯ nojɐe̯?
127,"mu͡ɪ̯ o͡ɪ̯ mɐch, o͡ɪ̯ lɐ͡u̯jeɾ ɟonne mɐch bɐ͡ɪ̯ɾ koɾom nɐ ɟe kɐ͡ɪ̯lke mu͡ɪ̯ lɐ͡u̯ mɐch bɐ͡ɪ̯ɾ koɾɪ lɐ͡u̯ d̪ɪje।"
128,kode t̪hɐkɪ lɐ͡u̯ nɪben?
129,kɐɾ lɐ͡u̯?
130,moɾ bɦɐ͡ɪ̯te e͡ɪ̯ kɔjd̪ɪn ɐchɪlo।
131,mɐch kenɐ nɐge nɐ͡ɪ̯।
132,kɛ kode t̪hekɪ <> ɐɟ kɔt̪od̪ɪn t̪hekɪ kɪnbe?
133,oɾe ɐllɐh!
134,o͡ɪ̯ ɟe ceɾmenok bɪɟɪ ɾɐkhche।
135,ɛkbɐɾe ɛk mɔn koɾɪ ɐnchɪlo।
136,ɐd̪ɦ mɔn koɾɪ ɐnchɪlo।
137,ɟe ɛkhonɐ ho͡ɪ̯lo chɔjtɐ bɐɾo t̪eɾokhen lɐ͡u̯je d̪ɦoɾche ɐgeɾ chɔjtɐ।
138,"ɐɾo pɐʃtɐ <> e͡ɪ̯ ɟe ʃɐg ɟe bɐchɪlo, ʃɐg d̪eho pɐt̪ɐ kɔt̪onɐ, dɐtɐgule d̪eho kɔt̪ogule?"
139,<> obɐɾ bɐɾo t̪eɾdɐ d̪ɦoɾchɪlo।
140,<> e͡ɪ̯ gɐche d̪ɦoɾche chɔjtɐ।
141,hɐmɾɐ ɛkd̪ɪn ɛktɐ khɐchɪ।
142,e͡e̯e!
143,et̪ɪ ɾe <> phɪɾ eɾ phɪɾ mɪchɐ kɔt̪ɐ ʃunɪje hɔe̯ e͡o̯ hɔe̯ kɔjd̪ɪn d̪eche।
144,<> kɐe̯?
145,<> khɐbɐɾ ko͡ɪ̯chom।
146,d̪ee̯ nɐ͡ɪ̯ <> e ko͡ɪ̯ moɾ bɦok nɐgche?
147,e͡ɪ̯।
148,d̪ehɐ t̪o।
149,mok ɟe ko͡ɪ̯chom moɾ bɦok nɐgche mok <>
150,mɐŋ kotɐ mɐŋ।
151,hɐ hɐ hɐ।
152,mɐŋ।
153,e <> bɐccɐ।
154,<> elɐ t̪o o͡ɪ̯ ɟe ejɐɾ bole <>
155,odɐ ɪjɐɾ bɐɽɪt̪o t̪hu͡ɪ̯che t̪o।
156,"nɐ, moɾ bɐ͡ɪ̯t̪o <> ɟɐmɐ͡ɪ̯ɾ bɐɽɪt̪o t̪hu͡ɪ̯che, ɾɐkhche।"
157,ɾɔŋpuɾet̪ ɟe͡ɪ̯te bɐʃɐ।
158,sɪle͡ɪ̯ koɾe nɐ͡ɪ̯ bole।
159,tep lɐge lɐge d̪ɪche।
160,tep nɐge d̪ee̯।
161,o͡ɪ̯pɐʃe ɾɔʃ pɔɽe।
162,ɾɔʃ pɔɽɪ pɔɽɪje ɪjɐ ho͡ɪ̯be।
163,phelɐe̯ d̪ɪbeɾ nɔe̯।
164,<> gɐ͡o̯ d̪ɦo͡o̯ nɐ͡ɪ̯?
165,e͡ɪ̯d̪en phun ho͡ɪ̯be।
166,o͡ɪ̯d̪en phun hɔbɐɾ nɔe̯?
167,o͡ɪ̯pɐʃe ɾɔd poɽɪ poɽɪ poɽɪ poɽɪ bɦɐlo nɐge nɐ?
168,mɔjlɐ poɽɪ poɽɪ lɐ͡ɪ̯n koɾɪ d̪ɪbe।
169,t̪ɐɾ pɔɾesene ʃukɪje <> mɐd̪ɾesɐt̪ bɦɐlo lɐge?
170,ɐɾ t̪hɐkɪne bɐbɐ ɟɐ͡ɪ̯।
171,kɪ ɐnd̪ɪben betɪ?
172,"pɐkʃɐk koɾmo mɐch pɐ mɐch, ben, ɐlu, kɐlɐ͡ɪ̯ɾ bɔɾɐ bɦɐɟmo d̪u͡ɪ̯te।"
173,e͡ɪ̯te e͡ɪ̯te d̪ekhɪ mɐd̪ɾesɐt̪ pɔɽɐ <>
174,e͡ɪ̯ nɪje ɟɐe̯ nɐ kɛmbɐ e͡ɪ̯?
175,ɐllɐe̯ ɟɐne।
176,kɪ ɟe ʃɔjt̪ɐn dɦukche!
177,po͡ɪ̯ɽbeɾ no͡ɪ̯ʃ ɐɾ mɐd̪ɾesɐ?
178,kɪ ko͡ɪ̯!
179,"ɟud̪ɪkel ko͡ɪ̯, gɐjeɾ upoɾ d̪ɪje ɟɐ͡ɪ̯be bole bo͡ɪ̯।"
180,ɟoɽe k ɛkhonɐ।
181,buɟchɪʃ?
182,"ɐɾ o͡ɪ̯ ɟe kɔe̯ ɟe, ""mɪlɪ betɪ ʃono।"""
183,"o͡ɪ̯ ɟe ɐgeɾkɐɾ mɐ͡ɪ̯nʃe ko͡ɪ̯che, ""gɐch gunle hɔe̯ gotɐ।"
184,bɐp gunne hɔe̯ betɐ।
185,mɐ͡o̯ gunne hɔe̯ chɐ͡o̯।
186,phute gunne hɔe̯ nɐ͡o̯।
187,e͡ɪ̯lle elɐ͡o̯ e͡ɪ̯lle mɪt̪t̪e।
188,hɔe̯ e͡ɪ̯ɾɔkom?
189,hɔe̯ nɐ mɐne?
190,ɔboʃʃo͡ɪ̯।
191,hɔe̯?
192,"hɐmɐɾ mɐ ɟɛmon ɔbɪnɔe̯ ɟɦɛmon koɾɪ hɐmɾɐ mɐ͡o̯k gɦɔɾek d̪ekhchɪ, od̪en koɾɪ hɐmɾɐ ɛknɐ kɪchu ʃɪkchɪ।"
193,o͡ɪ̯ ɟe ʃɐzɐneɾ bɐp ɟɦemon ʃɐzɐnek d̪ekhche ekhonɐ kɪchu kɪchu
194,kɐm kɐɟeɾ d̪ɦɔɾon ʃɐɟɐneɾ kɪnt̪u ɐlce।
195,"ʃɐt̪ɪɾ mɐ͡o̯ ɟɛmon cɔle, ʃe͡ɪ̯d̪on kɪcu d̪ɦɔɾon-d̪ɦɔɾon ʃɐt̪ɪɾ ɐlce।"
196,ɐɾɔ͡o̯ kuɽɐ।
197,ɔt̪o nojɐe̯।
198,"kɔt̪ɐ thɪke, ɐgekɐɾ mɐ͡ɪ̯nʃe ɟe ko͡ɪ̯ce, thɪke, kɔt̪ɐ khɐɾɐp nojɐe̯।"
199,"o͡ɪ̯ ɟe, e͡ɪ̯ d̪ɪnot̪, ʃɐhɪn ɐɾ phɪɾuɟ, hum।"
200,"phɪɾuɟ ɛknɐ ɛkkeɾe gotɐle ujɐɾ bɐpeɾ mɔt̪on d̪ɦɔɾon-gɔɾon, kɔt̪ɐ-bɐt̪ɾɐ, cɔlɐ-phɪɾɐ, mɐ͡ɪ̯nʃeɾ ʃɐt̪e ɛ͡o̯ kɔɾɐ, o͡ɪ̯tɐ ɐce।"
201,ɐɾ ʃɐhɪntɐ ho͡ɪ̯ce d̪unɪjɐɾ muk mond̪ɐ।
202,<> ʃɐhɪntɐ ho͡ɪ̯ce ujɐɾ mɐɾ mɔt̪on।
203,ɐɾ phɪɾuɟ ho͡ɪ̯ce ujɐɾ bɐpeɾ mɔton।
204,e͡ɪ̯llɐ kɐɾ gɦɐʃ ettugulɐ?
205,omɐɾe gɦɐʃ t̪ulɪ nɪjɐ ɐ͡ɪ̯no।
206,"<> bole ɛktɐ, ɟe kono ɛktɐ ɪŋgɪt̪o <> ge͡ɪ̯che।"
207,"ɟe ede ɟe pot̪t̪hom ɾɔmɟɐn, kɛmon <> d̪ekchen?"
208,pot̪t̪hom ɾɔmoɟɐn।
209,"e͡ɪ̯ ɟe, nojɐe̯, nechot̪, nechot̪ ho͡ɪ̯lo, pot̪t̪hom ho͡ɪ̯che bɐ, bɐ, pɔɾeɾd̪ɪn ho͡ɪ̯che bɐt̪ ɛktɐ phontɐ nechot̪।"
210,e͡ɪ̯ pot̪hom ɾɔmoɟɐn ʃukɾbɐɾ।
211,"phontɐ, e͡ɪ̯ phontɐ nechot̪।"
212,mɐɟeɾ ɾɔmoɟɐn ɐce nɐ?
213,e͡ɪ̯dɐ͡o̯ ho͡ɪ̯lo ʃukɾobɐɾ।
214,"e͡ɪ̯dɐ nobɪ sɐllellɐssɐlɐm bole kɔ͡o̯jd̪ɦɐ͡o̯ ge͡ɪ̯che ɟe, pot̪t̪hom ɾɔmɟɐn ʃukɾbɐɾ hɔbe, mɐɟeɾ ɾɔmɟɐntɐ͡o̯ ʃukɾbɐɾ ho͡ɪ̯be।"
215,ʃolo t̪ɐɾɪk ɐce nɐ?
216,ʃolo t̪ɐɾɪkɔ͡o̯ ho͡ɪ̯lo ʃukɾobɐɾ।
217,"bɐ, bɐt̪ t̪o phontɐ ɐce।"
218,"ho, o͡ɪ̯ phontɐ ɐce t̪o।"
219,e͡ɪ̯ ɟe ede d̪uɾbɦɪkkhɐ d̪ɛkhɐ d̪ɪbe d̪eʃe।
220,ʃetɐ <> hɔjɐt̪o muhomɔd̪ sɐllellɐssɐlɐme bole kɔjɐ ge͡ɪ̯ce।
221,t̪ɐɾ ɐbost̪o
222,elɐ kɛmon ɐcɪʃ?
223,kɛmon ɐcɪʃ?
224,"ɐlhɐmd̪ulɪllɐ, bɦɐlo।"
225,"t̪oɾ ʃɐt̪e enɐ gɔlpo-guɟbo koɾɪm, mobɐ͡ɪ̯lot̪ ɾekɔɾd koɾɪm, ʃɔmoʃʃɐ ho͡ɪ̯be?"
226,enɐ koɾɪm ɐɾ kɪ।
227,"gɔlpo-guɟɔb koɾmo, ɐlɐp-ɐlcochonɐ koɾmo ɐɾ kɪ।"
228,ʃɔmoʃʃɐ ho͡ɪ̯be?
229,ʃɔmoʃʃɐ kɪ?
230,<> t̪o ʃɔmoʃʃɐ।
231,"t̪o edɐ nɐm, t̪oɾ nɐm kɪ?"
232,d̪elojoɾ mɔndole।
233,"o, t̪oɾ bɔjoʃ kɔt̪o co͡ɪ̯lbɐɾ nɐgoce elɐ?"
234,ɛkʃo ɛgɐɾo।
235,ɛkʃo ɛgɐɾo bɔchoɾ cɔle?
236,"elɐ ɪjɐ ɾoɟɐ ɐchɪʃ t̪o, nekɪ?"
237,"ho, oɟɐ।"
238,bɦɐt̪ kɪ d̪ɪ khɐchɪʃ?
239,"bɦɐt̪, mɐch।"
240,ɔh!
241,t̪ɐ khɐ͡o̯wɐ d̪ɐ͡o̯wɐ bɦɐloe̯ ho͡ɪ̯t̪eche?
242,kɪ mɐch d̪ɪje khɐlu?
243,kɪ mɐch?
244,ɪlɪʃ mɐch।
245,ɪlɪʃ mɐch d̪ɪje khɐchɪʃ?
246,kode pɐlu ɪlɪʃ mɐch?
247,kɐe̯ ɐnche?
248,<> ɔ͡o̯!
249,"t̪e ɪjɐ mejɐɟɟɐnɪ cɔlche t̪o bɦɐloe̯, nɐkɪ?"
250,kono ɟɦut ɟɦɐmelɐ nɐ͡ɪ̯?
251,ɟɦut ɟɦɐmelɐ nɐ͡ɪ̯।
252,"o, t̪ɐ͡ɪ̯le khɐ͡o̯wɐ-d̪ɐ͡o̯wɐ mɐnuʃe koɾɐe̯ bɦɐlobɦɐbe?"
253,khɐ͡o̯wɐ-d̪ɐ͡o̯wɐ koɾɐe̯ t̪o।
254,kɐ͡ɪ̯l kɐɾ bɐɽɪt̪o khɐ͡ɪ̯cen?
255,kɐ͡ɪ̯l?
256,phulu cɐcɐɾ bɐɽɪt̪o।
257,"o, t̪ɐɾ ɐgeɾ d̪ɪn?"
258,hɐnɪpeɾ bɐɽɪt̪o।
259,"hum, t̪ɐɾpɔɾe ɟolɪleɾ hoɾe bɐɽɪt̪o khɐ͡ɪ̯cen?"
260,ɟolɪleɾ bɐɽɪt̪o khɐcu।
261,kɐɾ bɐɽɪt̪o kɛmon khɐ͡o̯wɐ-d̪ɐ͡o̯wɐ ko͡ɪ̯ɾlen?
262,bɦɐloe̯ khɪlɐ͡ɪ̯ce।
263,kɐɾ bɐɽɪt̪o kɛmon?
264,ʃɔbɐɾe bɐɽɪt̪e bɦɐloe̯ khɪlɐ͡ɪ̯ce।
265,"t̪ɐɾmod̪d̪e kɐɾ, kɐɾ bɐɽɪt̪o khɐ͡o̯wɐ bɦɐlo ho͡ɪ̯ce?"
266,"kon ɾɐnnɐtɐ kɛmon koɾɪce, kɪ ʃɔmɐcɐɾ, kɔ͡o̯ d̪ekhɔŋ।"
267,kon ɾɐnnɐtɐ kɛmon ho͡ɪ̯ce?
268,ɟolɪleɾ bɐɽɪt̪o kɪ kɪ khɪlɐ͡ɪ̯ce?
269,"mɐc, goʃ।"
270,"dɐ͡ɪ̯l, bɦɐt̪।"
271,"t̪ɐ͡ɪ̯le ɪjɐ, khɐ͡o̯wɐ ʃɔbcɐ͡ɪ̯t̪e kɐɾ bɐɽɪt̪o bɦɐlo ho͡ɪ̯ce?"
272,"ɾeɟɐɾ bɐɽɪt̪o, nɐ hɐnɪph mɐzɪɾ bɐɽɪt̪o nɐ fɔkɐɾud̪ɪn ɟɐtɐɾ bɐɽɪt̪o?"
273,"kɐɾ bɐɽɪt̪o khɐ͡o̯wɐ bɦɐlo ho͡ɪ̯ce, kɔ͡o̯ d̪ekhɔŋ?"
274,"mu͡ɪ̯ khɐlɪ dɪm ɐɾ mɐc, kɐɾ bɐɽɪt̪o?"
275,khɐ͡ɪ̯cuŋ।
276,"goʃt̪o khɐ͡ɪ̯t̪e pɐɾɪ nɐ͡ɪ̯, ʃokt̪o!"
277,ʃokt̪o?
278,<> gɐ͡ɪ̯-gɔɾuɾ goʃt̪o ɟon nɔɾom hɔe̯?
279,"nɐ, gɐ͡ɪ̯-gɔɾuɾ gost̪o, buɽɐ goɾuɾ gost̪o nɔe̯?"
280,ʃokt̪o।
281,ɐɾ otɐ ɟɐl d̪e͡o̯wɐ lɐge mɛlɐkkhɔn।
282,"ho, khɐ͡ɪ̯t̪e pɐɾɪ nɐ͡ɪ̯, ɛkhɐno khɐ͡ɪ̯t̪e pɐɾɪ nɐ͡ɪ̯।"
283,"ɛkno ɪpot̪ɐɾɪ t̪o, mɔnocɪd̪et̪e kɔɾɐ hɔe̯, nɐkɪ?"
284,"ɪpot̪ɐɾɪ kɛmon hɔe̯, kɪ ʃɔmɐcɐɾ?"
285,"kɔe̯ tɐkɐɾ koɾɪ ɪpot̪ɐɾɪ kɔɾen, put̪ɪd̪ɪn?"
286,"pɐʃʃɐɾe, chɔjʃo।"
287,ɪjɐɾ ɐgeɾbɐɾ bɦɐlo ho͡ɪ̯cɪl nɐ e͡ɪ̯bɐɾ bɦɐlo hɔbɐɾ nɐgoce?
288,konbɐɾ bɦɐlo hɔbɐɾ nɐgoce?
289,ɐgeɾbɐɾe <> ejd̪ɐ͡o̯-tejd̪ɐ͡o̯ kɪnchɪlo।
290,"ɐpl-tɐpel, mɐlɐttɐ-tɐltɐ kɪnchɪlo?"
291,"ho, ebɐɾ t̪o e͡ɪ̯gɔlɐ͡o̯ nɐ͡ɪ̯।"
292,ebɐɾ d̪ɐm beʃɪ nɐ?
293,e͡ɪ̯bɐɾ d̪ɐm beʃɪ ɟonne e͡ɪ̯ ʃɔmoʃʃɐtɐ।
294,e͡ɪ̯bɐɾ t̪o ʃog ɟɪnɪseɾ d̪ɐm nojɐe̯ beʃɪ?
295,o͡ɪ̯ d̪ɐmeɾ kɐɾone ɟɦɐmelɐtɐ beʃɪ ɐɾ kɪ।
296,bɐ͡ɪ̯
297,o͡ɪ̯bɦɐbe ɐɾ kɪcu khɐbɐɾ pɐe̯ nɐ।
298,"t̪ɐ ɛkhon, ɪjɐ ɟɛtoɾ ʃɐt̪e kɔt̪ɐ hɔe̯?"
299,mɐhbub ɟɛtoɾ ʃɐt̪e?
300,"ho, ge͡ɪ̯t̪e-ɐʃt̪e kɔt̪ɐ hɔe̯।"
301,<> ʃɐt̪e kɔt̪ɐ hɔe̯ nɐ?
302,<> ʃɐt̪e͡o̯ kɔt̪ɐ hɔe̯ nɐ͡ɪ̯?
303,"ʃowɐg, ʃelɪm?"
304,"oɾɐ ɐgot̪ khɐ͡ɪ̯ce ɐɾ, elɐ hɔe̯ nɐ ɐɾ kɔt̪ɐ?"
305,"ɾezɐ ɐɾ ʃowɐg, <> kɐce ɐɾ o͡ɪ̯ ʃowɐgeɾ kɐce।"
306,tɐkɐ?
307,ʃowɐgeɾ kɐce d̪echo।
308,ʃowɐgeɾ ʃɐt̪e kɔt̪ɐ komu?
309,"ɐccɐ ho͡u̯k kɔt̪ɐ ko͡ɪ̯ʃ elɐ, ʃɔmoʃʃɐ nɐ͡ɪ̯, kɔjɐ d̪e͡ɪ̯m elɐ।"
310,kɪnt̪u ɛkɔn
311,"o͡ɪ̯ ɪjɐ ɐ͡ɪ̯ʃe nɐ, nɐ?"
312,kedɐ?
313,"o͡ɪ̯ ɟe bokkoɾ hɐmɐɾ etet̪, mɔnoɟɪd̪ot̪ nɐmɐɟ poɽe nɐ?"
314,bɔkkoɾ pɔɽe nɐ?
315,"kɛ, pɔɽe nɐ kɛ?"
316,kɐhɪnɪ kɪ ujɐɾ?
317,ede ɟɐe̯।
318,kontɐt̪?
319,o͡ɪ̯ bɐɟɐɾeɾtɐt̪ nɐ o͡ɪ̯tɐt̪?
320,"nɐ, o͡ɪ̯tɐt̪।"
321,"<> thɪkbɦɐbe ɟɐe̯ nɐ,nɐ?"
322,ɔt̪o beʃɪ?
323,"nɐ, put̪ɪd̪ɪne ɟɐe̯ nɐ।"
324,"put̪ɪd̪ɪne ɟɐe̯ nɐ, nɐ?"
325,"mɐɟɐ͡ɪ̯d̪d̪e ɟɐe̯, ɟɐe̯ nɐ।"
326,"t̪ɐ bɐd̪e o͡ɪ̯ khɐɟɐ͡o̯ t̪o ɐ͡ɪ̯ʃe ɛkn ete, nɐ?"
327,khɐɟɐ ɐ͡ɪ̯ʃe।
328,"khɐɟɐ ɐ͡ɪ̯ʃe, t̪ɐ͡ɪ̯le o͡ɪ̯ bokkoɾ bɐd̪e ʃɔbɐ͡ɪ̯ ɐ͡ɪ̯ʃe?"
329,elɐ goɾu kɔjtɐ gɐb ho͡ɪ̯lo?
330,cɐ͡ɪ̯ɾtɛ।
331,cɐ͡ɪ̯ɾtɛ?
332,"ɪjd̪ɐ, o͡ɪ̯ chɐgol ɐce nɐkɪ?"
333,chɐgolo ɐttɐ।
334,pɐt̪ɐ tɐt̪ɐ khɪlɐ͡ɪ̯ʃ nɐ?
335,gɦɐʃ-tɐʃ nɪjɐ ɟɐjɐ d̪e͡ɪ̯ʃ nɐ?
336,"ho, mu͡ɪ̯ bɐcho nɐ ɐɾɔ͡o̯!"
337,"kɔjd̪ɪn ɟe d̪eknu, pɐt̪ɐ kuɽɐ͡ɪ̯lu?"
338,pɐt̪ɐ kuɽɪ-tuɽɪ nɪjɐ ɟɐjɐ khɪlɐŋ t̪o।
339,pɐt̪ɐ kuɽɪ nɪje ɟɐjɐ khɪle͡ɪ̯ʃ?
340,ɐ͡ɪ̯ɟgolel pɐt̪ɐe̯ nɐ͡ɪ̯।
341,"t̪ɐ͡ɪ̯le t̪oɾ cɔlkɐʃot̪ t̪hɐkt̪e ɪje bɦɐlo ɐchɪlo, ne?"
342,ɪphot̪eɾɪgule?
343,"mɐnuʃe dɐke dɐke khɪlechɪlo khub, nohɐe̯?"
344,dɐkɪ nɪje nɪje ɟɐjɐ khɪlee̯?
345,cɔkɐl ɐɾ edɐ͡ɪ̯?
346,t̪ɐ cɔlkɐɟot̪ bɦɐloe̯ chɪlo?
347,"ɔde mɐnuʃɟɔno beʃɪ t̪ok ejɐ koɾchɪlo, nohɐe̯?"
348,bɐɽɪt̪o nɪjɐ nɪjɐ ɟɐjɐ ɪpot̪ɐɾɪ khɪlɐ͡ɪ̯chɪlo?
349,bɦɐt̪ khɪlɐ͡ɪ̯chɪlo?
350,"ote ɟe ɐge ɟe o͡ɪ̯, chobɐ͡ɪ̯nnɐ ɐchɪlo, chobɐ͡ɪ̯nnɐɾ bɛtɐ ɐchɪlo?"
351,"chobɐ͡ɪ̯nneɾ bɛtɐ t̪o, khub ɐmd̪ koɾchɪlo।"
352,"chobɐ͡ɪ̯nneɾ bɛtɐ, chobɐ͡ɪ̯nneɾ bɛtɐ ko͡ɪ̯ t̪ɐɾ?"
353,"mu͡ɪ̯ nɐ d̪ekchoŋ, betɪ khɐlɪ d̪u͡ɪ̯tɛ।"
354,bɛtɐ ɐce <> bɛtɐ bɔɽo?
355,ʃɔb bɔɽo।
356,betɪ d̪uknɐ khɐlɪ bɔɽo।
357,mu͡ɪ̯ le͡ɪ̯kchoŋ ho͡ɪ̯lo e͡ɪ̯ ɟe kɔphɪ ɐɾ ho͡ɪ̯lo polɪ।
358,e͡ɪ̯ d̪u͡ɪ̯te͡ɪ̯ <> kɔphɪ ɐɾ kolɪ?
359,polɪ polɪ।
360,kolɪ।
361,kolɪ nɐm?
362,kolɪ nɐ polɪ?
363,omɐɾ bɐɽɪt̪o khɐ͡o̯wɐ d̪ɐ͡o̯wɐ koɾchɪlu?
364,ʃɔgɐ͡ɪ̯ɾe bɐɽɪt̪o khɐ͡o̯wɐ d̪ɐ͡o̯wɐ koɾchɪnu।
365,ɔdɐ͡ɪ̯ nɪlɐ ɐche।
366,"o͡ɪ̯ d̪enɐɟpuɾɪ ɟe buɽɐ ɐche ɟe, d̪enɐɟpuɾɪ?"
367,o͡ɪ̯ khɪlee̯ nɐ͡ɪ̯ t̪ok?
368,khub ɪje?
369,khub <> hɛ?
370,<> hoŋʃeɾ ʃɛʃ।
371,mu͡ɪ̯ ne d̪ekhlɔŋ bɦɐloe̯ ɐche।
372,"ʃohɐgeɾ gɦɔɾe, ʃohɐgeɾ bɔ͡u̯ɾ ʃɐt̪e ɟe khɐt̪ɪɾ!"
373,"mone kɔɾ kɐlɐ͡ɪ̯ tɐlɐ͡ɪ̯ d̪ee̯, ʃɐk-ʃɔbɟɪ d̪ee̯।"
374,"o͡ɪ̯ ɟe ɛkbɐɾ genu, mɐɟot̪e gechonu।"
375,t̪ɐt̪e e͡ɪ̯ɾɔkom ɔnek upokɐɾ koɾche e͡ɪ̯ɾɔkom।
376,mone kɔɾ kɐlɐ͡ɪ̯ nɐ t̪hɐkle ehon dɐ͡ɪ̯l ehonɐ <> d̪ee̯।
377,ʃɐg d̪ee̯।
378,ɟɔkhon ɟetɐ lɐge।
379,ɟɔkhon ɟɐ lɐge t̪ɔkhone t̪ɐ d̪ɪchɪlo।
380,elɐ kɪ t̪oɾ cul kɐdɐbu?
381,"ho͡u̯, nɐh।"
382,t̪oɾ mok t̪o chodoe̯ ɐche।
383,mochogule kɐdu hɔe̯।
384,ko͡ɪ̯ t̪oɾ mɔcho bɔɽo ho͡ɪ̯che t̪ɐɾ?
385,mob t̪o chodoe̯ ɐche d̪ɐd̪ɐ।
386,t̪ɐ͡ɪ̯le ɐ͡ɪ̯ɟke kɐɾ bɐɽɪt̪o khɐ͡o̯wɐ d̪ɐ͡o̯wɐ?
387,ɐ͡ɪ̯ɟke t̪o t̪oɾe bɐɽɪt̪o।
388,moɾe bɐɽɪt̪o khɐ͡o̯wɐ d̪ɐ͡o̯wɐ?
389,kɪ khɐ͡ɪ̯ben?
390,ɟedɐ d̪ɛn।
391,bɔjlɐɾ muɾgɪ?
392,bɔjlɐɾ khɐn nɐ?
393,khɐ͡ɪ̯ t̪o।
394,"t̪ɐ͡ɪ̯le bɔjlɐɾeɾ, bɔjlɐɾ d̪ɪje"
395,kɐlɐ͡ɪ̯jeɾ dɐ͡ɪ̯l khɐn nɐ?
396,kɐlɐ͡ɪ̯jeɾ dɐ͡ɪ̯l khɐ͡ɪ̯ t̪o।
397,<> hɛ?
398,thɐkɾɪ kɐlɐ͡ɪ̯।
399,thɐkɾɪ kɐlɐ͡ɪ̯?
400,thɐkɾɪ kɐlɐ͡ɪ̯ ɐnɪʃ।
401,thɐkɾɪ kɐlɐ͡ɪ̯ ɐnɪm?
402,he he he he।
403,thɐkɾɪ kɐlɐ͡ɪ̯ d̪ɪje kɪ khɐ͡ɪ̯ben?
404,dɐ͡ɪ̯l?
405,thɐkɾɪ kɐlɐ͡ɪ̯ elɐ pɐ͡o̯wɐ ɟɐe̯?
406,pɐ͡o̯wɐ ɟɐe̯ nɐ?
407,"ɛŋkoɾ khɐn nɐ, ɛŋkoɾ?"
408,kɐ͡ɪ̯lke t̪o thɐkɾɪ kɐlɐ͡ɪ̯ eɾ dɐ͡ɪ̯l khɐchɪ।
409,ɛŋkoɾ kɪ dɐ͡ɪ̯l nojɐe̯?
410,dɐ͡ɪ̯l ho͡ɪ̯le͡o̯ ʃɐd̪ lɐge nɐ।
411,kɛ ʃɐd̪ lɐ͡ɪ̯gbeɾ nɔe̯?
412,ɛŋkɾeɾ dɐ͡ɪ̯l bole ʃɐd̪ lɐge nɐ!
413,hɐ hɐ!
414,"bɦɔɾt̪ɐ d̪ɪje khɪle͡ɪ̯m, bɦɔɾt̪ɐ।"
415,ho͡o̯o!
416,khɐbɐɾ nɔe̯?
417,bɦɔɾt̪ɐ khɐn nɐ?
418,"bɦɔɾt̪ɐ, dɐ͡ɪ̯l, ʃɐg, pɐthɐ ʃɐg।"
419,ɐɾ ʃɐg।
420,ne͡ɪ̯ʃ।
421,pɐt ʃɐg ɐnɪm?
422,pɐt ʃɐgeɾ ɟe d̪ɐm!
423,heho!
424,huh!
425,e͡ɪ̯ ɾɔmoɟɐn mɐʃe ɟe pɐt ʃɐgeɾ ɟe d̪ɐm!
426,ʃed̪ɪn phɪɾoɟ bejɐn nɪje ɐʃche t̪ɪɾɪʃ tekɐɾ pɐt ʃɐk।
427,t̪oɾ hɐɽɪɾ t̪ɔlɐt̪e poɽe nɐ।
428,pɐt̪eɾ mod̪d̪ee̯ ɐte nɐ <> he।
429,ɐɾ t̪u͡ɪ̯ pɐt ʃɐg ɐneɾ ko͡ɪ̯ʃ?
430,pɐt ʃɐk t̪oɾ mone koɾ elɐ?
431,"ʃɐɾ d̪ɪje ɪ͡u̯ɾɪje ʃɐɾ, pɔtɐʃ phoʃphet- e͡ɪ̯gole d̪ɪje ʃɐk t̪ole phɔle।"
432,he?
433,t̪u͡ɪ̯ ɐnd̪ɪbeɾ ɟɐbu।
434,ɟɐjɐ d̪ekbu ho͡ɪ̯lo ɪjeɾ t̪ɔlɐ͡o̯ poɽe nɐ।
435,e͡ɪ̯ ho͡ɪ̯lo ɔbost̪ɐ!
436,"ɪjɐ motɐmutɪ bɦɐloe̯ ho͡ɪ̯t̪eche nɐ, ɪpot̪ɐɾɪ?"
437,ʃɔmoʃʃɐ nɐ͡ɪ̯?
438,"t̪u͡ɪ̯ t̪o mone hɔe̯ tɛkɐ d̪ɪcɪʃ ote, ɪpot̪ɐɾɪɾ ɟonne kɔe̯ tɐkɐ d̪ɪcɪʃ, d̪u͡ɪ̯ʃo nɐ kɔe̯ tɐkɐ d̪ɪcɪʃ?"
439,d̪u͡ɪ̯ʃo d̪ɪco।
440,"o, d̪u͡ɪ̯ʃo tɛkɐ d̪ɪcɪʃ?"
441,t̪omɾɐ ɪpot̪ɐɾɪ kɔɾen nɐ?
442,kund̪ɪn?
443,ɪjd̪ɐ?
444,mu͡ɪ̯ tɛkɐ d̪ɪjɐ d̪ɪchuŋ ote।
445,d̪ɪchen?
446,kɔt̪o?
447,"mu͡ɪ̯ d̪u͡ɪ̯ʃo d̪ɪchuŋ ɐpɐt̪o, ɐɾɔ͡o̯ t̪ɪnʃo d̪e͡ɪ̯m ɐɾ kɪ।"
448,tɔtɐl pɐʃʃo tɐkɐ mɪl koɾɪ d̪e͡ɪ̯m।
449,oɾe mɔʃɐ gɐɽɪ d̪ɪle gɦɐ।
450,<> elɐ kɐ͡ɪ̯͡o̯ kɔt̪ɐ ʃone nɐ d̪ehɪ।
451,"moɾɪjomok k, moɾɪjom elɐ ɪjd̪ɐ koɾɪ d̪ɪbe।"
452,moɾɪjom ɐce nɐ?
453,"kɪɾe ɾɪŋku, kɛmon ɐchɪʃ?"
454,e͡ɪ̯ t̪o ɐchom mu͡ɪ̯ ɛk ɾɔkom ɐɾ kɪ।
455,t̪oɾ ʃɐt̪e kɪchukkhɔn gɔlpogucchɔb koɾɪm।
456,mobɐ͡ɪ̯lot̪ ɛkhonɐ ɾekɔɾdɔ͡o̯ koɾɪm।
457,t̪o t̪ɐt̪e kono ʃɔmoʃʃɐ ho͡ɪ̯be t̪oɾ?
458,t̪umɪ bond̪ɦu mɐnuʃ।
459,t̪umɪ cɐ͡ɪ̯le ɾekɔɾd keno ɐɾɔ͡o̯ ɔnnokɪcu͡o̯ koɾt̪e pɐɾo।
460,ʃetɐt̪e kono pɾɔbelem nɐ͡ɪ̯।
461,"t̪ɔe̯ ɐmɾɐ ɟe ɟɐjgɐtɐe̯ ɐcɪ, etɐ hocche ɐmɐd̪eɾ, nɐ, ʃe͡ɪ̯tɐe̯।"
462,ʃɾɪt̪ɪɾ ɛktɐ ɟɐjgɐ।
463,"nɐ, ʃetɐ thɪk ɐce, ɛkhon t̪ɐ͡ɪ̯le ɪjɐ, t̪oɾ nɐm t̪eɾ mu͡ɪ̯ ɟɐnoŋ, t̪u͡ɪ̯ t̪oɾ nɐmtɐ kɔ͡o̯ t̪o d̪ekhɔŋ, kɪ nɐm t̪eɾ?"
464,nɐm ɟud̪ɪ ɐbɐɾ not̪un koɾɪ kowɐ lɐge?
465,t̪ɐhole t̪o ʃɔmoʃʃɐ!
466,"nɐ, t̪obu enɐ kɔ͡o̯, ʃɔmoʃʃɐ kɪ?"
467,t̪oɾ nɐm t̪o mu͡ɪ̯ ɟɐnoŋ।
468,"emdɪ ɐkɪb khɐn ɐmɐɾ nɐm, ʃetɐ t̪o t̪umɪ ɟɐno, ho, ʃe͡ɪ̯tɐe̯।"
469,ɐmɐɾ nɐm khɐn।
470,"bɔjoʃ t̪hɐɾtɪ ɪjɐ, tujentɪ sɪks।"
471,tujentɪ sɪkʃo kɔt̪o ɐ͡ɪ̯ʃe?
472,chɐbbɪʃ।
473,chɐbbɪʃ bɔt̪ʃoɾ ho͡ɪ̯bɐɾ lɐgce elɐ?
474,"co͡ɪ̯lbɐɾ lɐgce, e͡ɪ̯tɐ ʃɐɾtɪphɪket bɔjoʃ, o।"
475,lɪgl ʃɐt̪ɐ͡ɪ̯ʃ।
476,"<> ehon ʃɐɾtɪphɪkettɐe̯ t̪o mɐnuʃ beʃɪ ʃo koɾe, o͡ɪ̯ɟonno o͡ɪ̯tɐ͡ɪ̯ bɔlɐ ucɪt̪o।"
477,"hɐmɾɐ ɟɔkon o͡ɪ̯ mɐtot̪ ɐcono, kɔt̪o ɐddɐ d̪ɪcono, kɔt̪o"
478,kɪ ʃɔmɐcɐɾ?
479,"ɐge ɐbɐʃɪk chɪlo, ɛkʃɐt̪e kɪ mɔɟɐ ho͡ɪ̯chɪlo, hum।"
480,t̪ɔkon nowɐkhɐlɪɾ ɐnɐwɐɾ ɐchɪlo।
481,t̪ɐ o͡ɪ̯glɐ kɪ ɐmɪ bɦulɪ gecɪ?
482,"o͡ɪ̯ cɛŋɽɐ-pɛŋɽɐgulɐ ʃɔhokɐɾe kɔt̪o ɐddɐ,kɪ ʃɔmɐcɐɾ, phutbɔl khelcɪno, hum, ɛkʃɐt̪e।"
483,"ɛpɐke ho͡ɪ̯lo, muʃlɪmeɾ ɛkpɐʃe"
484,"ɛpɐke ʃɪboɾ ɛkpɐʃe, d̪u͡ɪ̯pɐke d̪u͡ɪ̯zon, bɦɐg koɾɪjɐ khelɐ o͡ɪ̯ ɟe ʃɔkɐlbelɐ bɦoɾot̪ ʃukɾobɐɾ koɾɪ o͡ɪ̯llɐ khelɐ kɪ d̪ɦumce ho͡ɪ̯cɪl।"
485,t̪oɾ mone ɐce e͡ɪ̯gɔlɐ?
486,mone nɐ͡ɪ̯?
487,"<> mɐmɐɾ cɪtɪ t̪oɾ ɾɔmopuɾeɾ ɐchɪlo, kɪ kɔt̪ɐ mone ɐce nɐkɪ t̪oɾ d̪ekhɔŋ d̪u͡ɪ̯ ɛktɐ?"
488,"ɛkbɐɾe puɾɐnɐ ʃunbɪ, nɐ <> hɛ̃, k t̪u͡ɪ̯, t̪u͡ɪ̯ puɾɐnɐe̯ k d̪ekhɔŋ।"
489,"ɛkbɐɾe puɾɐnɐ, ɐmɪ t̪oɾ bɐɽɪt̪o beɽbɐɾ gecɪlɐm, hu, t̪ɔkon ɐmɪ chod, t̪u͡ɪ̯ ɛknɐ bɔɽo, ho, buɟcɪʃ?"
490,"ho, ho।"
491,"hɐp-pɛnt pɔɾɐ chɪlo, t̪o t̪u͡ɪ̯ ɐmɐk ko͡ɪ̯ʃ ɟe, bond̪ɦu, t̪ok t̪hu͡ɪ̯jɐ, nod̪ɪt̪o t̪ɔkon pɐnɪ beʃɪ, hɛ̃?"
492,"t̪ɔkon t̪u͡ɪ̯ ɐmɐk kɪ koɾcɪʃ, kolɔt̪o nɪjɐ nod̪ɪ pɔɽ koɾɪ d̪ɪcɪʃ।"
493,e͡ɪ̯pɐɽot̪।
494,"o͡ɪ̯ ɟe, ʃobuɟeɾ gɦɔɾe zete gɦɐʃ lɐgɐ͡ɪ̯ce nɐ?"
495,"hu,hu।"
496,o͡ɪ̯ pɔɽ pɔɟɔnt̪o pɔɽ koɾɪ d̪ɪcɪʃ।
497,"d̪ɪjɐ pɔɾe t̪u͡ɪ̯ bɛk d̪ɪjɐ cɔlɪ gecɪʃ, ɐmɪ pɔɾe bɐɽɪt̪o cɔlɪ ɐccɪ, ɐmɐɾ spʃto mone ɐce।"
498,ɐɾ kɪ ʃunbɪ k?
