id,string
2206,heno ɟɐ͡ɪ̯jɐ ʃund̪ɔɾe ko͡ɪ̯le d̪ɛlɐ͡ɪ̯bo।
2207,ɐɾ <> t̪u͡ɪ̯ ɟod̪ɪ ʃund̪ɔɾe buɟɐ͡ɪ̯jɐ ko͡ɪ̯t̪ɐɾcho ɟod̪ɪ।
2208,ʃund̪ɔɾe buɟɐ͡ɪ̯jɐ ko͡ɪ̯t̪ɐɾt̪ɐɾmɐ?
2209,ɐmɪ luc d̪ɪmo ɐmɐɾ।
2210,ʃɔnt̪ut ɔ͡ɪ̯jɐ ɟɐjgɐ t̪ɐɾ ɐge ɔ͡ɪ̯bo nɐ।<> d̪ɪt̪e ho͡ɪ̯bo tɛhɐ lɐge।
2211,d̪u͡ɪ̯ hɐɟɐɾ tɛhɐ monoe̯ lɐgbo।
2212,<> mɐl d̪ɪjɐ nɪce d̪ɪjɐ।
2213,"ɐɾ ɪjɐ, ʃɐɾ d̪uhɐneɾ bɦɐ͡ɪ̯ pɐɾtɪ ɔphɪʃe?"
2214,"he͡ɪ̯dɐt̪o kɔt̪hɐ, ɐmɪt̪o phɐ͡ɪ̯ nɐ gɪjɐ।"
2215,sɛɾɾe monoe̯ mɐ͡ɪ̯ɾɐ d̪ɪche nɐkɪ?
2216,<> nɐkɪ mɾɐɾ nodɪɾ fut̪ɐ͡ɪ̯net̪o mɐ͡ɪ̯ɾɐ d̪ee̯।
2217,"e͡o̯ e ko͡ɪ̯lo, e͡ɪ̯ɟe, ʃɐnɪ ko͡ɪ̯lo।"
2218,"kɪ kɔe̯, mɐ͡ɪ̯ɾɐ d̪ɪche?"
2219,kɔe̯ e͡o̯ e bule ʃɐɾ nɪchegɐ d̪u͡ɪ̯ bɔst̪ɐ।
2220,kɪ nɪche bule d̪u͡ɪ̯ bɔst̪ɐ।
2221,d̪u͡ɪ̯ bost̪ɐ ho͡ɪ̯ɾɐ kɪ nɪche?
2222,e͡ɪ̯ mɪɾɟpuɾeɾ ɛktɐ।
2223,ɟɐncho kɪmun?
2224,"t̪u͡ɪ̯n ɟemun ɐmɐɾe foɾɪchɔe̯ koɾɐ͡ɪ̯chɔcho, t̪ɔɾe bɐd̪ d̪ɪjɐge ɟeɾe ɐmɪ mɪlɪ. t̪u͡ɪ̯llɐlɐ͡ɪ̯।"
2225,"ɐmɪ ɐɾektɐɾe phoɾɪchɔe̯ koɾɐjchɪ, he͡ɪ̯dɐ bule ɔhon bɦen d̪ejɐ tɔmtɔm bo͡ɪ̯jɐ mɐl ne।"
2226,"ɟɔhon ɐmɪ t̪ɔɾe ɪjɐ ho͡ɪ̯ɾɐ d̪ɪchɪ, t̪u͡ɪ̯ luhɐjɐ luhɐjɐ kɐm ko͡ɪ̯ɾɐ।"
2227,"nɐ, lugɐjɐ kɪccu koɾchɪ nɐ।"
2228,"e͡ɪ̯dɐ nɐ ɐmɪ t̪ɔɾe buɟɐ͡ɪ̯lɐm ɐɾhɪ, ud̪ɐhɔɾon d̪ɪlɐm ɐɾhɪ।"
2229,behe͡ɪ̯ buɟɟɔʃ t̪u͡ɪ̯?
2230,e͡ɪ̯bɐ kɪnt̪u ɐʃole ɟɔgɔt̪o nɔst ɔe̯।
2231,elɐ͡ɪ̯ggɐ mɐ͡ɪ̯nʃe ke͡u̯ ke͡u̯ɾe kunu kɪchu phoɾɪcɔe̯ koɾɐe̯ nɐ।
2232,"phɔɾe he ɐmɐɾe phun tun nɐ ko͡ɪ̯ɾɐ , phun ko͡ɪ̯ɾɐ nɐ he gɪjɐ mɐl t̪ult̪ɐche, ʃɔbkɪchu oke"
2233,bɔst̪ɐ bɔst̪ɐ<> nɪche d̪u͡ɪ̯ bɔst̪ɐ nɐ ɛk bɔst̪ɐ ɪjɐ nɪche।
2234,kelɐ kelɐ?
2235,e͡ɪ̯ t̪o͡u̯hɪd̪ bɦɐ͡ɪ̯।
2236,"t̪u͡ɪ̯ ɪ t̪o phoɾɪcɔe̯ kɔɾɐjɐ d̪ɪchɔle, nɐ?"
2237,"chɐ͡ɪ̯nnɐ heɾɐ mɪstɪ khɐe̯, he golɐ nɪche bɐɟed̪ɪjɐ heɾɐ golɐ khɐe̯, ɐmɐɾe ɛktɐ golɐ͡o̯ khɐjɐ͡ɪ̯lɐnɐ sɛɾe।"
2238,phɔɾe heɾɐ khɐlɪ t̪oɾmuɟ khɐ͡o̯wɐ͡ɪ̯che।
2239,ʃɐmne d̪e͡ɪ̯kkhɐ
2240,"ʃɐmne͡ɪ̯t̪o, ɐmɐɾ ʃɐmne͡ɪ̯t̪o golɐ ɐ͡ɪ̯nnɐ d̪ɪche।"
2241,ɐmɪt̪o ɟɐnɪ golɐ ɐ͡ɪ̯nnɐ d̪ɪche।
2242,"ɟeɾe chɐ͡ɪ̯nnɐ khɐ͡ɪ̯che, chɐ͡ɪ̯nnɐ bɐd̪e ɐmɐɾe mɛʃeɟ d̪e͡ɪ̯jɐ ɟɪgɐe̯ k kemun gollɐ khɐ͡ɪ̯lɐ?"
2243,t̪oɾmuɟ kemun khɐ͡ɪ̯lɐ?
2244,kɔe̯ bɦu͡ɪ̯t̪t̪ɐmɐɾɐ t̪oɾmuɟ d̪ekhchɪ।
2245,eʃ ɐ͡ɪ̯ gɦuʃ khɐ।
2246,eʃ ɐ͡ɪ̯ gɦuʃ khɐe̯।
2247,he͡ɪ̯d̪ugɐ ʃuɟɔn sɛɾeɾɐ lɐgchɪn kɐ͡ɪ̯ɟɛ।
2248,t̪u͡ɪ̯ ɐchole?
2249,nɐ phɔɾe ɐ͡ɪ̯chɔcho?
2250,"ɐmɪ phɔɾchɪ mɐ͡ɪ̯d̪d̪e phɔɾchɪ bɪphd̪o, d̪unuɟonɪt̪o bɐlɐ luk, ɐmɐɾ ʃɐmne।"
2251,"bɛnɐɾ tɐŋgɐnɪ lɔjɐ, nɐ?"
2252,bɛnɐɾ tɐŋgɐnɪ lɔjɐ nɐ।
2253,<> mɐ͡ɪ̯ɾɐ d̪ɪche ɐmɐɾ mone k।
2254,"tenɪŋot̪o ɔ͡ɪ̯lo nɐ bɐl, ɐ͡ɪ̯ɾɐ d̪ɪche।"
2255,ʃɔb mɐ͡ɪ̯ɾɐ d̪ɪche।
2256,"cɐjnɐ lokeɾɐ hɔmɐn kɐd ne, he͡ɪ̯ bɔld̪ ɛt̪ɐne kɪʃʃo nɐ?"
2257,et̪ɐne hɔmɐne tenɪŋ ɔe̯ nɐm।
2258,kɔjdɐ kɪʃke tenɪŋo nɐm nɪɟeɾ d̪ehcho nɐ?
2259,ʃɔb e͡ɪ̯ net̪ɐ mɛt̪ɐ chɐt̪t̪olɪgeɾ-e͡ɪ̯t̪t̪ɐ͡ɪ̯ t̪o nɪchegɐ।
2260,"chɐjɐ͡o̯ kɐjɐ, kɐm nɐ͡ɪ̯।"
2261,"bond̪ubɐnd̪ob <> bond̪ubɐnd̪ob, e͡ɪ̯ chɐt̪t̪olɪgeɾ net̪ɐ <> e͡ɪ̯bɐ net̪ɐmɐt̪e kɐjɐlce।"
2262,ɛkʃo tehɐ <> d̪ejɐ d̪ekgɐ pho͡ɪ̯ncɐʃ ɟɔn nɪ eno ɪjɐ ɐche।
2263,bɪʃ ɟɔn phɐ͡ɪ̯be t̪u͡ɪ̯ bɪchchɐjɐ?
2264,ʃɐccɐ kɪʃk।
2265,"ɟɐɾɐ ʃɐccɐ kɪʃʃɐk, eɾɐ t̪o ɟɐe̯ nɐ।"
2266,eɾɐɾe ne nɐ।
2267,"mɐmu, khɐlu, chɐchu, mɛt̪ɐ, phet̪ɐ, khet̪ɐ <> ʃuhɐg mɐstɔɾɾe ko͡ɪ̯chɪ pe͡ɪ̯ɟ khulɐɾ lɐ͡ɪ̯ggɐ।"
2268,pe͡ɪ̯ɟ?
2269,kun ʃuhɐg?
2270,ɐɾe e͡ɪ̯ ʃuhɐg।
2271,ɐe̯ hɐj।
2272,"ɐpnɐɾɐ d̪ekht̪e pɐcchen, t̪ɔbe ɐmɪ ko͡ɪ̯chɪ, ɐ͡ɪ̯ne t̪o ɔhon, nɐ͡ɪ̯n mɐ͡ɪ̯nʃe t̪o nɐ͡ɪ̯nt̪ɐ ko͡ɪ̯bo!"
2273,ɐ͡u̯ɟɟɐ phulɐphɐnɾe e͡ɪ̯ɟe gɐcho udɐjɐm gɐb gɐcho।
2274,phutkɪ d̪ɪjɐ thelɐ d̪ɪjɐ d̪ɪjɐ।
2275,ɐmɐɾ bɦɪdɪ͡o̯ kɪ ʃund̪ɔɾ?
2276,t̪oɾɐɾ t̪o kon lɐ͡ɪ̯k kɔment phɐ͡ɪ̯nɐ ɟɪbone।
2277,"ɐmɐɾ kon bond̪ɦu bɐnd̪ɦob ko͡ɪ̯lɐm ɐmɐɾe ʃɐphɐɾt koɾche nɐ, e͡ɪ̯dɐ ʃot̪t̪o!"
2278,"nɐ͡ɪ̯m t̪u͡ɪ̯n ɐbɐɾ ɾɐg ɔ͡ɪ̯ʃ nɐ bɦɐ͡ɪ̯, ɐmɐɾ ɐmɐɾ ɐmɐɾ ɐmɐɾ kɔt̪hɐ t̪u͡ɪ̯n, ɐ͡ɪ̯cchɐ t̪ɔɾ bɐd̪d̪e, t̪u͡ɪ̯n nɪɟe͡ɪ̯, ɐmɐɾ kun bond̪ɦud̪ɦud̪"
2279,keɾe ɐmɪ t̪ɔɾe kɔment koɾɪ nɐ?
2280,"kɔment kɔɾɐ, ɐ͡ɪ̯cchɐ kɔment t̪u͡ɪ̯n ɐmɐɾ koɾsɔʃ nɐ, <> kɔment kɔɾʃ, ɐ͡ɪ̯cchɐ kɔment t̪o bɪʃɔe̯ nɐ।"
2281,ɐmɐɾ kɐment koɾt̪e͡ɪ̯ ɔ͡ɪ̯bo e͡ɪ̯dɐ kɪ chobɪ ɟe kɐment koɾle ɐmɐɾ lɐbɦ ɔ͡ɪ̯t̪ɐche?
2282,nɐh ɔhon ɐɾ kɪ hɔɾt̪ɐm t̪u͡ɪ̯n k।
2283,t̪ɔɾe ɐɾ kɪ hɔɾt̪ɐm?
2284,ɔhont̪o ɐmɪ ko͡ɪ̯chɪ d̪e͡ɪ̯kkhɐ ɾɐg koɾɪʃ nɐ।
2285,nɐ k kɪ hɔɾt̪ɐm k।
2286,ɐɾ kun bond̪ɦu ɐmɐɾe helpo koɾche kɔchen?
2287,t̪ɔɾe kɪbɐ helpo koɾt̪ɐm e͡ɪ̯dɐ ko͡ɪ̯be ɟe ebɦɐbe ɐmɐɾe helpo koɾlo nɐ!
2288,ɪskule kunu bond̪ɦu ɐmɐɾe helpo koɾche nɐ।
2289,nɐ kɪbɐ helpo koɾt̪o ko͡ɪ̯be ɐchet̪o ɟe e͡ɪ̯bɦɐbe ɐmɐɾe helpo koɾlo nɐ।
2290,"helot̪o ɔnek bɦɐbe kɔɾɐ ɟɐe̯, ɔhon t̪u͡ɪ̯ kɪbɦɐbe cɐ͡ɪ̯t̪ɐchɔʃ ɟe, ɐmɪ t̪o kunubɦɐbe helo pɐ͡ɪ̯chɪ nɐ!"
2291,"t̪ɔɾe ut̪oʃɐh d̪ɪche nɐ, ʃɐʃɾɐ͡ɪ̯b koɾche nɐ cɛnel?"
2292,kelɐ ʃɐbʃɾɐ͡ɪ̯b koɾche?
2293,"ɐmɪ koɾchɪ, ʃɐd̪d̪ɐ͡ɪ̯mɛ koɾche।"
2294,"hu ʃɐd̪d̪ɐ͡ɪ̯mɛ koɾche, ɐnt̪ɐɟɪ koɾche।"
2295,"e koɾche, he koɾche, eɾɐkɪ ke͡u̯ ɪ koɾche nɐ?"
2296,"kelɐ koɾche, ʃɐd̪d̪ɐ͡ɪ̯mɛ ko͡ɪ̯ kelɐ koɾche ɐmɐɾe d̪ehɐ।"
2297,"t̪u͡ɪ̯n o koɾʃ nɐkɪ ʃɔnd̪eho bɦɐ͡ɪ̯, <> ɟɐh"
2298,"ɔhone͡ɪ̯ ɐnʃɐʃɐ͡ɪ̯b ko͡ɪ̯ɾɐ d̪ɛm, ɐnʃɐʃɐ͡ɪ̯b koɾɪcho nɐ।"
2299,e͡ɪ̯d̪ɐɾ lɐ͡ɪ̯ggɐ nɐ।
2300,ʃɐʃkɐ͡ɪ̯b koɾchɔʃ nɐkt̪ɐ ɐmɪ ɟɐnɪ?
2301,e͡ɪ̯ kɔmen nɐ koɾle ɐmɪ buɟd̪ɐm nɐ t̪u͡ɪ̯ ɐmɐɾe ʃɐʃkɐ͡ɪ̯b koɾchɔʃ nɐ ɐnʃɐʃkɐ͡ɪ̯b koɾchɔʃ?
2302,e͡ɪ̯ ɐɾɐphɐt̪e ɛktɐ ʃɐmne d̪ɪjɐ bohe।
2303,"e͡ɪ̯ ʃɐphut kɔɾɐ, nɐ?"
2304,"kɪɾe t̪ɪt̪ɪ, ehon ɔt̪o ɾɐt̪ e͡ɪ̯che, gumɐch nɐ?"
2305,"kɐɾentɪ t̪o nɐ͡ɪ̯gɐ, gumɐjɐm kemne?"
2306,kɐɾent ɐ͡ɪ̯bo kun ɾɐ͡ɪ̯t̪e।
2307,t̪ɪntɐ bɐɟe।
2308,t̪ɪntɐ co͡u̯d̪d̪o।
2309,ɐjhɐe̯!
2310,ɔnek ɾɐt̪ ɔ͡ɪ̯jɐ geche।
2311,ɐʃole͡o̯ be͡ɪ̯ɟɟɐ ɾɐ͡ɪ̯t̪o ɔ͡ɪ̯jɐ phɔɾche।
2312,ɔt̪o ɾɐ͡ɪ̯t̪e d̪ekhchɔʃ kɐɾenteɾ bɐ͡ɪ̯ccɐ ɐje nɐ?
2313,<> khɪd̪ɐ lɐgche?
2314,ɔnek khɪd̪ɐ lɐgɟe।
2315,ɐe̯ kɪchu ɛktɐ ɾɐ͡ɪ̯nd̪ɐ khɐ͡ɪ̯।
2316,e͡ɪ̯ ɾɐ͡ɪ̯t̪eɾ belɐ?
2317,kɪ khɐ͡ɪ̯be?
2318,"phɐst̪ɐ bɐnɐ͡ɪ̯bɐm, ɐɾ kɪt̪ɐ।"
2319,ɐɾ kɪ bɐnɐnɪ ɟɐe̯?
2320,ɐcchɐ ɐcchɐ e͡ɪ̯ ɾɐt̪ɾe kɪ t̪ɔɾɐ phɐgol ɔ͡ɪ̯choʃ pɐst̪ɐ bɐnɐ͡ɪ̯be ɐbɐɾ lɔge।
2321,d̪ud̪ɦ ɐche?
2322,guɽɐ d̪ud̪ɦ?
2323,ɐe̯ cɐ bɐnɐ͡ɪ̯।
2324,ho cɐ khɐ͡ɪ̯।
2325,cɐ khɐ͡ɪ̯le t̪o ɐbɐɾ gɦum ɐ͡ɪ̯t̪o nɐ।
2326,ho ɟe ɔbost̪ɐ।
2327,ɔboʃʃo <> ɐ͡ɪ̯ccɐ buɟlɐm nɐ ʃeheɾɪɾ tɐ͡ɪ̯me͡o̯ kɐɾent d̪ee̯ nɐ e͡ɪ̯dɐ kɪ phɐgol chɐgol nɐkɪ।
2328,ɐmɪ͡o̯ buɟɪ nɐ।
2329,"ʃeheɾɪɾ tɐ͡ɪ̯me, ɔhon t̪o mɐne t̪ɪntɐ pɔneɾo bɐɟe, k?"
2330,ehon ʃeheɾɪɾ tɐ͡ɪ̯me ehon t̪o kɐɾent d̪e͡o̯wɐ ucɪt̪o।
2331,kɐloke ʃɐɽɪ phoɾbɪ?
2332,pɔhelɐ bo͡ɪ̯ʃɐkh t̪o kɐloke।
2333,ʃɐɽɪ phɔɾbɐm chɪnt̪ɐ hɔɾot̪ɐchɪ d̪ehɪ kɪ kɔɾon ɟɐe̯।
2334,ɐmɪ͡o̯ phɔɾbɐm।
2335,ʃɐɽɪ ɐche?
2336,ho ɐchɪn t̪o d̪u͡ɪ̯dɐ।
2337,ɪjɐ ɔ͡ɪ̯bo lɐl ʃɐd̪ɐ kɪ d̪u͡ɪ̯dɐ ʃɐɽɪ?
2338,ho d̪u͡ɪ̯dɐ͡ɪ̯ ʃɐɽɪ।
2339,t̪ɐ͡ɪ̯le phɔɾe d̪u͡ɪ̯dɐ͡ɪ̯ t̪o t̪umɪ ɐɾ
2340,"puɟɐe̯ d̪ɪ phoɾt̪ɐɾbɐ, ɐmɪ kɪ phoɾɐm?"
2341,t̪ɔɾ phɔɾon lɐgd̪d̪o nɐ।
2342,t̪u͡ɪ̯ d̪u͡ɪ̯d̪ɪn phɔɾe phɔɾcho ɐjɐ।
2343,"ɐmɪ phɔɾbɐm, t̪ɔɾ kɪ ʃɔmoʃʃɐ?"
2344,ɐmɐɾ chudu mɐmɪɾ blɐ͡u̯ɟ lɐgbo।
2345,t̪ɐ͡ɪ̯le phoɾʃɪɾe phoɾɐ͡ɪ̯t̪ɐm nɐ।
2346,"ko͡ɪ̯jɐmne foɾʃɪ, foɾe foɾɪcho <> foɾʃɪ ɟɐ͡ɪ̯bogɐ ʃɔhɐl ɐttɐ।"
2347,"phoɾʃɪ emne͡o̯ ʃɔhɐle ɟɐ͡ɪ̯bogɐ, d̪ehɪcho ʃɐɽɪ phoɾt̪o nɐ।"
2348,"ho, ɐmɐɾo e͡ɪ̯dɐ͡ɪ̯ mono ɔe̯।"
2349,"nɐ koɾche, ɐɾ phɔɾon lɐgd̪o nɐ ʃɐɽɪ।"
2350,phɔɾon lɐgd̪o nɐ।
2351,e d̪ekbɐ gumt̪e͡ɪ̯ utht̪o nɐ।
2352,ɐbɐɾ gɐneɾ lɐ͡ɪ̯ggɐ utttɐ phɔɾt̪ɐɾe?
2353,ho gɐn ɐchɪn t̪o kɐloke phoɾʃɪɾ ɐbɐɾ।
2354,"ɪjeɾ mo͡ɪ̯d̪d̪e, kɔleɟeɾ mɐdo।"
2355,upoɟelɐɾ mo͡ɪ̯d̪d̪e͡o̯ gɐn gɐ͡ɪ̯bo।
2356,"upoɟelɐt̪o gɐn, ɔnek ɟɐgɐt̪ onuʃtɐn kɐloke।"
2357,upoɟelɐt̪ ɔnʃtɐn ɔ͡ɪ̯bo kɐloke?
2358,"ho, upoɟelɐt̪ ɛkek ʃɐt̪ɪt̪o d̪ɪbo, phɔɾe ɪskuleɾ mo͡ɪ̯d̪d̪e ɟɐ͡ɪ̯bo।"
2359,gɐ͡ɪ̯bo ɔ͡ɪ̯t̪ɐche ʃɔbɐ͡ɪ̯ mɪ͡ɪ̯llɐ।
2360,hum।
2361,kɔt̪o cheɽɪdɐɾo kɔt̪o khɐlɪ gɐn gɐ͡o̯n lɐge।
2362,"ho, gɐn poɽʃɪ ko͡ɪ̯t̪ɐche, kɪ gɐn gɐ͡ɪ̯bo?"
2363,eʃo he bo͡ɪ̯ʃɐkh e͡ɪ̯dɐ?
2364,ho e͡ɪ̯dɐ͡ɪ̯t̪t̪o?
2365,eʃo he bo͡ɪ̯ʃɐkhe͡ɪ̯t̪t̪o।
2366,"phoɾʃud̪ɪn ko͡ɪ̯t̪ɐche, gɐn ʃɪ͡ɪ̯kkhɐ͡o̯ ɟɐlɐ e͡ɪ̯che khɐlɪ gɐn gɐ͡o̯n lɐge।"
2367,"।ɐʃole͡ɪ̯ɾe, ɐʃole͡ɪ̯।"
2368,e e͡ɪ̯ mejedɐɾe kɪ gɐn ʃɪhɐe̯?
2369,kun mejedɐ?
2370,e͡ɪ̯ɟe e͡ɪ̯ɟe <> cheɽɪ।
2371,ho ho e͡ɪ̯ cheɽɪɾe͡o̯ gɐn ʃɪhɐe̯
2372,kɔt̪o tehɐ d̪ee̯?
2373,tehɐ d̪ee̯?
2374,mɐ ʃɪhɐe̯।
2375,omɐ!
2376,phoɾʃɪɾe ɐɟke ko͡ɪ̯t̪ɐchɪ mɐʃɪ phɔɽɐ kɪ?
2377,kɔe̯ edɪ͡ɪ̯ phɔɽɐe̯।
2378,ɐmɪ ko͡ɪ̯ omɐjɐ gɐneɾ mɔd̪d̪e phɔɽɐ͡o̯ ɐche?
2379,phoɾʃɪ k t̪e ɐchenɐ?
2380,tehɐ d̪e nɐ kɪllɐ͡ɪ̯ggɐt̪ekɪ?
2381,de͡ɪ̯lɪ ɐje nɐkɪ?
2382,ho phɔt̪t̪ed̪d̪ɪnɪ d̪ehɪ bule ɐje।
2383,"oɾe bɐbɐɾe, ʃɪhɐe̯, <> heɾe kɪ mɐstɐɾ d̪ɪche nɐ?"
2384,nɐ mɐstɐɾ d̪ɪche nɐ।
2385,oɾe bɐbɐ!
2386,t̪e mɐgonɐ kɪllɐ͡ɪ̯ggɐ।
2387,t̪e t̪o phoɾʃɪɾte kɪt̪ɐ tehɐ d̪ɪbɐ?
2388,kelɐ͡ɪ̯ggɐ d̪ɪt̪o nɐ?
2389,phoɾʃɪ t̪o gɐneɾ ɟɔgɔt̪eɾ mɐstɐɾɪ।
2390,phoɾʃɪɾte tehɐ d̪ɪt̪ɐɾe।
2391,phoɾʃɪ t̪o gɐneɾ ɟɔgɔt̪eɾ pɾo ɪ।
2392,heɾe d̪ɪle kɪ ʃɔmoʃʃɐ?
2393,ɐɾ phoɾʃɪɾe tehɐ d̪ɪle͡o̯ mɐmɪ <> d̪ɪbo?
2394,e͡ɪ̯t̪ɐ͡ɪ̯t̪t̪o kɔt̪ɐ।
2395,d̪ɪle͡ɪ̯ kɪ ɐmɾɐ lɔ͡ɪ̯jɐm?
2396,e͡ɪ̯dɐ͡ɪ̯t̪t̪o।
2397,ɐ͡ɪ̯ccɐ d̪ehɐ ɟɐ͡u̯k।
2398,phɔɾʃɪɾe tehɐ d̪ɪle phɔɾʃɪ ʃund̪ɔɾ ho͡ɪ̯ɾɐ edɪ bɛŋko ɟɔmɐjɐ ɐɾektɐ bɐɽɪ bɐnɐjɐlbo।
2399,"ho, ɐʃole͡ɪ̯।"
2400,e͡ɪ̯dɐ ɟe!
2401,edɐ kɪptɐ!
2402,emun kɪptɐ nɐ!
2403,ɐmɐɾe͡ɪ̯ t̪o t̪ɐɾ beʃɪ ɟɐnuneɾ kɔt̪ɐ।
2404,cheheɾɪ khɐ͡o̯neɾ lɐ͡ɪ̯gkɐ dɐkt̪ɐche ɔhono kɐɾen d̪ɛjnɐ।
2405,ɐʃole͡ɪ̯ mɐne cheheɾɪɾ tɐ͡ɪ̯me geche ɔhono kɐɾen d̪ɛjnɐ।
2406,edɐ bɐtphɐɾɪ ʃuɾu koɾche।
2407,bɪl d̪ɪ͡o̯nɐ ɟe।
2408,ɐʃole͡ɪ̯ bɪl d̪ɪt̪ɐm nɐ sɐlɐɾe।
2409,kunu bɪl d̪e͡o̯wɐ͡ɪ̯ uchɪt̪o nɐ।
2410,t̪ɾɪʃɐl t̪o kɐɾent ɛmon ɛmon ʃɔmɔe̯ ɟɐe̯।
2411,ɟɔhon t̪u͡ɪ̯ gɦumɐ͡ɪ̯t̪e ɟɐ͡ɪ̯be t̪ɔhon kɐɾent ɟɐ͡ɪ̯bo।
2412,ɟɔhon t̪u͡ɪ̯ chɐndɐ ko͡ɪ̯ɾɐ ɐ͡ɪ̯be t̪ɔhon kɐɾent ɟɐ͡ɪ̯bogɐ।
2413,ɟɔhon khɐ͡ɪ̯t̪e bo͡ɪ̯be t̪ɔhon kɐɾent ɟɐ͡ɪ̯bo।
2414,ɪʃ e͡ɪ̯t̪ɐ koɾle bɪɾokt̪o lɐge।
2415,"e, e͡ɪ̯ɟe ʃɔmɔe̯ tɐ͡ɪ̯mɪŋdɐ ektu ɟɔgɦonno।"
2416,<> khɐ͡o̯neɾ ʃɔmɔe̯ kɐɾent gele ɐmɐɾ pɾod̪d meɟɐcho khɐɾɐp ɔe̯।
2417,"ɐɾ khɐ͡o̯neɾ ʃɔmɔe̯ ɟɔhon kɐɾent t̪hɐje nɐ, t̪ɔhon ɐmɾɐɾ eno ɟɔlo t̪hɐhe nɐ mɐne।"
2418,"ɐmɾɐɾ mɔtoɾ d̪u͡ɪ̯ gɔntɐ, t̪o gɔntɐ phɔɾe, phɔɾe chɐɽun lɐge।"
2419,ɟehet̪ ɔhone ɔnek mɐnuʃ nɐ?
2420,"ho, ɔnek mɐnuʃ t̪o।"
2421,ɔneke͡ɪ̯ ɪ͡u̯ɟ koɾe।
2422,ɟɔl t̪hɐhe nɐ।
2423,"khɐ͡o̯neɾ fɐt̪eɾ mɔd̪d̪e tuk, tuk phɔɾle kɪccu d̪ehɪnɐ kɐɾent gelegɐ hud̪ɐ͡ɪ̯ ɾɐg ude।"
2424,ɔh ɐ͡ɪ̯cchɐ he͡ɪ̯d̪ɪn kɪ e͡ɪ̯che ɟɐncho?
2425,"he͡ɪ̯d̪ɪn kɪ e͡ɪ̯che ɪje bɔŋgobond̪ɦu hleɾ mɔd̪d̪e mɐne ɐmɾɐɾ ɪjeɾ hɔleɾ mɔd̪d̪e lɐl ʃɐg, lɐl ʃɐgeɾ mɔd̪d̪ɦe ɪ phɐ͡ɪ̯che।"
2426,lɐl ʃɐgeɾ mɔd̪d̪e kɪɾɐ t̪hɐhe nɐ?
2427,"ʃɐgeɾ mɔd̪d̪e d̪ekbɪ beʃɪ beʃɪ kɪɾɐ t̪hɐhe hum, hum।"
2428,lɐl ʃɐgeɾ kɪɾɐ phɐ͡ɪ̯che।
2429,phɔɾe ɐnd̪olɔn koɾche nɐ?
2430,"ɐmɐɾ nɐ ʃɐg ɟɪnɪʃtɐ bɐ͡ɪ̯ɾe khɐ͡ɪ̯le kɛlle͡ɪ̯gkɐ ɟɐnɪ gɦɪnnɐ, ellɐ͡ɪ̯gkɐ gɦɪnnɐ lɐge buɟɦchocho?"
2431,ɐmɐɾ ʃɔb kɪchu͡ɪ̯ gɦɪnnɐ lɐge।
2432,phɔɾe ɐnd̪olɔn cɔlche nɐ?
2433,ɐɾeho eɾɐ e͡ɪ̯t̪ɐ lɔ͡ɪ̯jɐ ɐnd̪olɔn koɾbo?
2434,hleɾ khɐ͡o̯n lɔ͡ɪ̯jɐ ʃɔb ɟɐgɐt̪e͡ɪ̯ kɔmpɾe͡ɪ̯n।
2435,t̪o kɪ ʃɐd̪ ɔe̯ nɐ?
2436,ʃɐd̪ t̪o thɪhɪ ɔe̯।
2437,"ʃɐd̪ tɐ, ɐʃole͡ɪ̯ kuno dɪphɐɾencho phɐ͡ɪ̯ nɐ।"
2438,ʃɐd̪ t̪o thɪhɪ lɐge।
2439,ɐmɐɾe buɟɦchocho?
2440,"ɐmɐɾ, ɐmɐɾ ɾum met ɾɐ͡ɪ̯nd̪ɐ d̪ɪchɪn ɪ kujɐ͡ɪ̯ mɐcheɾ t̪ɔɾkɐɾɪ buɟɦchocho?"
2441,ko͡ɪ̯che ɟe ɐpu ɐɟke ɾɐt̪ɾe ɐmɪ ɾɐnbɐm।
2442,ɐphone ɐmɐɾ lɔge khɐ͡ɪ̯bɐ͡ɪ̯n।
2443,ɐmɪ ko͡ɪ̯chɪ ɐ͡ɪ̯cchɐ thɪkɐche।
2444,d̪ɪche phɔɾe t̪o ɐɾ phɐlɐ͡ɪ̯jɐ d̪ɪ͡o̯n ɟɐe̯ nɐ।
2445,ɐmɐɾ ɔboʃʃo khɐbɐɾ nɪjɐ ɔt̪o khut̪okhɪt̪ɐnɪ ɔjnɐ।
2446,ɔhone khɐbɐɾ bɐlo nɐ ɛ͡ɪ̯le͡o̯ ɐmɪ khɐ͡ɪ̯jɐlt̪ɐɾɪ buɟɦchocho?
2447,ko͡ɪ̯ ɟɐ͡ɪ̯t̪ɐn?
2448,ko͡ɪ̯ ɟɐ͡ɪ̯t̪eɾ hɐ͡ɪ̯ɾe?
2449,d̪ɪjɐphɐɾɐ।
2450,d̪ɪjɐphɐɾɐ t̪o ʃɐmone͡ɪ̯।
2451,ɔ͡ɪ̯nd̪ɪjɐ ɔtu ɟɐe̯।
2452,dɐ͡ɪ̯ɾek ɔtu ɟɐe̯।
2453,hɛ̃ sɐ͡ɪ̯hel lɔ͡ɪ̯jɐ ɟɐ͡ɪ̯jɐm gɐ।
2454,ho sɐ͡ɪ̯hel lɔ͡ɪ̯jɐ ɟɐmu।
2455,sɐ͡ɪ̯hel d̪ɪjɐ t̪o ɔtut̪e t̪o।
2456,sɐ͡ɪ̯hel lɔ͡ɪ̯jɐ।
2457,kɪ ʃɔmpɾut̪o nɐ ɔd̪d̪ektɐ?
2458,e͡ɪ̯t̪ɐ ko͡ɪ̯t̪ɐɾt̪ɐm nɐ।
2459,ɟɪphu ɐ͡ɪ̯che nɐ ɔhono?
2460,d̪uɾu ɔt̪hɔbɐɾ t̪o uphɐʃ।
2461,ɐ͡ɪ̯lo nɐ।
2462,e͡ɪ̯ bɐɽɪ dɐ gɔfɔɾ gɐ̃o?
2463,ɐɾ e͡ɪ̯ e͡ɪ̯ cɔɽ phuɾɐdɐ bɐhɐd̪ɪjɐ।
2464,phuɾɐdɐ nɐ।
2465,ɔd̪d̪ɦektɐ?
2466,ɔd̪d̪ɦektɐ।
2467,ɐɾ e͡ɪ̯ ɪjɐ e͡ɪ̯hɐn kɪ?
2468,e͡ɪ̯ne bɐ͡ɪ̯d̪d̪ɐ phɔɾche nɐ?
2469,e͡ɪ̯ne ɪ mɔnoɟɪg t̪ulche nɐkɪ bɐ͡ɪ̯d̪d̪ɐ?
2470,e͡ɪ̯ ɟɐgɐt̪ ɟe ɔhone ɟeno khɐɾɐ͡ɪ̯jɐ ɐchu͡ɪ̯n।
2471,bɐ͡ɪ̯d̪d̪ɐ।
2472,eno bɐ͡ɪ̯d̪d̪ɐ e͡ɪ̯che?
2473,e͡ɪ̯ bɐ͡ɪ̯d̪d̪ɐ ʃɛʃ bɐnɐno nɐ pɾot̪om?
2474,bɐ͡ɪ̯d̪d̪ɐ ʃɛʃ d̪ɪ bɐnɐnɪ t̪o।
2475,bɐ͡ɪ̯͡e̯͡o̯ ʃɛʃ ʃɔmɔe̯ monoe̯ nɐ?
2476,phɔɾe ɔ͡ɪ̯lo mud̪ɪɾt̪e।
2477,"ho, mud̪ɪɾ t̪u͡ɪ̯ kohɐnnɪ?"
2478,e͡ɪ̯ tɐ͡o̯wɐɾ phɐɾ ɛ͡ɪ̯le nɐ?
2479,"ɪjɔ͡o̯, mɐch gɐŋg mɐch kemun ude।"
2480,ɾɐkɪb bɦɐ͡ɪ̯jeɾ kɪ ɔbost̪hɐ?
2481,phɐbele t̪o ɐ͡u̯ɟɟɐ sɛlɐɾɪ phɐ͡ɪ̯che।
2482,phɐbe͡ɪ̯llɐ ɔ͡ɪ̯nnohɐno hɛe̯ ɛktɐ phun d̪ɪlo nɐ।
2483,ɔhon kɪ bɪd̪eʃ ɟɐ͡ɪ̯bɐ nɐkɪ?
2484,muʃɐɾɔph।
2485,phɐbe͡ɪ̯llɐɾe ɟɐ͡ɪ̯jɐ k phɐbe͡ɪ̯llɐ ɛkd̪ɪn ɛktɐ phun o d̪ɪlo nɐ।
2486,t̪ɔɾo khɐlɪ phun d̪echo।
2487,ɐ͡ɪ̯cchɐ phɐɾd̪ɪn t̪ɔɾe phun d̪ee̯।
2488,phɐbe͡ɪ̯llɐ t̪o bond̪ɦu।
2489,ɐmɐɾe e͡ɪ̯k d̪ɪne ɛktɐ phun d̪ɪlo nɐ।
2490,t̪e ɐmɐɾ phun d̪ee̯?
2491,ɐmɐɾ kɪ ɔphɔɾɐd̪ koɾlɐm k?
2492,bɪd̪eʃ ɟɐ͡o̯͡u̯jɐɾ phɔɾo
2493,"konɟuʃ, phuɾɐ t̪oɾ mɔt̪।"
2494,hɪ।
2495,"mɐne ɛktɐ tehɐ bɦɐŋt̪o nɐ ʃe, ɪ koɾt̪o nɐ।"
2496,kɪptɐmɪ ko͡ɪ̯ɾɐ͡ɪ̯ ɐʃole bɔɽolok ɔ͡ɪ̯be।
2497,buɟɟo mɔlcɐ ʃɐk e͡ɪ̯che।
2498,mɔlcɐ ʃɐk t̪ulbe?
2499,ho kɐloke ʃɔhɐle t̪ulbɐm।
2500,kɐloke t̪ulɪʃ kotɪ?
2501,"phɔɾe emnɪt̪e͡o̯ nɪɾɐmɪʃ ɪ khɐ͡ɪ̯t̪ɐchɪ, phɔɾe mɔlcɐ ʃɐk t̪u͡ɪ̯llɐ।"
2502,kɪ ʃɐk?
2503,mɔlcɐ ʃɐk।
2504,edɪ kɛmone khɐe̯?
2505,"bɔɽɐ bɐnɐjɐ khɐ͡o̯n ɟɐe̯, ʃɐk ɾɐ͡ɪ̯nd̪ɦɐ khɐ͡o̯n ɟɐe̯।"
2506,t̪u͡ɪ̯ t̪ɾɪʃɐleɾ bɐʃɪnd̪ɐ t̪u͡ɪ̯ edɪ kemone ko͡ɪ̯be k?
2507,"e͡ɪ̯dɐ, e͡ɪ̯dɐ he͡ɪ̯d̪ɪn ɛktɐ nɪʃɔɾ d̪ekchɪ ɟe mɐne, ɟɔɾ ne͡ɪ̯ ʃɪkkhɐnt̪ɪɾɐ kɪ khɐcche , t̪ɐɾ।"
2508,ɐʃole͡ɪ̯।
2509,mɐne e͡ɪ̯ e͡ɪ̯dɐ <> bɐ͡o̯ mɐ chɐ͡ɪ̯ɽɐ ɟɐe̯।
2510,bɐŋlɐd̪eʃeɾ ʃɔb ɟɐjgɐɾɪ e͡ɪ̯ ɔbost̪ɐ।
2511,"mɐne khɐbɐɾeɾ ɔnek ʃɔmoʃʃɐ, buɟɟcho?"
2512,"hum, hum।"
2513,"ɟɐɾɐ bɐ͡ɪ̯ɾe ɟɐjɐ t̪hɐhe, heɾɐɾ ɔnek ʃɔmoʃʃɐ ɔ͡ɪ̯jɐ ɟɐe̯।"
2514,"hum, ɐʃole͡ɪ̯।"
2515,kɪ ɐɾ kɔɾɐ phɔɽoneɾ lɐ͡ɪ̯ggɐ t̪o t̪hɐhonɪ lɐgbo।
2516,"che͡ɪ̯ɾɐ͡ɪ̯n mɐnuʃ ɟedɪ ɐche, edɪ t̪o ɾɐ͡ɪ̯nd̪ɐ mɐ͡ɪ̯nd̪ɐ khɐ͡ɪ̯t̪ɐɾe।"
2517,cheɾɐ͡ɪ̯nt̪eɾ t̪o ɐɾɔ͡o̯ ʃɔmoʃʃɐ ɔe̯।
2518,eɾ lɐ͡ɪ̯ggɐ͡ɪ̯ kɛmpɐʃe nɪbbɪɾɐ nɪbbɐɾɐɾe
2519,ɾɐ͡ɪ̯nd̪ɐ ɾɐ͡ɪ̯nd̪ɐ d̪ee̯।
2520,"ɐ͡ɪ̯ccɐ ɾɐ͡ɪ̯nd̪ɐ ɟe d̪ee̯, kɪt̪ɐ ɔkkoɾe ɾɐ͡ɪ̯nd̪ɐlɐ?"
2521,e͡ɪ̯t̪ɐne kɪ heno ʃɔb phɐe̯ mɔʃolɐ tɔʃolɐ?
2522,"kɔlebe ɟɐ t̪ɐhe, t̪ɐ d̪ɪjɐ͡ɪ̯ ʃɪd̪d̪ɦo ho͡ɪ̯ɾɐ d̪elɐe̯।"
2523,t̪ɐ͡o̯ ɔneke͡ɪ̯ <> ɔneke͡ɪ̯ phɐɾe bɐlo ko͡ɪ̯ɾɐ ɾɐnt̪o।
2524,ʃɔbɐ͡ɪ̯ kɪ ɐmɐɾ t̪umɐɾ mɔt̪o?
2525,ɔd̪o͡ɪ̯ɾɟ?
2526,"nɐ, ɐʃole͡ɪ̯।"
2527,"mɐ nɐ t̪ɐkle ɟemun ɐmɪ mɐcheɾ t̪ɔɾhɐɾɪɾ mo͡ɪ̯d̪d̪e ɟɪɾɐ bɐdɐ d̪e͡ɪ̯ nɐ, hud̪eɾ guɽɐ d̪ɪjɐ ɾɐ͡ɪ̯nd̪ɐ t̪o͡ɪ̯jɐ d̪e͡ɪ̯।"
2528,"khɐ͡ɪ̯chɪ thɪkɐche kɪnt̪u mɐcheɾ ɛt̪t̪o ɐ͡ɪ̯ʃtɐ, gɔnd̪o!"
2529,mɐch nɐ bɐchle ɐʃole͡ɪ̯ ɐ͡ɪ̯ʃtɐ gɔnd̪o hoɾe।
2530,mɐch bɐɟd̪ɐɾche nɐ buɟɟɔcho?
2531,emne͡ɪ̯ monoe̯ d̪ɪjɐ d̪ɪche।
2532,"ɐɾ ko͡ɪ̯ mɐch, buɟɦcho e͡ɪ̯t̪t̪o।"
2533,chɐʃeɾ ko͡ɪ̯ ɐɾɔ͡o̯।
2534,kɪt̪ɐɾ ko͡ɪ̯ ko͡ɪ̯t̪ɐɾɪ nɐ।
2535,"ko͡ɪ̯ ,mɐch nɐ bɐ͡ɪ̯ɟɟɐ ɾɐnd̪on ɟɐ?"
2536,mɐ ɾɐnd̪e ʃɐd̪lɐjɐ
2537,"ʃɐt̪lɐjɐ ɾɐnd̪e <> bunɐɾ mo͡ɪ̯d̪d̪e kɔʃɐjɐ ɾɐnd̪e <> kɔʃɐjɐ bɐlo ko͡ɪ̯ɾɐ ɾɐnd̪e, e͡ɪ̯dɐ͡ɪ̯ ɛktɐ।"
2538,"ho, e͡ɪ̯dɐ ʃɐd̪ lɐge।"
2539,<> chotto chotto ko͡ɪ̯dɪ ɟedɪ?
2540,"edɪ, edɪ ʃɐt̪lɐjɐ ɾɐ͡ɪ̯nd̪ɐlɐ।"
2541,kɪ ɟe ɛktɐ ɔbost̪ɐ!
2542,bɐ͡ɪ̯ɾe t̪hɐhɐ͡ɪ̯ ɟɦɐmelɐɾe um।
2543,ɟe bɐ͡ɪ̯ɾe t̪hɐhe he buɟɦe।
2544,ʃɔɟɪb sɛɾeɾ kunu pɛɾɐ nɐ͡ɪ̯ he?
2545,nɐ cɐkɾɪ hɔɾt̪o bedɐ bɐ͡ɪ̯ɾe geche nɐ kunu kɪchu।
2546,gɦɔɾeɾ mod̪d̪ɦe mɐɾ hudelo khɐjɐ khujɐ zɪbɔn phɐɾ ho͡ɪ̯ɾɐ d̪ɪt̪ɐche।
2547,nɐ mɐɾ hudelo khɐjɐkhujɐ tehɐ͡o̯ ɟod̪ɪ ɐ͡ɪ̯t̪o bedɐɾ phɔhedo t̪e ɐchenɐ ɛktɐ kɔt̪hɐ ɐchɪn।
2548,"ho, bedɐɾ lɐ͡ɪ̯ggɐ koʃto lɐge।"
2549,"ɔt̪o ɔt̪o tehɐ ɐjenɐ, tɪ͡u̯ʃonɪ ho͡ɪ̯ɾɐ ɐɾ kɔt̪o tehɐ ɐje?"
2550,tɪ͡u̯ʃonɪ kɔɾɐjɐ।
2551,"ɐɾ bedɐ kɔt̪o bɔchoɾ e͡ɪ̯ tɪ͡u̯ʃonɪ koɾt̪ɐɾbo, d̪ɦo͡ɪ̯ɾɐ ɾɐkht̪ɐɾbo?"
2552,bedɐɾ e͡ɪ̯।
2553,bedɐɾ t̪o ehon ɪ student nɐ͡ɪ̯।
2554,ɐɾ tɪ͡u̯ʃonɪ kɔɾɐdɐ nɐ ɔnek bɪɾot̪ɪkɐɾ ɛktɐ bɪʃɔe̯ buɟɟoʃ?
2555,d̪ɦo͡ɪ̯ɾɪ gɦɔɾon lɐge।
2556,mɐne ɐmɪ ɔnek sɛɾɾɐɾɾɐɾe d̪ekhchɪ ɟe koɾt̪e koɾt̪e phɔɾe bedɐɾɐ bɪɾokt̪o ɔjɐ ɟɐgɐ।
2557,ɐɾ e͡ɪ̯dɐ koɾt̪o cɐjnɐ।
2558,"ɔhon ɐchenɐ mɐne, ʃɔɟɪb sɛɾeɾe ɐchenɐ ɐge ɛkd̪ɔm t̪umɪ pɐ͡ɪ̯t̪ɐ mɐne ʃɐɾɐkkhɔnɪ poɽɐ͡ɪ̯t̪o।"
2559,bɛc ɐkɐɾe phoɾɐ͡ɪ̯t̪o।
2560,d̪ɔʃ bɐɾodɐ ɛklge phɔɾɐ͡ɪ̯t̪o।
2561,ɔhone buɟɦ।
2562,"ɔhone d̪ɪf, nɪlɪmɐ, t̪umɪ ɐmɪ ɐmɾɐ phɛmɪlɪ memɐɾ।"
2563,ɐɾ nɪlɪmɐɾ lɔge ɛktɐ phɔɾe ɐlɪph।
2564,"mɐne, d̪ɪne d̪ɪne kɪnt̪u mɐnuʃeɾ ɟɔnfɾɪjt̪ɐ ko͡ɪ̯mmɐ ɟɐgɐ।"
2565,"gɔnopɾɪjɐ ko͡ɪ̯mɛ ɟɐgɐ nɐ, e͡ɪ̯dɐɾ lɐ͡ɪ̯gkɐ nɐ।"
2566,"ʃɪkʃo ʃebɦen e͡ɪ̯t eɾ, ʃɪkʃo ʃebɦen eɾ bo͡ɪ̯ nɐ cenɟ ɔ͡ɪ̯lo, eɾɐɾet̪o ɐɾ d̪ɪt̪o nɐ sɛɾeɾ d̪ɦɐɾo।"
2567,eɾɐɾet̪o skul tɪcɐɾ chɐɽɐ phoɾɐ͡ɪ̯t̪ɐɾt̪o
2568,elɐ buɟɦ elɐ।
2569,kɪllɪʃɐ?
2570,bo͡ɪ̯ phuɾɐ cenɟ ko͡ɪ̯ɾɐlche।
2571,e͡ɪ̯dɪ e͡ɪ̯dɐ͡o̯t̪o ɐmɾɐ phoɾɐ͡ɪ̯t̪ɐɾt̪ɐm nɐ ɛ͡ɪ̯le?
2572,kɔjd̪ɪn phɔɾe nɐ͡ɪ̯n teneɾ o bo͡ɪ̯ cenɟ koɾbo।
2573,kɪllɐ͡ɪ̯ggɐ?
2574,kɪllɐ͡ɪ̯ggɐ cenɟ koɾt̪o?
2575,kɪ cenɟ koɾche?
2576,ʃɪkkhɐ kɐɾɪkulɐm cenɟ koɾbo।
2577,d̪ɪche keɾ khelɐkhulɐ d̪ejɐ bɦo͡ɪ̯ɾɐ t̪hɪche।
2578,"kɔe̯ e͡ɪ̯ pɐʃowɐɾdtɪ lɪkhon, mone mone ɛktɪ ʃɔmpoɾɪ d̪ɦoɾun, ɐmɪ d̪ɦoɾɪ"
2579,"ɛkon, e͡ɪ̯t̪ɐ͡ɪ̯।"
2580,ɔhon ut̪t̪ɐ e͡ɪ̯t̪ɐ ɐmɐɾe kɔe̯ k phuʃpo d̪ɪd̪ɪ e͡ɪ̯ ʃɔŋʃodɐ bɐ͡ɪ̯ɾ ko͡ɪ̯ɾɐ d̪e͡o̯t̪o।
2581,"ho ut̪t̪ɐɾɐ ɐmɐɾe͡o̯ e͡ɪ̯t̪ɐ gɪjɐ tɾɪkʃo ʃɪhɐe̯।o ɐ͡ɪ̯cchɐ, e͡ɪ̯t̪ɐ?"
2582,"e͡ɪ̯ɟe mone mone d̪ɦoɾe ɟe, edɪ?"
2583,"ho, e͡ɪ̯t̪ɐt̪o ɐɾ ʃɔɟɪb sɛɾɾe d̪ɪt̪onɐ, buɟɦoʃonɐ ke͡u̯?"
2584,ɔhon ɐmɐɾ mon cɐ͡ɪ̯t̪ɐche bedɐɾe d̪ɦo͡ɪ̯ɾɐ phɪt̪t̪ɐm
2585,ɐɟke pɐst̪ɐe̯ beʃɪ ɟɦɐl ɐchɪn?
2586,ho ektu beʃɪ ɟɦɐl d̪elɐ͡ɪ̯chɪlɪ।
2587,ektu ɟɦɐl nɐ ɛ͡ɪ̯le mɔɟɐ lɐge?
2588,kɪnt̪u ʃuknɐ moɾɪceɾ ɟɐjgɐe̯ kɐ̃cɐ moɾɪc d̪ɪle͡o̯ t̪o pɐɾt̪ɪ।
2589,"ɐmɐɾ kɐ ʃuknɐ moɾɪceɾ ɟɦɐldɐ beʃɪ bɦɐllɐge, kɐ̃cɐ moɾɪceɾ phɾebɦɐɾtɐ et̪o bɦɐllɐgenɐ ɐmɐɾ kɐche।"
2590,"he pɐst̪ɐ ɐmɪ ɐɾekd̪ɪn ektu tɾɐ͡ɪ̯ koɾbɐm, ɪ ko͡ɪ̯ɾɐ ,kɪɟɐnɪ kɔe̯ cɪken d̪ɪjɐ।"
2591,"ɐmɪ ɾɐnchɪlɐm mɐŋʃo d̪ɪjɐ, nɔɾomɐlɪ lɐge।"
2592,mɐne mɐŋʃoɾ ʃɐd̪tɐ ɐlɐd̪ɐ lɐgbo ɐɾ e͡ɪ̯dɐ ɐlɐd̪ɐ lɐgbo।
2593,"cɐ͡ɪ̯chɪlɐm ɐɾekd̪ɪn d̪ud̪ɦ d̪ɪjɐ ɾɐnt̪e, buɟchɔʃ?"
2594,"d̪ud̪ɦ bɦɪɟɐ͡ɪ̯chɪ͡o̯, mɐne phɾɪɟ t̪he͡ɪ̯kɐ nɐmɐjɐ bɦɪɟɐ͡ɪ̯chɪ।"
2595,"pɔɾe d̪ud̪ɦ golche, d̪ud̪ɦ ɟɔl d̪ɪchɪ , pɔɾe d̪ud̪ɦtɐ dɦɐlbɐm emun ʃɔmo mone ho͡ɪ̯t̪ɐche ɟe ɟɦɐl mɪʃtoɾ ʃɔmɐhɐɾ hɔjɐ e͡ɪ̯dɐ mone hɔe̯ ɐɾ bɦɐlɐgt̪o nɐ।"
2596,"nɐ d̪ud̪ɦeɾ mod̪d̪ɦe t̪o ɔnnɐnno mɔnoʃlɐ d̪ɪbɪ, mɔnoʃlɐ d̪ɪle t̪o ɐɾ d̪ud̪ɦtɐ mɪʃtɪ lɐgt̪o nɐ।"
2597,"kɾɪmɪ pɐst̪ɐ ɾɐnt̪e cɐ͡ɪ̯chɪlɐm, pɔɾe ɐɾ ɾɐnt̪chɪ nɐ।"
2598,"t̪oɾ culdɐ kɪ uʃk khuʃk hɔjɐ ɐche, t̪el d̪eʃ nɐ?"
2599,"ɔnektɐ ɐjɐ bɦo͡ɪ̯ɾɔb ɐ͡ɪ̯ʃɐ phɔɾe ɪ koɾche, nɪche।"
2600,nɪjɐ ɔksɪjen tɔkʃɪɟen d̪ɪjɐ pɔɾe thɪk koɾche।
2601,pɔɾe t̪o ɐ͡ɪ̯chɪ ɐmɾɐ।
2602,"phɔɾe ɾɐt̪t̪e ɛktɐɾ ʃɔmɔe̯ bɦɐ͡ɪ̯ bɪʃʃɐʃ koɾ, eɾ gɐɾɟɪjɐn ɐ͡ɪ̯chenɐ।"
2603,nɪt̪o ɐ͡ɪ̯che nɐ?
2604,sɛɾ phun d̪ɪt̪ɐche bɐɾbɔbɐɾ mɐne eɾlɐ͡ɪ̯gɐ mɐne ɛkɟɔn nɐ gele͡o̯ t̪o ɐɾ sɛɾeɾɐ ɟɐ͡ɪ̯t̪e phɐɾenɐ।
2605,keɾe ɐ͡ɪ̯chenɐ keɾe?
2606,"kɪɟɐnɪ, ɔd̪d̪ɦut̪o gɐɾɟɪjɐn nɐ?"
2607,phɔɾe ɟedɪ gɪjɐ d̪ɪjɐ͡ɪ̯che
2608,pɾopɐɾeʃon ne͡o̯wɐɾ mɔt̪o eɾɔkom tɐ͡ɪ̯m ɪ d̪ee̯ nɐ।
2609,tɐ͡ɪ̯m d̪ɪle nɐ।
2610,"cɐɾ mɐʃ tɐ͡ɪ̯m pɐ͡ɪ̯choʃ, hɪ͡u̯ɟ tɐ͡ɪ̯m।"
2611,"ɐɾe ɟɐh, ʃemɪʃtoɾɐɾ d̪u͡ɪ̯d̪ɪn ɐge ɾutɪn d̪ɪche, kemne e͡ɪ̯dɐ, e͡ɪ̯dɐ kɪ kon hɪ͡u̯ɟ tɐ͡ɪ̯m ho͡ɪ̯lo?"
2612,ɐ͡ɪ̯cchɐ t̪u͡ɪ̯ kɪ ʃɔbʃɔmɔe̯ ɾutɪneɾ ɐʃɐe̯ bo͡ɪ̯ʃɐ t̪hɐkbɪ ɟe ɾutɪn d̪ɪle pɔɽbɐm?
2613,"bɦɪjɐʃolɪ, ɾutɪn nɐ d̪ɪle kɪ pɔɽɐ hɔe̯ nɐkɪ?"
2614,ɐʃʃoɾ!
2615,e͡ɪ̯dɐ kunu kɔt̪hɐnɐ।
2616,e͡ɪ̯dɐ͡ɪ̯ kɔt̪hɐ।
2617,t̪ɐ͡ɪ̯le ɐmɐɾ e͡ɪ̯ eʃo ʃɪɾ ɾutɪn d̪ɪche nɐɾɐ।
2618,ɐmɪ poɽt̪ɐmnɐ
2619,"ɐmɐɾ, mɐne he t̪o ɐmɐɾ ʃɐmne ɐchɪn।"
2620,phɔɾe ɐmɐɾ lɔgeɾtɐɾe e͡ɪ̯bɐ bɐ͡ɪ̯ɾ koɾche kɔlɐɾo d̪ɦo͡ɪ̯ɾɐ।
2621,phɔɾe ɐmɐɾ lɔge heɾe bo͡o̯wɐ͡ɪ̯che।
2622,"phɔɾe k bo͡ɪ̯n, ɟɐnɪ t̪o kɪ koɾon lɐgbo?"
2623,"ɐmɪ ko͡ɪ̯ ho ʃɔb d̪ehɐjɐm, ʃɔb d̪ehɐjɐm।"
2624,e͡ɪ̯dɐ kun d̪ɦɔɾoneɾ gundɐmɪ bɦɐ͡ɪ̯?
2625,"phɔɾe, phɔɾe t̪o eɾɐ gechegɐ।"
2626,"foɾɪkkhɐɾ mod̪d̪ɦe mɐne ʃɾɪɟɔnʃɪl, hɛ̃?"
2627,"ʃɾɪɟɔnʃɪl le͡ɪ̯kkhɐ͡o̯ buɟchoʃ ɐmɪ ɛk pɾɪt̪ɐ le͡ɪ̯kkhɐ heɾ lɐ͡ɪ̯ggɐ d̪u͡ɪ̯ mɪnɪt bo͡ɪ̯, he lekhbo"
2628,"ɐɾe bɐbɐɾe, mɐmɐɾ bɐɽɪɾ ɐbd̪ɐɾ।"
