id,string
6499,ɐmɐɾ phɾendlɪsto t̪u͡ɪ̯ noɾmɐlɪ t̪u͡ɪ̯ cɪnt̪ɐ koɾ ɐmɐɾ phɾendlɪsto ʃɔbɐ͡ɪ̯ ɐche।
6500,ke͡u̯ɾ lɔge ɐmɐɾ kɔt̪ɐ kɔ͡o̯n lɐgbo ɪmun kono kɔt̪ɐ ɪjɐ ɐche।
6501,ɟe ɐmɐɾ kɔt̪ɐ ko͡ɪ̯t̪e͡ɪ̯ ɔ͡ɪ̯bo।
6502,ho heɾ ɐmɐɾ lɔge kɔt̪ɐ ko͡ɪ̯t̪e bɐllɐge nɐ he͡ɪ̯ ɐmɐɾ lɔge kɔt̪ɐ ko͡ɪ̯jɐ mɔɟɐ phɐe̯ nɐ ɐgeɾ mɔt̪on
6503,thɪk ɐche kɔt̪ɐ ko͡ɪ̯cho nɐ।
6504,ɪmun mɐnu phɐlɐe̯ t̪hu͡ɪ̯jɐ d̪ɪbɪ।
6505,et̪t̪o pɪɾɪt̪eɾ d̪ɔɾkɐɾ nɐ͡ɪ̯gɐ।
6506,blok khu͡ɪ̯llɐ phɐlɐe̯ t̪hu͡ɪ̯jɐ d̪e।
6507,ɐllɐ hee̯ phɔɾe ɪjɐ koɾbone।
6508,ho ɪdɐ thɪk o͡ɪ̯ ʃɔbʃome mɐne ɾɐgɐɾɐgɪ ɟɪnɪʃtɐ।
6509,edɐ mɐnon ɟɐe̯ nɐ।
6510,t̪u͡ɪ̯ blok xu͡ɪ̯llɐ t̪hu͡ɪ̯jɐ d̪e ɟɐt̪e t̪ɔɾ kono d̪oʃ nɐ ɔe̯।
6511,t̪o o͡ɪ̯ blok mɐɾon lɐgd̪o nɐ।
6512,blok mɐɾɐɾ d̪ɔɾkɐɾ ɐche?
6513,t̪hɐ͡o̯k।
6514,phɾendlɪsto t̪hɐ͡o̯k d̪ekbo ne।
6515,ɐcchɐ thɪk ɐche t̪u͡ɪ̯ ɪjɐ koɾɪcho ed̪ɪke ɐbɪ ɛkd̪ɪn?
6516,ʃukɾobɐɾe phɪdɐ lɔmu d̪ehɪ।
6517,ɐ͡ɪ̯cchɐ phɔɾe ɟɐnɐ͡ɪ̯ʃ।
6518,phon d̪ɪmune t̪ɔɾe ɐmɪ ɐ͡ɪ̯le।
6519,ɐcchɐ thɪk ɐche।
6520,ɐcchɐ ɐllɐh hɐpheɟ।
6521,poɾɪkkhɐdɐɾ lɐ͡ɪ̯gɐ nɪjt̪ koɾo।
6522,<> t̪ɐɾɐbɪɾ nɐmɐɟ t̪o xɔt̪om mɔnoɟɪd̪o gɪjɐ xɔt̪om dɐ d̪e͡o̯।
6523,ɐllɐhoe̯ t̪omɐɾ poɾɪkkhɐ d̪e͡ɪ̯kko bɐlɐ kɪ bɦɐlɐ ɾeɟɐlt koɾo।
6524,bɦɐlɐ ɾeɟɐlt <> mɐe̯ d̪owɐ d̪ɪchɪ।
6525,"ɐmɪ <> t̪omɐɾ cɐcɪ, t̪omɐɾ khɐlɐ।"
6526,ʃɔbɐ͡ɪ̯ ɟɐmu।
6527,ʃɔbɐ͡ɪ̯ ɟɐ͡o̯।
6528,"ɟɐ͡o̯, ɟɐ͡o̯ ɐɟɐn d̪ɪche ɟɐ͡o̯।"
6529,ɐɟɐneɾ lɔge-lɔge ɟɐ͡o̯n lɐge ʃowɐb ɐche।
6530,ɟɐ͡o̯।
6531,t̪omɾɐ gele <> nɐnɐ bɐ͡ɪ̯ɾe d̪e͡ɪ̯kkɐ-d̪e͡ɪ̯kkɐ ʃɪjo nɐnɐ bɐje <> ɔ͡ɪ̯jɐ ɟɐ͡ɪ̯t̪ɐche gɐ।
6532,"t̪omɾɐ, t̪omɾɐ, t̪omɾɐ khɐɽu͡ɪ̯le"
6533,t̪omɾɐ gɪjɐ ɪjɐ koɾle ɐmɾɐ͡o̯ lɔge lɔge <> d̪ɔɾzɐ d̪ɪjɐ heɾɐ͡o̯ khɐɽu͡ɪ̯ zɐ͡ɪ̯bogɐ।
6534,ho d̪eɾɪ koɾle͡ɪ̯ ɟɐlɐ।
6535,d̪eɾɪ ɔ͡ɪ̯jɐ ɟɐjgɐ <> ɐ͡ɪ̯lsɐmɪ koɾle kobɾo ɐgun ɟɔlbo।
6536,ɐmɐɾ kɔt̪ɐ heʃɔmɔe̯ t̪umɪ ko͡ɪ̯t̪ɐ nɐ mɐe̯ kobɾo ɟɔlbo।
6537,o͡ɪ̯ ɟe mɐe̯ mo͡ɪ̯ɾɐ ɾo͡ɪ̯che t̪umɪ ko͡ɪ̯jɐ ɐʃɐ-ɐʃɪ koɾt̪ɐcho।
6538,nɪʃt̪uɾ d̪unɪjɐ nɪʃt̪uɾ।
6539,nɪʃt̪uɾ chele nɪʃt̪uɾ।
6540,ko͡ɪ̯t̪ɐche ɛk <> kɔe̯ ɟɐnen ɪjɐ ʃɐmɪje ɪjɐ <> kɪ mɐjɐ lɐge ɪjɐe̯ bɐp-mɐe̯ d̪o ɟɔnmo d̪ee̯ bɐp mɐɾ kɪ mɐjɐ
6541,eɾt̪e beʃɪ mɐjɐ kɐɾ?
6542,phɔɾe kɔe̯ ɐmɐɾ ɐllɐhoɾ।
6543,kɔe̯ d̪ehence ɐllɐhoɾ lɐ͡ɪ̯gɐ ene mɐjɐ koɾben t̪o ɐbɐɾ ɟɪ-put̪ lɐ͡ɪ̯gɐ <> lɐ͡ɪ̯gɐ mɐjɐ koɾen keɾe।
6544,ɐllɐhoɾ lɐ͡ɪ̯gɐ mɐjɐ koɾben ɐmɐɾ ɐllɐhoe̯ ɔnek bɦɐlo <>
6545,"ɟod̪ɪ͡o̯ ʃo͡ɪ̯l khɐɾɐp lɐge, ɐt ɾɐkɐt̪ phɪɽɐ ɐ͡ɪ̯jɐ foɾɪ।"
6546,bo͡ɪ̯jɐ phoɽɪ।
6547,ɐt ɾɐkɐt̪ phɪɽɐ ɐ͡ɪ̯t̪ɐɾbo।
6548,"ɐt ɾɐkɐt̪ phɪɽɐ, bet̪eɾ phɪɽɐ ɐ͡ɪ̯jɐ phɪɾo।"
6549,t̪omɾɐ buɟɟo nɐ?
6550,ɪdɐ kɪnu ɪslɐm kɪnu buɟɪ nɐ।
6551,nɔbɪɟɐ͡o̯ ko͡ɪ̯lɐm ɪslɐme ko͡ɪ̯che nɐ <> bɪʃ ɾɐkɐt̪o͡ɪ̯ phɔɽun lɐgbo।
6552,kɪnu ɟulum ko͡ɪ̯ɾɐ ko͡ɪ̯che nɐ kɔɾoneɾ lɐ͡ɪ̯gɐ।
6553,"ɔkhon ɟɔhon bɦɐlo lɐgt̪ɐche nɐ, ɔʃust̪ho, ʃu͡ɪ̯jɐ t̪hɐho।"
6554,bɦɐlo lɐgle ɐbɐɾ pho͡ɪ̯ɽo।
6555,ʃo͡ɪ̯lo t̪o͡ɪ̯ ɟɔhon khɐɾɐp lɐge।
6556,ʃo͡ɪ̯l khɐɾɐp lɐgle <> bet̪eɾ fo͡ɪ̯ɾɐ ɐ͡ɪ̯jɐ phɔɾbɐ।
6557,ɟɐ͡o̯ t̪obu mɪs d̪ɪ͡o̯nɐ।
6558,ɟɐ͡o̯ ɔne ʃɔjt̪ɐneɾ lɔge ʃɔjt̪ɐne ɐllɐhoɾ lɔge t̪ɔɾko koɾe।
6559,keɾe ɟud̪d̪ɦ koɾe e͡ɪ̯ ɟe t̪omɐɾ bɐnd̪ɐgoɾe ɐmɪ nɪt̪ɐchɪ gɐ।
6560,ʃɔjt̪ɐnɪ ko͡ɪ̯ɾɐ nɐmɐɟ phoɾt̪o nɐ।
6561,"ɐllɐe̯ kɔe̯ ɟɐ <> e͡ɪ̯ ɟɪd̪ kɔɾ, ɟɪd̪ kɔɾ uth।"
6562,phɔzoɾ ɔkt̪o phɔɾle <> phɔzoɾ fo͡ɪ̯ɾɐ phut̪e nɪ?
6563,phɔzɔɾeɾ <> e͡ɪ̯ ho nɐmɐɟ phɔɾe।
6564,ɟohɔɾeɾ ʃɔmɔe̯ kɔe̯ ɟe ʃɔjt̪ɐne o͡ɪ̯ɟe t̪omɐɾ bɐnd̪ɐ phɔɟɾo phɔɾche nɐ ɟohɔɾo phɔɾche nɐ।
6565,d̪uphuɾe d̪ɪchɪlɐm nɐ?
6566,ɐllɐe̯ kɔe̯ nɐ phɔɾbo।
6567,ɪjɐɾ phɔɾe bɐnd̪ɐ o͡ɪ̯ ɟe ɟe͡ɪ̯ bɐnd̪ɐ eʃɔb bɐnd̪ɐ ko͡ɪ̯t̪e-ko͡ɪ̯t̪e phɔɾe nɐ।
6568,ɟɪmun ɐmɪ o͡ɪ̯ foɾɪ nɐ ko͡ɪ̯bo o͡ɪ̯d̪e ʃɔjt̪ɐne ɐʃe ko͡ɪ̯bo o͡ɪ̯ɟe t̪omɐɾ bɐnd̪ɐe̯ ɟɔhoɾo phɔɾche nɐ।
6569,ɐllɐe̯ kɔe̯ ɐɾo ɐche ɐʃɔɾ nɐmɐɟ ɛ͡ɪ̯le͡o̯ phɔɾbo।
6570,emne ko͡ɪ̯t̪e-ko͡ɪ̯t̪e eʃɐɾ ʃɔmɔe̯ ɪjɐ koɾle phɔɾeɾd̪ɪn।
6571,phɔɾe nɪɾɐʃ ɔ͡ɪ̯jɐ ɟɐe̯ gɐ ɟe ɐmɐɾ bɐnd̪ɐe̯ eʃɐ͡o̯ phɔɾlo nɐ!
6572,ʃɔjt̪ɐne ɟɪt̪t̪ɐ ɟɐgɐ।
6573,ʃɔjt̪one ɟɪt̪t̪ɐ ɟɐjgɐ buɟɟɔʃ।
6574,phɔɾe <> koɾe।
6575,t̪obu ɐllɐe̯ kɔe̯ mɐne eʃɐ͡o̯ ɟod̪ɪ pho͡ɪ̯ɾɐ phɪt̪o t̪o ɐllɐe̯ khuʃɪ ɔ͡ɪ̯lo ɛ͡ɪ̯le।
6576,t̪o ɐmɾɐ kɔt̪o bɔɽo bejɐd̪d̪p bɐnd̪ɐ e͡ɪ̯chɪ kɔt̪ɐ hunɪ nɐ।
6577,ɐɟɐn d̪e͡o̯wɐ mɐne ɐllɐɾ hukum phɐlɔn kɔɾɐ।
6578,eɾfɔɾe e͡ɪ̯ ʃɔje fɔzoɾ nɐ pɐ̃c owɐkt̪o ɔzuje ɟe fe͡ɪ̯ʃ owɐʃ।
6579,pɐ̃c owɐkt̪o ɔzu koɾle t̪omɐɾ fe͡ɪ̯ʃ owɐʃ lɐgt̪o nɐ।
6580,e͡ɪ̯ ɔzu͡o̯ɪ t̪omɐɾ fe͡ɪ̯ʃ owɐʃ।
6581,muxo͡ɪ̯ t̪o phɾes।
6582,ɐllɐhoɾ ɾɔhɔmɔt̪।
6583,ɐllɐe̯ mɐne ʃɔb koɾɐn ʃɐ͡ɪ̯pheɾ mɐ͡ɪ̯d̪d̪e o͡ɪ̯ʃd̪ɦ lehɐ͡o̯ɪ।
6584,pɾot̪ektɐ ɐjɐt̪o͡ɪ̯ o͡ɪ̯ʃd̪ɦ।
6585,"ɟɐnen nɐ bɦɐbɪ koɾɐ͡ɐ̯neɾ ɔɾt̪ho d̪e͡ɪ̯jɐ, d̪e͡ɪ̯jɐ phɔɽen, kɔt̪o bɦɐlo lɐge!"
6586,ɔɾt̪ho d̪e͡ɪ̯khɐ phɔɽle ɟe͡ɪ̯ bɐlɐ!
6587,khɐlɪ muno͡ɪ̯ cɐe̯ phɔɽoneɾ lɐ͡ɪ̯gɐ।
6588,ɔɾt̪ho ʃɔhokɐɾe।
6589,"hɐbɪbɐ ɐppɐe̯ ko͡ɪ̯che, ɔɾt̪ho po͡ɪ̯ɽɐ d̪e͡ɪ̯kko।"
6590,"bɔlche nɐ, e͡ɪ̯ koɾɐ͡ɪ̯f ɟod̪ɪ moneɾ bɪt̪t̪e ge͡ɪ̯t̪t̪ɐ ɟɐ͡ɪ̯t̪ɐɾegɐ <> ho, e͡ɪ̯ koɾɐ͡ɪ̯f d̪ɪjɐ͡o̯ɪ t̪umɪ ʃɔb ʃɔŋʃɐɾ koɾbɐ।"
6591,koɾɐn d̪ɪjɐ͡o̯ɪ ɟɪnd̪ɪgɪ gɔɽbɐ।
6592,"kuɾɐne ɟe͡ɪ̯tɐ lehɐ ɐche, ɪdɐ͡o̯ɪ ʃɔb।"
6593,ʃot̪t̪o।
6594,koɾɐ͡ɐ̯neɾ kɔt̪ɐ mɪt̪t̪hɐ nɐ।
6595,gɦume d̪ɦɔɾe।
6596,ʃɾest̪o kɪt̪ɐb।
6597,koɾɐn।
6598,e͡ɪ̯che koɾɐn ʃɐ͡ɪ̯ph।
6599,pɔɾe ɔnnot̪ɐ।
6600,koɾɐn d̪ɪjɐ͡o̯ɪ ʃɔb kɪchu।
6601,koɾɐ͡ɐ̯neɾ e͡ɪ̯ d̪unɪjɐt̪e e͡ɪ̯dɐ e͡ɪ̯che <> ɐ͡ɪ̯t̪o nɐ।
6602,ɪjɐ o͡ɪ̯ɟe ɐmɪ ɛkɟɔn।
6603,muʃɪlɪm।
6604,ɐmɪ ɛkɟon ɐllɐhoɾ bɐnd̪ɐ।
6605,ɪdɐ͡o̯ɪ t̪o bɔɽo puɾʃtɐɾ।
6606,muʃɔlmɐneɾ gɦɔɾo ɟe ɟɔnmo e͡ɪ̯che ɪdɐ͡o̯ɪ bɔɽo kɔt̪hɐ।
6607,ɟɔnmo e͡ɪ̯che।
6608,ɐxeɾɪ nobɪɾ ummot̪ e͡ɪ̯chɪ।
6609,ʃɔb nobɪɾ ɐge ɟɐ͡ɪ̯bɐ।
6610,ʃɔbɐɾ ɐge ɐmɾɐ <> ।
6611,muho ɐt̪ d̪ɪjɐ ɾɐkche keɾe ʃumɐ͡ɪ̯jɐe̯?
6612,<> t̪omɾɐ gumɐe̯ ɾo͡ɪ̯cho ɟed̪ɪn ɟɐmugɐ ɪjɐɾpoɾteɾ mɐ͡ɪ̯d̪d̪e।
6613,ɪjɐɾpɔɾt nɐ t̪ulchɪlɐ?
6614,<> eɾ fɔɾeɾd̪ɪn ent̪e ɐ͡ɪ̯jɐ ɾɐ͡ɪ̯t̪eɾ belɐ ɐ͡ɪ̯jɐ gumɐ͡ɪ̯cho nɐ।ɐfɔɾe ʃɔkɐlbelɐ <> ɐmɐɾ eno।
6615,ɐmɐɾ mubɐ͡ɪ̯l d̪ɐ t̪ulchɪlɐm।
6616,mɐt̪ɐdɐ bɪʃ koɾt̪ɐche।
6617,<> phɔɾe nɐmɐɟ pho͡ɪ̯ɾɐ khɐ͡ɪ̯bo ne।
6618,cɐ khɐ͡ɪ̯ben?
6619,<> cɐ bɔjɐ͡ɪ̯chɪn go।
6620,gud।
6621,t̪omɾɐ mɐ nɐmɐɟ pho͡ɪ̯ɾɐ khɐ͡ɪ̯bɐ।
6622,nɐ kono cɐ nɐ͡ɪ̯ nɐmɐɟ pho͡ɪ̯ɾɐ bɦɐt̪ khɐ͡ɪ̯bo ʃɔbɐ͡ɪ̯।
6623,ɐmɐɾ cɐ nɐ khɐ͡ɪ̯le bɦɐllɐgd̪ɐɾt̪o nɐ ɪjɐ ɾɔŋ cɐ khɐ͡ɪ̯le
6624,cɐ khɐ͡o̯n lɐgt̪o nɐ।
6625,ɐ͡ɪ̯cchɐ udo ʃɔbɐ͡ɪ̯ udo।
6626,ʃɔbɐ͡ɪ̯ udo।
6627,udo-udo।
6628,ɟɐ͡o̯ t̪omɾɐ ɟɐ͡ɪ̯le ɔ͡ɪ̯d̪o ɐmɾɐ ɟɐmu।
6629,t̪omɾɐ gelegɐ ɐmɾɐ khɐɽumu।
6630,nɐmɐɟ phoɾmu <> phɔɾe e͡ɪ̯dɐ kɪ ebochoɾ ʃɪt̪o koɾbo nɐ e͡ɪ̯che gɐ
6631,<> omɐ o pedo।
6632,ʃɐkɪb <> hɛ।
6633,ʃɐkɪb ʃɔŋkoɾ।
6634,bɔgɐɾ।
6635,ɐ͡ɪ̯cchɐ
6636,e͡ɪ̯ bɔchoɾ koɾbo?
6637,nɐ ʃɐmneɾ bɔchoɾ koɾbo?
6638,ʃɐmoneɾ bɔchoɾ।
6639,"e͡ɪ̯ bɔchoɾ ʃɪje, ʃɪt̪o koɾbo?"
6640,"ʃɪje, ʃɪt̪o hugɐ͡ɪ̯bo kono?"
6641,nɐ ʃɪt̪o nɐ go <> ɛ go।
6642,t̪ɪn dɐ ɟe͡ɪ̯ bɪɟɔɾmɐ <> ʃowɐd̪eɾe kono lɔ͡ɪ̯jɐ bo͡ɪ̯jɐ t̪hɐhon lɐgbo <>
6643,<> ɟɐ͡ɪ̯gɐ।
6644,ɟɐ͡ɪ̯t̪e ɪskulo kɔt̪ɐ e͡ɪ̯che nɐ ɔnekd̪ɪn e͡ɪ̯che।
6645,ɟunɐjd̪ɔɾ ɪskul bond̪ɦo nɐ?
6646,ʃombɐɾt̪e <> ɾoɟɐt̪ o͡ɪ̯ klɐs koɾɐ͡ɪ̯bo?
6647,ɐmgoɾ t̪eɾo t̪ɐɾɪkh poɾɟont̪o klɐs ɔ͡ɪ̯bo।
6648,<>ɟɐ͡ɪ̯t̪ɐche gɐ।
6649,e͡ɪ̯ ʃɐmɪm utho।
6650,ɛkɪ।
6651,ɐɟɐn d̪ɪt̪ɐche udo।
6652,ɐʃsɐlɐmu ɐlɐ͡ɪ̯kum ɐmɪ t̪ɐbɐʃʃum ʃɔɾkɐɾ।
6653,ɐmɐɾ bɔjoʃ bɪʃ bɔchoɾ।
6654,ɐmɪ depodɪl ɪntɐɾnɐʃonɐl ɪ͡u̯nɪvɐɾsɪtɪt̪e pɔɽɐʃonɐ koɾt̪echɪ।
6655,dɪpɐɾtɪment ɔph ʃɔphɔtoɟɛɾ ɪnɟɪnɪjɐɾɪje।
6656,kɐlkkɐ d̪o ɪjɐ ʃo͡ɪ̯d̪ɪ ɪd̪ ɔ͡ɪ̯bo।
6657,t̪o ɐmɾɐɾ o d̪o phɔɾeɾd̪ɪn ɪd̪ ɔ͡ɪ̯bo।
6658,t̪o kɐlkkɐ bɐŋlɐd̪eʃo d̪o ɛktɐ ɪjɐ ɐche।
6659,ɔto।
6660,ʃo ɐmgo nɐ-nɐ so͡u̯d̪ɪt̪e ʃukɾobɐɾe ɪd̪ mɐne bɐŋlɐd̪eʃo ɔto ʃonɪbɐɾe ɪd̪।
6661,ʃonɪbɐɾe ɪd̪।
6662,t̪o kɐlkkɐ cɐn ɾɐ͡ɪ̯t̪e kɪ plɛn ɐche t̪ɔɾɐɾ?
6663,bɐɾbukɪ͡u̯ pɐɾtɪ।
6664,ɐɾ kɪ koɾt̪ɐɾcho?
6665,kɔt̪t̪o kɪchu͡ɪ̯ koɾun ɟɐe̯।
6666,ʃɔbɐ͡ɪ̯ mɔt̪ d̪e।
6667,e͡ɪ̯ ɐ͡ɪ̯cchɐ nɐd̪ɪmɾe emne ko͡ɪ̯chɔʃ?
6668,heɾe ko͡ɪ̯chɪ ɐɟkɐ ko͡ɪ̯chɪlɐm ɐ͡ɪ̯t̪o ɔne kɐloke nɐkɪ ɪjɐ koɾbo।
6669,kɪ ko͡ɪ̯che?
6670,ɐɾ pɐɾtɪɾ kɔt̪ɐ͡o̯ bolchɪ ɪt̪t̪ɐne͡o̯ ɟɪgɐ͡ɪ̯che pɐɾtɪ d̪e͡o̯wɐɾ kɔt̪ɐ।
6671,o ɛkhon kɐloke mone hɔe̯ ɐʃbo।
6672,ɐɟke ɐɾo dɪsɐ͡ɪ̯d kɔɾɐ ɔ͡ɪ̯bo।
6673,ɐɟke <> ʃɔmɔe̯ kɐloke ɐ͡ɪ̯bo ʃɔmɔe̯ <> ɐɾe kɪ ʃund̪ɔɾ bɐt̪ɐʃ cɐlɐjt̪ɐche।
6674,e͡ɪ̯ ʃono ɐ͡ɪ̯cchɐ egulɐ bɐd̪d̪e।
6675,ɪd̪eɾ plɐn kɪ?
6676,kɪ koɾbɪ?
6677,ko͡ɪ̯ ɟɐbɪ?
6678,gɦuɾt̪e nɪjɐ ɟɐ͡ɪ̯t̪ɪ nɐ?
6679,obɦɐɾbɾɪɟo lɔ͡ɪ̯jɐ ɟɐ͡o̯।
6680,bɾɪɟo?
6681,t̪ɐnhɐ ɐmgoɾ lɔge t̪hɐ͡ɪ̯ko।
6682,ɪd̪eɾ d̪ɪn bɾɪɟo ɟe͡ɪ̯ mɐnuʃ t̪hɐhe।
6683,ɪd̪eɾ d̪ɪn ɟɐ͡o̯n ɟɐ͡ɪ̯t̪o nɐ।
6684,genɟɐm।
6685,"ho, ɐɾe kono ɛktɐ ɪbɦent ɛ͡ɪ̯le bɾɪɟeɾ ɟe͡ɪ̯ ɛktɐ ɔbost̪hɐ ɔe̯।"
6686,ɐtɐ͡e̯ o͡ɪ̯ ɟɐjgɐ t̪hɐhe nɐ o͡ɪ̯ ɟɐgɐɾ mɔd̪d̪e ɐbɐɾ o bɐbɐ।
6687,kemne ɐtmu <> t̪ɐɾ uphɔɾe ɐbɐɾ ɟe͡ɪ̯ gɔɾom।
6688,ɐɾ o ɛmon d̪o ɐche kɐlkkɐ kɪ ɟɐnɪ pɾot̪ek ɾoɟɐɾ ɪd̪eɾ mɐzɐɾe͡ɪ̯ ɪjɐ ɔe̯।
6689,bɾɪʃtɪ ɐhe।
6690,d̪ek ebɐɾo d̪ekbɪ ɐ͡ɪ̯jɐ phɔɾbo।
6691,ebɐɾo bole t̪ɪn t̪ɐɾɪkh poɾɟont̪o ɐ͡ɪ̯bo।
6692,ho ʃunchɪlɐm।
6693,ɐɟokeɾ ɐbohɐ͡o̯wɐ d̪ehɔʃ nɐ।
6694,kɪ kɪ kɔɾɐt̪ɐche।
6695,gɐcheɾt̪e thɔp-thp ko͡ɪ̯ɾɐ ɐm phɔɾt̪ɐche।
6696,ʃɔbkɪchu t̪hɐkbo।
6697,ɔhon ɟod̪ɪ ɐm cuɾɪ koɾt̪e ɟɐ͡ɪ̯t̪ɐm t̪ɐ͡ɪ̯le beʃɪ bɦɐllɐgt̪o।
6698,ɐm mɐt̪ɾo ɐ͡ɪ̯t̪ɐche ene ehono d̪o ɐmɾɐ sɐ͡ɪ̯de-phɐ͡ɪ̯deɾ ɐm gɐcho et̪t̪o ɐ͡ɪ̯che nɐ ɐ͡ɪ̯le ene cuɾɪ koɾbo।
6699,ɐmgo nɐnuɾ bɐɽɪɾ gɐche ɐmɐɾ phɐ͡ɪ̯kkɐ͡o̯ gechegɐ।
6700,ho ɐllɐ t̪ɔɾe ko͡ɪ̯cho d̪ɪjɐ ɟɐ͡ɪ̯t̪o।
6701,d̪ɪjɐ geche nɐ mɐmɐɾ bɐ͡ɪ̯t̪o।
6702,kɐcɐ ɐm ene egulɐ।
6703,sɐlɐmɪ d̪ɪbo nɪ t̪ɔɾ mɐmɐe̯ mɐmɪ?
6704,mɐmɪ bɪʃ d̪ee̯।
6705,ɐ͡ɪ̯cchɐ t̪o t̪u͡ɪ̯ t̪o t̪u͡ɪ̯ nɐ ɐmɐɾ t̪ɪn hɐɟɐɾ cɐ͡ɪ̯ɾʃo e͡ɪ̯che sɐlɐmɪ।
6706,ɐmɐɾ bɔɽo bɐ͡ɪ̯ ɔhon ɐɾ chudu ʃɐɟɪʃ nɐ।
6707,t̪u͡ɪ̯ ɐmɐɾe sɐlɐmɪ d̪ɪbɪ <> mɐ͡ɪ̯nneɾe mɐnle mone koɾt̪ɐm ɟe he͡ɪ̯ ɐmɐɾe mɐnche d̪ɪt̪ɐm।
6708,mɐnochɔt̪o nɪ?
6709,ɐmɐɾ t̪ɪn hɐɟɐɾ cɐɾʃo tɐkɐ ɪd̪eɾ sɐlɐmɪ utche।
6710,ɪd̪eɾ ɐge।
6711,d̪ɪche kedɐe̯?
6712,t̪o͡ɪ̯le ɐmgoɾe egulɐ d̪ɪjɐ lɐ͡ɪ̯cho।
6713,ɐmgo <> ɐbbu d̪ɪche ɛk hɐɟɐɾ।
6714,phɔɾe khɐlɐmonɪ chudu khɐlɐmonɪ d̪ɪche ɛk hɐɟɐɾ।
6715,ɐʃmɐ khɐlɐe̯ d̪ɪche pɐcʃo।
6716,mɐmɪ pɐcʃo।
6717,t̪ɪn hɐɟɐɾ।
6718,nɐnu nɐnɐe̯ mɪlɐe̯ t̪ɪnʃo।
6719,mɐmɐnɪ ɛkʃo।
6720,ɪt̪t̪ɐn d̪ɐ kɪ koɾbɪ?
6721,o ɐbɐɾ ɪjɐ ɪjɐ meɟo mɐmɐnɪ d̪ɪche nɐ ɛkʃo t̪ɐ͡ɪ̯le ɐmɐɾ pɐcʃo t̪ɪn hɐɟɐɾ।
6722,"ɪt̪t̪ɐn, ɪt̪t̪ɐnd̪ɐ kɪ koɾbɪ?"
6723,gɦuɾt̪ɐm ɟɐmu।
6724,ɐmgoɾe d̪ɪjɐ lɐ kɪchu।
6725,ɐmgoɾe guɾɐbɪ nɪ?
6726,e͡ɪ̯ ɐmɐɾ d̪uɾeɾt̪e bɐnd̪ubɪ ɐ͡ɪ̯bo।
6727,o ho ho!
6728,t̪u͡ɪ̯ kɪ t̪ɔɾ sɐlɐmɪ d̪ɪjɐ t̪ɔɾ bɐnd̪ubɪgoɾe guɾɐbɪ?
6729,nɪɟɦum ɪt̪t̪ɐne ɐ͡ɪ̯bo।
6730,ʃot̪t̪ɪkɐɾe ɐ͡ɪ̯bo?
6731,ho <> e͡ɪ̯dɐ d̪ɐ ɟɪbone͡o̯ ɐmɐɾe gɦuɾɐ͡ɪ̯lo nɐ ɛ͡ɪ̯le।
6732,ko͡ɪ̯ guɾt̪ɪ ɟɐbɪ?
6733,bɾɪɟo ɐɾ ko͡ɪ̯?
6734,t̪u͡ɪ̯ ɟɐbɪ bɐɽɪt̪o?
6735,nɐ he͡ɪ̯ ɐ͡ɪ̯bo।
6736,kɔt̪o guɾt̪ɪ ɟɐbɪ t̪ɔɾe kɪ bɐɽɪt̪t̪e d̪ɪbo nɐ kɪ।
6737,eno <> ɐmɐɾe ɐmɐɾe͡o̯ d̪ɪche nɐ t̪ɔɾ mɐe̯ ɟɪbone kono ɟɐjgɐe̯ ɟɐ͡o̯wɐɾ lɐgɪ t̪ɔɾ bɦɐjeɾe͡o̯ d̪ɪche nɐ।
6738,ɐmɪ d̪o bɐt̪ t̪ɔɾ bɦɐje ɟe pholɐ t̪ɔɾ bɦɐjeɾe d̪ɪche nɐ t̪ɔɾ ɐmmue̯।
6739,ɐbɐɾ t̪ɔɾe d̪ɪbo nɐ kɪ!
6740,ɐmɐɾ ʃɔb bɐnd̪ubɪɾɐ ɟɐ͡ɪ̯bo।
6741,t̪ɔɾ ɐmmue̯ d̪ɪle o͡ɪ̯ ɔ͡ɪ̯bo ɐmɾɐ d̪ɪt̪ɐm nɐ ebɐɾ t̪ɔɾe <> nɐ ɾe।
6742,ɟɐbɪ kemne?
6743,emno͡ɪ̯ ɟɐmugɐ।
6744,ko͡ɪ̯ ɟɐbɪgɐ?
6745,bɐnd̪ubɪɾɐɾ lɔge।
6746,chɐmɪ ebɐɾ ɪd̪eɾ ɟɐmɐ kɔjdɐ kɪncho?
6747,"ʃɾest̪o kɪt̪ɐb, ʃɾest̪o kɪt̪ɐb।"
6748,koɾɐ͡ɪ̯n e͡ɪ̯che koɾɐ͡ɪ̯n ʃɐ͡ɪ̯ph।
6749,phɔɾe ɔnnot̪ɐ।
6750,koɾɐn d̪ɪjɐ͡ɪ̯ ʃɔbkɪchu।
6751,e͡ɪ̯ koɾɐ͡ɐ̯neɾ <> ɪdɐ e͡ɪ̯che d̪u͡ɪ̯nnɐt̪ t̪omɾɐɾ ɪjɐ o͡ɪ̯ ɟe ɐmɪ ɛkɟon
6752,ɪd̪eɾ ɟɐmɐ he͡ɪ̯ cɐ͡ɪ̯ɾdɐ kɪnche ebɐɾ।
6753,cɐ͡ɪ̯ɾdɐ?
6754,t̪ɪndɐ e͡ɪ̯che t̪ɾɪ-pɪcho ɐɾ ɛktɐ e͡ɪ̯che <> phɔɾeɾ ɪd̪o d̪ekhbɪ ɛktɐ͡o̯ nɐ͡ɪ̯।
6755,kɪjeɾ bedɐ nɐ͡ɪ̯।
6756,"phɔɾeɾ ɪd̪o d̪ɔʃ hɐɟɐɾeɾ mɪm ɐpu, t̪ɐnhɐ ɐpu ʃɔbɐ͡ɪ̯ ɐ͡ɪ̯bo।"
6757,phɔɾeɾ ɪd̪o t̪u͡ɪ̯ ɛktɐ gɪphɔt ko͡ɪ̯ɾɐ lɐbɪ ɛktɐ ʃoʃoe̯ gɪphɔt ko͡ɪ̯ɾɐ lɐ͡ɪ̯bo <> kɪ।
6758,t̪ɐ͡ɪ̯le ɐmɐɾe gɪphɔt koɾbo kedɐ?
6759,t̪omɐɾed̪o।
6760,"ɔgɾɪm, ɔgɾɪm d̪u͡ɪ̯ hɐɟɐɾ tɪjɐ d̪ɪbo phɔɾe d̪ɔʃ hɐɟɐɾ tɪjɐ ɾɐ͡ɪ̯kkɐ d̪ɪbo।"
6761,t̪omɐɾe bɦɐ͡ɪ̯je gɪpht koɾche।
6762,ɐmɐɾed̪o gɪphɔt koɾe nɐ͡ɪ̯।
6763,kumɽo gu͡ɪ̯ɟɟɐ pɐcʃo tɪjɐ ɛktɐ kɪ kɐlɐɾ ɟɐnɪ <> t̪u͡ɪ̯ ɛk kɐɟ koɾ ɟɐ t̪hɐhe bɦɐɽɐ ɛktɐ gɪphɔt ɟɐmu-ɐmu uttu phɐnɪ-chɐnɪ khɐ͡ɪ̯t̪ɐm nɐ।
6764,"t̪u͡ɪ̯ ɐmɐɾe bɪkɐʃe, bɪkɐʃe d̪ɪjɐ lɐ͡ɪ̯cho।"
6765,ɐmɪ he͡ɪ̯dɐ d̪ɪjɐ ɐ͡ɪ̯nnɐ phɔɾmune।
6766,kɪɾe t̪ɔɾ ɪjɐɾ skɾɪnd̪ɪ ɔph ɔ͡ɪ̯jɐ gechegɐ।
6767,"ɐmgoɾ, ɐmgoɾ cɔjeɟ o͡ɪ̯ ɛktɐ t̪ɔɾ cɔjeɟ o͡ɪ̯ ɛktɐ।"
6768,buɟot̪ nɐ ɟee̯ d̪ee̯
6769,cɔjeɟ lɐge nɐ।
6770,ɐmɐɾ cɔjeɟ beʃɪ ʃund̪ɔɾ t̪ɔɾɐɾ cɔjeɟeɾt̪e।
6771,d̪ɦuɾu ɐmɐɾ cɔjeɟeɾ d̪ɦɐɾo͡ɪ̯ nɐ͡ɪ̯ t̪ɔɾo।
6772,t̪ɐɾfɔɾe͡o̯ ɟee̯ gɪphɔt d̪ee̯ heɾ cojeɟe͡ɪ̯ gɪphɔt d̪ee̯।
6773,"ɟe͡ɪ̯, ɟe nɪbo heɾ cɔjeɟe d̪ee̯ nɐ।"
6774,ɐpu ɟe͡ɪ̯ ɟɐmɐ d̪ɪche ɐbbu ko͡ɪ̯che he͡ɪ̯dɪ o͡ɪ̯ phoɾt̪ɐm।
6775,t̪ɔɾɐ ɟod̪ɪ bɦɔbʃɪt̪t̪e gɐɾlphɾend o cuɟ koɾcho he͡ɪ̯dɐ͡o̯ ɐmɐɾe d̪ɪjɐ kɔɾɐbɪ।
6776,d̪ekbɪ t̪ɔɾɐ ɾɐɟkumɐɾɪ pɐ͡ɪ̯chɔʃ।
6777,"ɔjo, ɐɾ t̪ɔɾɐ nɪɟeɾɐ koɾle d̪ekbɪ pet̪nɪ pɐ͡ɪ̯chɔʃ।"
6778,"egulɐ bɐd̪ d̪ɪjɐ, t̪ɔɾɐ ʃɔbɐ͡ɪ̯ ɐmɐɾe sɐlɐmɪ d̪ɪjɐ lɐ͡ɪ̯cho।"
6779,pɐ̃cʃo d̪ɪjɐlɐ।
6780,t̪u͡ɪ̯ ɐge ʃɔbɐ͡ɪ̯ɾe ʃɐlɐm d̪ɪbɪ।
6781,ɐllɐe̯ t̪ɔgo।
6782,ke bɐ͡ɪ̯ ko͡ɪ̯che?
6783,sɐlɐmɪ d̪ɪbɪ ko͡ɪ̯chɔt̪o।
6784,t̪u͡ɪ̯ ko͡ɪ̯chɔt̪o।
6785,"nɐ, phɐste t̪u͡ɪ̯ ko͡ɪ̯chɔt̪o।"
6786,ed̪o sɐlɐmɪ।
6787,"nɐ <> ɐ͡ɪ̯cchɐ, t̪ɔɾe ʃɐlɐm d̪ɪche ʃeʃ।"
6788,t̪ɔɾtɐ gechegɐ।
6789,ɐŋgtɐ d̪e।
6790,ɐmɪ kɪ ʃɐlɐm ko͡ɪ̯chɪ nɪ?
6791,"ko͡ɪ̯chɪ, ɐŋgtɐ d̪ɪt̪ɪ।"
6792,"sɐlɐmɪ d̪ɐ͡o̯, ʃɐlɐm koɾchɪ।"
6793,ɪd̪eɾ d̪ɪn।
6794,ɪd̪ ɐ͡ɪ̯che?
6795,ɔgɾɪm।
6796,ɔne ʃɔbɪ ɔgɾɪm cɔle।
6797,"ɐmɪ, ɐmɪ ɔgɾɪm kɪchu d̪e͡ɪ̯ nɐ।"
6798,ɟod̪ɪ ɔhone mo͡ɪ̯ɾɐ ɟɐ͡ɪ̯gɐ hud̪ɐt̪e?
6799,sɐlɐmɪ d̪ɪjɐ lɐbɦ ɐche!
6800,"ɔne ʃɔbɔ͡ɪ̯ d̪ehocho nɐ ɪd̪, ɪd̪ nɐ ɐ͡ɪ̯t̪e͡ɪ̯ t̪o ʃɔbɐ͡ɪ̯ ɔgɾɪm ɪd̪ mobɐɾok mɐɾt̪ɐche।"
6801,"uhu, lɐgt̪o nɐ।"
6802,e͡ɪ̯ bɐɾ ɐpu।
6803,<> pɾot̪ɪbɐɾ he͡ɪ̯ mɐgnɐ khɐe̯।
6804,e͡ɪ̯bɐɾ mɐgonɐ khɐ͡o̯n ɟɐ͡ɪ̯t̪o nɐ।
6805,ho pɾot̪ɪbɐɾ mɐgnɐ khɐe̯।
6806,kedɐ mɐgnɐ khɐe̯?
6807,t̪u͡ɪ̯।
6808,ɐmɪ konod̪ɪn d̪ekhchɪ nɐ t̪u͡ɪ̯ ɟɪbone͡o̯ nɐ ɛktɐ kɐm koɾcho nɐ kono koɾcho?
6809,pɾot̪ɪbɐɾ mɐgnɐ khɐʃ t̪u͡ɪ̯।
6810,ɐmɐɾe <> lɔge hebɐlɐ nɐ koɾle͡o̯ khɐ͡ɪ̯t̪o bo͡ɪ̯jɐ ɟɐ͡ɪ̯bogɐ।
6811,ɐmɪ ɟɪbone edɐ t̪ɔɾɐɾ lɔge ʃoɾɪʃɐɾ t̪el
6812,bɪchun ɐmɪ bɐ͡o̯ d̪e͡ɪ̯।
6813,ʃɔbɐ͡ɪ̯ kɔɾon lɐge <> lɐ͡ɪ̯t d̪o͡ɪ̯ɾɐ bo͡ɪ̯jɐ t̪hɐhe kedɐe̯?
6814,"o mɐgo <> lɐ͡ɪ̯t, lɐ͡ɪ̯t edɐ ɐmɪ koɾɪcɐnd̪eɾ chobɪ t̪ule kedɐe̯?"
6815,kedɐe̯?
6816,ʃund̪ɔɾ-ʃund̪ɔɾ chobɪ t̪u͡ɪ̯llɐ d̪ee̯ kedɐe̯?
6817,cɐnd̪eɾ chobɪd̪ɐ kɪ koɾmu <> phɔɾe gɐn lɐgɐ͡ɪ̯jɐ bɐɟɐ͡ɪ̯jɐ bo͡ɪ̯jɐ t̪hɐhe kedɐ?
6818,ɐmɪ ko͡ɪ̯ ɐmɪ ko͡ɪ̯।
6819,chɐbɪ ɟe chudu chɐbɪ͡o̯ bɐt̪ɐʃ koɾt̪ɐɾe।
6820,t̪ɔɾt̪e bɦɐlɐ bɐt̪ɐʃ koɾe।
6821,bɦɐlo e͡ɪ̯che।
6822,beʃɪ t̪ɔɾt̪e beʃɪ poɾɪʃɾɔm koɾe।
6823,ɐmɪ khɐmu e͡ɪ̯dɐ͡ɪ̯ beʃɪ।
6824,ho khɐmu e͡ɪ̯dɐ͡ɪ̯ beʃɪ।
6825,ho t̪ɔgoɾ ɛktɐ pɐɾtnɐɾ e͡ɪ̯che।
6826,elɐ͡ɪ̯gɐ ɔne pɐɾtɪ d̪ɪbɪ।
6827,ebɐɾ tɪjɐ d̪ɪbo।
6828,ebɐɾ tejɐ bɐd̪e kono ɪjɐ o͡ɪ̯t̪o nɐ।
6829,ɛk tɪjɐ͡o̯ d̪ɪt̪ɐm nɐ।
6830,ɟee̯ tɪjɐ nɐ d̪ɪbo hee̯ ɾumeɾ bɐ͡ɪ̯ɾe t̪hɐkbo d̪ekbo।
6831,he͡ɪ̯dɐ ɐmɾɐɾ tɐ ɐmɾɐ।
6832,t̪o t̪ɔɾɐɾtɐ t̪ɔɾɐ <> ɟee̯ ko͡ɪ̯bo hee̯ d̪ekbo।
6833,o͡ɪ̯ɟe heɾe ko͡ɪ̯chɪ ɐmɪ͡o̯ bo͡ɪ̯jɐ ɐchɪlɐm ɐmɪ hoje ɟod̪ɪ kɔe̯ hoje phɐ͡ɪ̯bo nɐ͡ɪ̯le phɐ͡ɪ̯t̪o nɐ।
6834,phɐ͡ɪ̯t̪ɐm nɐ ho।
6835,heɾe͡ɪ̯ d̪o ɐmɪ d̪ɪt̪ɐm nɐ।
6836,o t̪umɪ ɔne mɪl d̪ɪ͡o̯nɐ buɟɦcho t̪umɪ ɔne mɪl d̪ɪ͡o̯nɐ।
6837,hee̯ mɪl kɪ?
6838,ɐ͡ɪ̯cchɐ ɟɐ ɐmɪ ɐmɐɾ ɾumeɾt̪e bɐɾu͡ɪ̯t̪ɐm nɐ।
6839,ɔhone t̪ɔɾɐ ɟod̪ɪ ɐmɐɾe chɐɽɐ khɐ͡ɪ̯t̪ɐɾcho t̪o khɐ͡ɪ̯jɐ lɐbɪ।
6840,ɾumeɾt̪e bɐɾu͡ɪ̯t̪ɐ keɾe d̪ehɐɾ ʃugɔt̪ ɐche।
6841,khɐ͡o̯wɐɾ ʃugɔt̪o nɐ͡ɪ̯।
6842,d̪ehɐɾ ʃuɟog ɐche khɐ͡o̯wɐɾ ʃuɟog nɐ͡ɪ̯।
6843,ɐppuje ɐmɐɾ sɐlɐmɪ d̪ɪjɐ lɐ͡ɪ̯che।
6844,ɐmɐɾ koʃɪmɪtɪks ʃɔb d̪ɪche ɐppuje।
6845,bɦɐlɐ e͡ɪ̯che ɟɐ।
6846,ɐppu ɐmɐɾe sɐlɐmɪ d̪ɪjɐ lɐ͡ɪ̯che।
6847,kɪchu ɾɐhɪʃ phɔɾed̪ɐ t̪ɔɾ lɐ͡ɪ̯gɐ kejɐ kɔʃmetɪkɔʃ।
6848,t̪ɔɾ tɪjɐɾ t̪e ɔɾd̪ek d̪ɪjɐ lɐ͡ɪ̯cho ɐmɐɾe।
6849,o mɐ͡ɪ̯ gɔd।
6850,hee̯ mɐd̪ɾesɐɾ phɔɾe <> kɔʃmetɪk।
6851,ɪt̪t̪ɐ nɐ d̪o ben ʃe͡ɪ̯t hɪɟɐpeɾ।
6852,ɐmɐɾ ʃud̪ɐ lɐ͡ɪ̯ggɐ geche gɐ।
6853,t̪ɐnhɐ ɪd̪eɾ ʃopɪŋ ko͡ɪ̯ɾɐ lɐ͡ɪ̯chɔʃ?
6854,kɪ koɾlɐ।
6855,kɪ kɪncho?
6856,ʃɐd̪ɪb bɦɐ͡ɪ̯je bole ɪd̪eɾ mɐ͡ɪ̯d̪d̪e gɦumɐ͡ɪ̯bo।
6857,"ɪd̪o ʃɔbɐ͡ɪ̯ ɟɐ ɟɐ kɪne ɟɐmɐ,ɟut̪ɐ।"
6858,ɐŋgo t̪o ɪjɐ ʃɐɾt kɪnchɪ।
6859,<> ʃɔb nɐ kɪne।
6860,phɐnɟɐbɪ nɐ।
6861,kɔjek <> phɐmɪ͡o̯ ʃɐɾt kɪnchɪ।
6862,<> ɐmɪ kɪnchɪ genɟɪ।
6863,t̪ɔɾe kedɐ kɪnnɐ d̪ɪche?
6864,thɪk ɐche nɐ?
6865,ɐmɐɾe ɐppupe kɪnnɐ d̪ɪche।
6866,"d̪ɛkho kɪ ʃund̪ɔɾ bɐt̪ɐʃ ɾe, bɦɐ͡ɪ̯।"
6867,ɐɾ o͡ɪ̯ d̪ɪk gele ɛkd̪ɔm bɐt̪ɐʃ-tɐtɐʃ kɪchu phɐ͡o̯wɐ ɟɐ nɐ।
6868,bɐl!
6869,ɪdɐɾe o͡ɪ̯ t̪o kɔe̯ gɾɐm।
6870,"<> ɐɾe ɐmɾɐ mɐd̪ɾɐʃɐ ɟɐ͡ɪ̯le kɔe̯, ""t̪omɾɐ kɪ <>?"""
6871,"pɪs-pɪs, ʃɐnt̪ɪ-ʃɐnt̪ɪɾ ɟɐjgɐ ʃɔhoɾ।"
6872,ɐmɾɐ ko͡ɪ̯ ʃɔhoɾe t̪hɐkɪ ɟe ɐmmu ɐɾ ɐmɪ।
6873,"<> ɟɐ͡o̯wɐɾ ʃɔmɔe̯ ko͡ɪ̯, ɟɐ͡ɪ̯bɐ?"
6874,ko͡ɪ̯ ɟɐ͡ɪ̯bɐ?
6875,kɔe̯ bu͡ɪ̯d̪ɐmɐɾ sɪtɪ upoʃɔhoɾ।
6876,bu͡ɪ̯d̪ɐmɐɾ ʃɪtɪ।
6877,kɔe̯ edɐ ɐbɐɾ kondɐ?
6878,kɔe̯ gele͡ɪ̯ buɟɦbɐ।
6879,"ɐmɪ nɐ ɐɾektɐ ʃot̪t̪ɪ kɔt̪hɐ, ɐmɪ ɟɪbone͡o̯ ɐche nɐ।"
6880,"kɪ ɟɐnɪ <> kɪ kɔe̯ ɐmɪ ʃɔbʃɔmɔe̯ ɔtowɐlɐ hok bɐ ɟɐgoɾe͡ɪ̯ hok ogoɾe ɟɐ͡ɪ̯jɐ ko͡ɪ̯, bud̪ɪjɐmɐɾɐ।"
6881,<> ko͡ɪ̯t̪e hɔe̯ nɐ bu͡ɪ̯d̪d̪ɐmɾɐ।
6882,ɐmɪ͡o̯ ko͡ɪ̯ bu͡ɪ̯d̪d̪ɐmɾɐ।
6883,ɐmɪ ɟɪbone͡o̯ ko͡ɪ̯chɪ nɐ bu͡ɪ̯d̪d̪ɐmɾɐ।
6884,"ɐmɐɾ ʃɔbʃɔmɔe̯ ko͡ɪ̯ <> ʃɔbʃɔmɔe̯ ko͡ɪ̯ <> ko͡ɪ̯, bu͡ɪ̯d̪d̪ɐmɐɾ ʃɪtɪ ɟɐ͡ɪ̯bɐnɪ?"
6885,bu͡ɪ̯d̪d̪ɐmɐɾ sɪtɪ?
6886,"gele͡ɪ̯ buɟɦbɐ, ɐjo।"
6887,pɔɾe ɐje।
6888,ɐmɪ phɔɾkɐd̪ bɦɐ͡ɪ̯ɾe d̪ehɪ।
6889,"ɐmɐɾ mɐje ɐmɐɾe mɐd̪ɾɐʃɐe̯ d̪ɪjɐ ɐ͡ɪ̯t̪e ɟɐ͡ɪ̯t̪eʃe, phɔɾkɐd̪ bɦɐ͡ɪ̯je, phɔɾkɐd̪ bɦɐ͡ɪ̯ ɐ͡ɪ̯ʃe d̪u͡ɪ̯ nɐmbɐɾ ʃɪdo gɪjɐ mɪʃukeɾ nɪche ɪlɐɾ bond̪ɦuɾɐ ɪ"
6890,ɐɾe ebɐɾ o͡ɪ̯ɟe ɪjɐ ɐmɐd̪eɾ sɐ͡ɪ̯de d̪ɐ ɟɐ͡ɪ̯jɐ d̪uɾe ɟɐ͡ɪ̯jɐ ɪphot̪ɐɾ kɔɾɐɾ d̪ɔɾkɐɾ ɐʃɪlo।
6891,ɐmɾɐ mɐd̪ɾɐʃɐe̯ <>।
6892,"ɐɾe he͡ɪ̯dɐ bɐd̪ d̪ɪn, ze͡ɪ̯ poɾɪmɐne kɔt̪od̪ɪn bɦɐɾsɪtɪ t̪hɐkt̪e e͡ɪ̯ ɐɟke ɛktɐ ɪphot̪ɐɾ pɐɾtɪ, kɐlkɐ ɛktɐ ɪphot̪ɐɾ pɐɾtɪ, edɐ kɛnsjel koɾle ɐɾo d̪u͡ɪ̯dɐ t̪h"
6893,ɐmɾɐ mɐd̪ɾɐʃɐt̪e gɐb gɐcheɾ t̪ɔle ɪphot̪ɐɾɪ koɾchɪ।
6894,ɔnek mɐnu d̪uɾet̪t̪e ɐ͡ɪ̯jɐ।
6895,ɐmɾɐ gelɐm kɐlkɐ।
6896,<> ɛkbɐɾe kɔɾ kɐloke ɟehet̪u lɐst u͡ɪ̯k।
6897,ʃoɾɪ lɐst ɾɔmɟɐn।
6898,ɐɟke nɐ <> ɪt̪t̪ɐne।
6899,edɪ͡o̯?
6900,"bɛbʃɐ-mɛbʃɐ, ektu bɛbʃɐ koɾe nɐ ɪt̪t̪ɐne?"
6901,"<> ʃɔbɐ͡ɪ̯ d̪ehɪ ɐmgo ʃɐt̪he ɾegulɐɾlɪ ʃɔbɐ͡ɪ̯ d̪ehɪ nɪɟego gɾɐm mɐne ɪjɐt̪ ɟɐ͡ɪ̯jɐ, nɪɟ d̪eʃe geche nɐ?"
6902,heno ɟɐ͡ɪ̯jɐ d̪ehɪ ʃɔbɐ͡ɪ̯ ɪskuleɾ edɪɾ lɔge koɾche।
6903,ɐmɪ d̪ɪ koɾlɐm nɐ।
6904,ke͡u̯ d̪ehɪ ɐmɐɾe ɪnbɦɐ͡ɪ̯tɪ d̪ɪlo nɐ।
6905,<> ɐmɾɐ ɪskuleɾ nɐ͡ɪ̯jɪ।
6906,ɐɾe ʃɔbɐ͡ɪ̯ɾe nɪjɐ͡ɪ̯ t̪o koɾche।
6907,o͡ɪ̯ɟe bɛcgulɐ ɐche nɐ?
6908,"o͡ɪ̯ɟe ɐmɾɐ ɪphot̪ɐɾ pɐɾtɪ kɪ koɾmu, ɐmɐɾe ɪjɐ d̪ɪt̪ɐche, ɪd̪ mobɐɾok d̪ɪt̪ɐche।"
6909,kɐ͡o̯chɐɾ bɦɐ͡ɪ̯ ɐmɐɾe ɪd̪ mobɐɾok d̪ɪche।
6910,<> ʃɔb so͡u̯d̪ɪ ɐɾbe gechegɐ।
6911,<> ʃɔbkotɐ <> eɾphɔɾe͡o̯ ɔnekdɪ ɐchot̪o bedɐ।
6912,ɪt̪t̪ɐ ɐche ɪt̪t̪ɐ ʃɔb kɔleɟeɾ eno।
6913,ɐbbɐɾe ko͡ɪ̯chɪ ɐ͡ɪ̯jɐ <> ɐge ɐ͡ɪ̯t̪o।
6914,kɔleɟedɪ͡ɪ̯ eɾphɔɾe͡o̯ ɐchɔt̪o ɐɾ ɐmɐɾ ko͡ɪ̯t̪t̪e ɐche?
6915,ɐbbɐe̯ kɔe̯ khɐlɪ ɐpnɐɾe <>।
6916,"ɐmɾɐ ɟe͡ɪ̯ ɐche, ʃɔbdɪɾe khɐlɪ kɔe̯ ɪd̪ mobɐɾɔk।"
6917,"ɪphot̪ɐɾ pɐɾtɪ nɐ͡ɪ̯, khɐlɪ ɪd̪ mobɐɾɔk।"
6918,"kɐlkɐ t̪o ɪd̪, ɐnond̪o!"
6919,ɪd̪ mobɐɾok ko͡ɪ̯t̪e t̪o ɐɾ khɔɾoc lɐge nɐ।
6920,kɐlkɐ ɐmɐɾ kɐche ɟe ɐ͡ɪ̯ʃe mejed̪ɪ koɾt̪e ɐ͡ɪ̯bo hejt̪e।
6921,elɐ ebɪ ɔ।
6922,ɛkɟɔneɾt̪e pɔncɐʃ tejɐ ko͡ɪ̯ɾɐ ɾɐhum।
6923,"k, kɛʃɪjɐɾ kɪ t̪ɔɾe ɾɐkht̪ɐm nɐkɪ?"
6924,kɐɾe?
6925,kɛʃɪjɐɾ?
6926,ɐmɐɾ t̪o muɟuɾɪ lɐgbo।
6927,eɾt̪e bɦɐlɐ ɐmɐɾ kɛʃɪjɐɾɪ ɐmɪ।
6928,mɛnɟɐɾeɾ kɪ muɟuɾɪ lɐge nɐ?
6929,"ʃɔɾ, et̪odɪ hɐt̪ phoɾɐje d̪e͡ɪ̯, ke͡u̯ ɐmɐɾe ɛktɐ tejɐ͡o̯ d̪ɪjɐ ɟɐe̯ nɐ।"
6930,"khuʃɪ ho͡ɪ̯jɐ kɔe̯, ""ɔɾonɐ ɟɐ͡o̯ ɐcchɐ mehed̪ɪdɐ ɾɐ͡ɪ̯kkhɐ d̪e͡o̯।"""
6931,ɟedɪɾ beʃɪ hɔe̯ odɪ lɔ͡ɪ̯jɐ ɟɐjgɐ।
6932,"bɐɾodɐ-ɛktɐ poɾɟont̪o ɟɐ͡ɪ̯ggɐ ɟɐ͡ɪ̯ggɐ, ɐmɐɾ ɐmmɐɾ lɔge emun ɟɪd̪ ude।"
6933,"bɔjɐ t̪hɐjɪ ɟe ʃeʃ ɐɾ t̪o, phɔɾe kɪnt̪u ɛktɐ ʃɔmɔe̯ phɔɾɐ͡ɪ̯t̪e phɔɾɐ͡ɪ̯t̪e nɐ ɟɪd̪ ude nɐ?"
6934,mɐne ɐɾ bɦɐllɐge nɐ phoɾɐ͡ɪ̯t̪e।
6935,ɐmmɐ kɪ koɾbo?
6936,"e͡ɪ̯ɟɔnɾe-he͡ɪ̯ɟɔnɾe ɐnbo, ɐ͡ɪ̯nnɐ ɐ͡ɪ̯nnɐ ko͡ɪ̯bo।"
6937,"ɐɾe ɪd̪mɐ͡ɪ̯jɐ d̪ɪn, chudu mɐnu boɟɦe nɐ।"
6938,phɔɾe ɐ͡ɪ̯bo।
6939,t̪ɐ͡o̯ ɐbɐɾ kɪ koɾe?
6940,hego mɐgo ʃɐmne koɾe।
