id,string
4345,"t̪ɐɾpɔɾ bolɪche bɔ͡u̯d̪ɪ, ɟɔl khet̪e hɔbe pɾocuɾ, nɐ͡ɪ̯lɪ t̪umɐɾ ʃɔmoʃʃɐ d̪ɐ̃ɽɐe̯ ɟɐbene।"
4346,ɛkhon t̪o।
4347,o͡ɪ̯de hocche ɐmɐɾ ʃɐt̪ ɟed̪ɪn hɔe̯ ʃed̪ɪnɪɾt̪e ɐmɐɾ o͡ɪ̯ puɾoʃɐbeɾ t̪ɾoɾt̪onɐ hocche।
4348,o͡ɪ̯ ɟɔl khɐ͡ɪ̯je khɐ͡ɪ̯je ɾɐkhɪ
4349,ʃe͡ɪ̯ ɟɐgɐɾt̪e mɐne kɔm ho͡ɪ̯je t̪hɐke।
4350,"ɛkhono ɾo͡ɪ̯che, eɾpɔɾe kɪ hɔbe ɟɐnɪ nɐ।"
4351,ɟe͡ɪ̯ ʃumɐ upoʃ t̪hɐkɪ nɪɟ ɟɐlɐe̯ ʃe͡ɪ̯ ʃumɐ bɐ͡ɪ̯d̪e pɔɽe।
4352,koɾt̪ɪcho kɪ?
4353,ɾɐnnɐ koɾt̪ɪchɪ।
4354,ʃoɾɪɾ tɔɾɪɾ bɦɐlo ɐche?
4355,"ɐɾe bɐpu, ɐmɐɾ e͡ɪ̯ ʃugɐɾ ɐche nɐ?"
4356,mɐɟɦe ʃɐnt̪o ɟɐ͡o̯wɐɾ pɔɾ <> ɐbɐɾ bɐ͡ɪ̯ɾe poɽɪche।
4357,kɪ ɐche eɾpɔɾe ɟɐnɪ nɐ।
4358,"ɐɾ e͡ɪ̯hene ʃugɐɾ holɪ t̪o bɪbɦɪnnot̪ɐ d̪ehɐ d̪ee̯, ɛkt̪ɐ nɐ।"
4359,"ɟetuk ʃɐmlɐt̪ɪ pɐɾɪ bɐbɐ ʃɐmlɐe̯ ɾɐhɪ, pɔɾe ɟod̪ɪ nɐ pɐɾɪ t̪o emnɪ͡ɪ̯ t̪o ɪ koɾt̪ɪ hɔbene।"
4360,e͡ɪ̯de o͡ɪ̯je geche bɔŋʃogɔt̪o।
4361,t̪ɐɾfɔɾe ɐmɐɾ ʃɐʃuɽɪɾ o t̪o chɪlo।
4362,o ɟɐmɐ͡ɪ̯ɾ ɐche nɐkɪ?
4363,nɐ ed̪eɾ phɛmɪlɪ ɛkhono kɐɾu d̪ɛkhɐe̯ nɪ।
4364,t̪o bɦɐlo।
4365,e d̪ɦɐɾe ɐmɐɾ ɛk ʃɐʃuɽɪɾ chɪlo।
4366,ɐmɐɾ nonod̪ ɔʃust̪ho howɐt̪e।
4367,uɾɐ d̪u͡ɪ̯ bɦɐ͡ɪ̯।
4368,t̪oɾ ɟɐmɐ͡ɪ̯ɾ t̪o ɐtɐnno bɔchoɾ bɔjoʃ o͡ɪ̯je geche ɛkhono bɦɐlo ɐche।
4369,hummo pɔɾe kɪ ɔbene ɟɐnɪ nɐh।
4370,kɪnt̪u ɐmɐge d̪ehɪʃ।
4371,"o͡ɪ̯ ʃubɦ,ʃɐnt̪o ege howɐɾ ʃɔmbɦɐbnɐ beʃɪ ɔbe।"
4372,ege t̪o bɔŋʃogɔt̪।
4373,ɐɾ bɔŋʃo lɐgt̪ɪche nɐ।
4374,"ɛmon ɐche d̪ɛkh, mɐ bɐbɐɾ kɐɾoɾ ne͡ɪ̯"
4375,t̪ɐd̪eɾ phɛmɪlɪt̪e ɛkɟɔn nɐ ɛkɟɔneɾ ɔe̯।
4376,o͡ɪ̯ ɟe khɐbɐɾ-d̪ɐbɐɾ mejt te͡ɪ̯n nɐ kolɪ e͡ɪ̯ ɔe̯।
4377,ɐmɐɾ mɐɟɦe e͡ɪ̯ mɐne khɐbɐɾ ɛkd̪ɔm gɔɽe <> ।e͡ɪ̯ d̪u͡ɪ̯ t̪ɪn mɐʃ ɐge bɦɐt̪tɐ͡o̯ khɐ͡o̯wɐ poɽɪche beʃɪ।
4378,bɪʃeʃ ko͡ɪ̯ɾe ɐmʃɔt̪t̪o khɐ͡ɪ̯chɪlɐm mɛlɐ।
4379,hɔɾlɪks khɐ͡o̯wɐ poɽɪchelo।
4380,ɛkd̪ɔm ɐmɐɾ d̪oʃe ɐmɪ beʃɪ bɐɽɐe̯ nɪchɪ।
4381,ɐne cɪnt̪ɐe̯ ʃeʃ o͡ɪ̯je ɟɐcchɪ।
4382,nɐlɪ o͡ɪ̯ ʃubɦ ɐ͡ɪ̯che pɪɾɐe̯ kɔe̯ bɔchoɾ!
4383,chɔe̯ ʃɐt̪ b ɐɾɔ͡o̯ beʃɪ।
4384,ɐt bɔchoɾ hoje gelo nɐ ʃubɦ eʃche mone hɔe̯?
4385,"hum, t̪ɐ t̪o o͡ɪ̯che।"
4386,hɛ̃ o͡ɪ̯ ʃumɐ o͡ɪ̯ ʃumɐe̯ ɐmɐɾ d̪ɦɔɾɐ poɽɪchelo।
4387,hɐlkɐ!
4388,ummo mɐne ɛkd̪ɔm mɐpe mɐpe d̪ɦɔɾɐ poɽɪchelo।
4389,t̪ɐ t̪ɐ͡o̯ mone ɔe̯ beʃɪ ɔt̪o।
4390,ɐmɪ mɐne hɐtɐ t̪ɐɾfɔɾe ɾutɪ khet̪ɐm।
4391,o͡ɪ̯ɾɔm kheje teje t̪ɐɾfɔɾe nɔjɔn dɐjbetɪk hɐʃpɐt̪ɐle ɟeje cek ko͡ɪ̯ɾe ɐʃchɪlɐm।
4392,ɐbɐɾ ɐmɐɾ ɐʃuk mɐɟɦe mɐɟɦe ɛkhɐne e͡ɪ̯ʃe mɐɟɦe ettu bɐɽɪchɪlo।
4393,kɪnt̪u d̪ɛkhɐ ɟɐcche d̪u͡ɪ̯ʃɔe̯ gɪlɪ ɔcche t̪umɐɾ ʃugɐɾ puɾodɐ ɐ͡ɪ̯ʃe ɟɐe̯।
4394,ummo ɐɾ nɐ khɐ͡ɐ̯ pete t̪umɐɾ ɔcche nobbo͡ɪ̯ ɾɐkht̪ɪ ɔe̯।
4395,nɔbbo͡ɪ̯ɾ mod̪ɪ।
4396,"ɐɾ okhɐne t̪oɾ chɔjeɾ gɦɔɾe gelɪ hɔe̯, thɪk nɐ?"
4397,"t̪umɪ ɪdɐ o mɐʃɪ, d̪ɔphɐd̪ɐɾge d̪ehɪcho?"
4398,d̪ɔphɐd̪ɐɾge?
4399,ko͡ɪ̯n ɟɐgɐ chɪlo bɐɽɪ?
4400,ɐmɐge bɦɪtejod̪ɔphɐd̪ɐɾge bɦɪte ɐche nɐ?
4401,nɐ go।
4402,ɐmɪt̪o t̪ogeɾ o͡ɪ̯ mɐlɐkɐɾge cɪnɪ।
4403,o͡ɪ̯ phekɪɾɐ chɪlo।
4404,phekɪɾ kɐkɐ chɪlo।
4405,o͡ɪ̯ d̪ɔphɐd̪ɐɾ ɔlo fo͡ɪ̯ɾ bɪʃʃeʃeɾ kɪ ɟɐnɪ ɔt̪o।
4406,fo͡ɪ̯ɾ bɪʃʃeʃeɾ?
4407,um nɐ go।
4408,kon
4409,o t̪o ɔnek ɐgeɾ t̪e t̪hɐkt̪ɪ hɐlkɐ hɐlkɐ chɪlo।
4410,ʃɐnt̪o <> tenʃɔn koɾɐɾ pɔɾe bɐ͡ɪ̯ɾe poɽɪche ʃugɐɾ।
4411,o͡ɪ̯ ɾɐt̪t̪ɪɾɪ ʃɔkɐle ɾutɪ koɾɪ।
4412,phɐʃe chɪlo t̪oge bɐɽɪt̪t̪e t̪ɐ͡ɪ̯ bɔl?
4413,ɐmɐge pukuɾ chelo nɐ?
4414,pukuɾ।
4415,hɛ̃ o͡ɪ̯ phunoɾɪɾ fɐʃe।
4416,phu͡ɪ̯ɾ phɐɽe bole oge bɦɪte।
4417,o pukuɾɪɾ pɐɽe t̪o kɐncɔn chelo।
4418,kɐncɔn nɐ kɪ ɟɛnu oɾ nɐm।
4419,o͡ɪ̯ t̪o uɾɐ d̪ɔphɐd̪ɐɾ <> ʃubɔl bɐgcɪɾ hɐ hɐ hɐ ʃubɔl bɐgcɪɾ bon chɪlo।
4420,kɪ o͡ɪ̯che bɔl?
4421,o͡ɪ̯ ɟɐgɐe̯ ɟomɪ ɔcche ʃoɾɪkɪɾ ɟomɪ ɾo͡ɪ̯che ɐmɐge nɐme।
4422,khɐe̯ t̪o fo͡ɪ̯ɾ bɪʃʃeʃeɾ chɔl।
4423,mɐne ʃɪb bɐbuɾ nɐme ʃe͡ɪ̯tuk kujɐne pɐbɪnɪ?
4424,ʃetuk ɪskulɪɾ pɐʃe।
4425,ne ɐɾ o͡ɪ̯ o͡ɪ̯tuk pɐɾbɪnɪ d̪ɔkhle zet̪e?
4426,d̪ɔkhle ɟɐ͡o̯wɐ ɟɐe̯।
4427,kɪnt̪u o͡ɪ̯ ɟe tɐhɐ xɔɾoɟ kɔɾɐ lɐgbene।
4428,tɐhɐ xɔɾoɟ mɐne tɐhɐ xɔɾoɟ koɾɐɾ lok ɐche।
4429,ʃe lok ɐmɐge ɐche।
4430,hɛ̃ e kɪnt̪u ʃɔmoʃʃɐ ɔcche ɟe uɾɐ khɐe̯ et̪o bɔchoɾ d̪ɦo͡ɪ̯ɾe।
4431,t̪ɐ ɛkhon bo͡ɪ̯le d̪ɛkh।
4432,od̪eɾ kɪ ɟomɪ kɔm ɐche ne͡ɪ̯?
4433,bɔlbɪ kɪ ɟe ɐmɐd̪eɾt̪o ɐpɐt̪t̪ hɐt̪e ne͡ɪ̯ ɐmɐɾ bɐbɐɾ ɟomɪ।
4434,t̪ɐ ɐmɐge ettuk cheɽe d̪ɛ͡u̯।
4435,t̪umɐge t̪o ɔnek ɐche।
4436,ɐmɐɾ bɐbɐ ɔcche ɐkɐɟ koɾɪche͡o̯ɪ ʃumɐe̯ mɛlɐ ɟomɪ chelo t̪o।
4437,hd̪u?
4438,mɐ͡ɪ̯nʃɪɾe khɐlɪ khɐlɪ khɐ͡ɪ̯t̪ d̪eche।
4439,fo͡ɪ̯ɾ bɪʃʃeʃeɾ o͡ɪ̯ɟe ɟe pukuɾ।
4440,ho͡u̯ o͡ɪ̯ pukuɾɪɾ ɔd̪d̪ek ɪ bɦo͡ɪ̯ɾe phɛlɐ͡ɪ̯che ʃɔmɪɾ ʃɐ।
4441,ɐmɐge ɟɐgɐ kɪne eʃɐt̪he।
4442,mɐne o͡ɪ̯ phukuɾɪɾ ɔd̪d̪ek poɟont̪o ɐmɐge ɟɐgɐ chelo।
4443,"kɪnt̪u konod̪ɪn, o͡ɪ̯ t̪o o͡ɪ̯ ʃubɔl bɐgcɪɾ pukuɾɪɾ mod̪ɪ t̪oge ɟɐgɐ chelo।"
4444,t̪ɐ t̪oɾ bɐbɐ t̪o d̪ɔkhle ɟɐ͡ɪ̯ nɪ।
4445,o͡ɪ̯ o͡ɪ̯ d̪ɔphɐd̪ɐɾge bɦɪtee̯ o oɾɔkom o͡ɪ̯che।
4446,d̪ɔkhle ɟɐ͡ɪ̯ nɐ͡ɪ̯ bɦɐgɐ͡ɪ̯ ɐmɾɐ ɟomɪtuk e͡ɪ̯ ɟe
4447,ɟɐmelɐ ɔcche।
4448,ɐɾ ɐmɐɾ bɐbɐ kɔje gechelo bo͡ɪ̯le oge d̪ɪje ɟɐbe।
4449,e͡o̯ne ɐmɪ kɪɾɔm phɪlɪ ɟɐ͡ɪ̯ kɔ͡u̯?
4450,o t̪umɐɾ bɐbɐ o͡ɪ̯t̪o ʃɔbt̪ɐ ɟe mɐne ɪ ko͡ɪ̯ɾe t̪hu͡ɪ̯je cɔle geche।
4451,ɐne ettu ɟomɪɾ d̪ɐm kɪ!
4452,d̪ɐm t̪o d̪ɪn ɟɐʃʃe ɐɾ bɐɽt̪ɪche।
4453,ɐmɐge enɪ ɛk lɐk tɐhɐ o͡ɪ̯ɾe ʃɔt̪o ehon।
4454,t̪ɐ t̪o ɔbe͡ɪ̯।
4455,po͡u̯ɾoʃbɦɐɾ ɟomɪɾ d̪ɐm ɐɾɔ͡o̯ ɾɐst̪ɐ gɦɐt bɐɽɐe̯ pulɔt kɐ͡ɪ̯te bɪkɾɪ kɔt̪t̪ɪche nɐ?
4456,muʃɔlmɐnɾɐ dɦukt̪ɪche।
4457,kɐɟeɾ mod̪ɪ ɔne ɛktɐ bɐɽɪ kɔɾɐ t̪hɐklɪ ɟɐ͡ɪ̯ʃ ɐɾ nɐ ɟɐ͡ɪ̯ʃ bɐbɐɾ bɦɪte dɐ।
4458,ɐɾ okhɐne ɟe kɔe̯ gɦɔɾ ɐche t̪ɐɾɐ unɐɾ <>।
4459,ɐmɐɾ mone ɟɐ bole।
4460,nɐ onɪ t̪o ɐmɾɐ ɟɐgɐ ɾɐkhbo nɐ।
4461,onɪ be͡ɪ̯ce d̪ebo।
4462,ʃɪb bɐbuɾ ɟɐgɐ o be͡ɪ̯ce d̪ebo।
4463,ɟod̪ɪ d̪eɾɪt̪ɪ becpɪ tɐkɐ ɔbe beʃɪ।
4464,tɐkɐ beʃɪ ɔbe।
4465,d̪eɾɪt̪ɪ bɪkɾɪ koɾbɪ।
4466,"ho, tɐkɐ।"
4467,tɐkɐɾ ɟonnɪ͡ɪ̯ t̪o।
4468,"ɐɾe ʃɪstem kɪ ho͡ɪ̯che kɔ͡u̯ d̪ɪ, ɐmɾɐ oɾ d̪ɦɐɾe͡o̯ ɟɐcchɪ nɐ, ɐmɐge lok ɐche, boɟɦcho?"
4469,oɾɐ͡ɪ̯ tɐkɐ d̪ɪje ʃɔb ɟomɪ-ɟɐt̪ɪ nebe ɐɾ oge ettu pɐ͡o̯wɐɾ ɐche।
4470,oge ke͡u̯ kɪchu kɔt̪ɐ͡o̯ pɐɾbe nɐ।
4471,"ɐmɪ ʃɐmne͡o̯ ɟɐbo nɐne, ɪ koɾbo nɐne।"
4472,"unɪ ɟɐ pɐɾe koɾbene, ɛk kɐkɐ ɐche।"
4473,d̪uphuɾɪ bɦɐt̪ khɐ͡ɪ̯।e͡ɪ̯bɦɐbe cɔlot̪ɪche।
4474,ɾɐt̪t̪ɪɾɪ kɪ khɐ͡o̯?
4475,ehone o͡ɪ̯ d̪u͡ɪ̯de ɾutɪ khɐbɐnɪ ettu।
4476,ʃoɾɪjdɐ bɦɐlo nɐ।
4477,kɪɾɔm o͡ɪ̯ ɐmɐɾ t̪o bɐɽe nɐ।
4478,ɪbɐɾɪ bɐ͡ɪ̯ɽe phoɽɪche।
4479,kɐkɐɾɐ ɔnek pɾobɦɐbʃɐlɪ।
4480,"t̪oge kɐlɪjɐ, mone koɾod̪ɪ kɪnɐɾ mɔt̪o ʃeɾom ɟomɪ ɐche?"
4481,kɐlɪjɐe̯?
4482,tɐkɐ d̪ɪje ɪttu kɪchu kɪne ɾɐkhlɪ।
4483,"hum, ɐche t̪o, bɦɐlo bɦɐlo ɟomɪ ɐche।"
4484,"o͡ɪ̯ d̪ehɪʃkene, d̪u͡ɪ̯tuk bɪkɾɪ ko͡ɪ̯ɾe d̪ɪje d̪ɛkho e͡ɪ̯ ɔlkɪktu ɾɐkht̪ɪ pɐɾɪs nɪkɪ।"
4485,kɐlɪjɐe̯ t̪hɐkɐɾ ɪcche nɐ͡ɪ̯।
4486,khulnɐe̯ ɟomɪ ɾɐhɐɾ bɦɐɾɪ ɪcchɐ।
4487,okhɐne t̪o ɾɐkht̪ɪ pɐɾlɪ kono ʃɔmoʃʃɐ͡ɪ̯ nɐ͡ɪ̯।
4488,nɪɾɪbɪlɪ t̪hɐklɪ।
4489,"bɦɐɽɐ d̪ɪje͡o̯, tɐkɐ ɐche, ʃɔb d̪ɪk d̪ɪje।"
4490,"cɔlɐcɔlt̪ɪ, khɐ͡o̯wɐ-d̪ɐ͡o̯wɐ ʃɔb d̪ɪk d̪ɪje ʃɐnt̪ɪ ɐche khulnɐɾ bɐɽɪ।"
4491,khulnɐe̯ bɦɐɾɪ mɔɟɐ।
4492,"khulnɐe̯, kɐlɪjɐe̯ ɟɔt̪o xɔɾoɟ nɐ hɔe̯ kɐlɪjɐe̯ t̪ɔt̪o kɔm xɔɾoɟe bɐ͡ɪ̯ce t̪hɐhɐ ɟɐe̯।"
4493,"ɐɾe, okhɐne mɐch-tɐch d̪ɪje hɪʃebe ʃɔb kɪchu।"
4494,"ʃɔbɟɪɾ cɐʃ ɐche bɦɐlo, mɐcheɾ cɐʃ ɐche bɦɐlo।"
4495,"khulnɐ t̪umɐɾ ɔt̪o ʃuhuɾe elɐkɐ nɐt̪o, t̪umɐɾ dɦuklɪ t̪umɐɾ mone hɔbe kɪ ɐmɪ kɐlɪje͡ɪ̯ɪ ɐchɪ।"
4496,"bɦɐlo poɾɪbeʃ, bɦɪɽ-bɦɐttɐ ɐche, lokɟɔn ɐche ɐɾ ɐmɐge o͡ɪ̯ kɐlɪjɐ-mɐlɪjɐ bɦɐlo thehe ehone।"
4497,mɐɾe ɛkɐ ɛkɐ t̪hu͡ɪ̯je ɐʃt̪ɪ ɪcche ɔɾot̪ɪche nɐ।
4498,"cɐ͡ɪ̯chɪ ɟɐgɐ kenobo, t̪ɐpɔɾe bɪd̪eʃ, ɐ͡ɪ̯͡ɪ̯eltɪ͡e̯s ko͡ɪ̯ɾe bɐ͡ɪ̯ɾe ɟɐ͡o̯wɐɾ ettɐ ɪcche chelo।"
4499,t̪ɐ mɐɾe ɛkɐ phelɐ͡ɪ̯je ɟɐ͡o̯wɐɾ kɐjd̪ɐ nɐ͡ɪ̯।
4500,"nɐ, o͡ɪ̯ tenʃɔn, tenʃɔne ɐmɐɾ mɔt̪ hɔbene।"
4501,"ɐmɐɾ e͡ɪ̯ɟe, ɔlpo bɔjoʃe khɐlɪ tenʃɔn pɐt̪ɪ pɐt̪ɪ <>।"
4502,t̪oɾ mɐɾ hocche d̪ɦo͡ɪ̯ɾɟo ʃɔmɐt̪ɐ beʃɪ।
4503,buɟɦɪchɪʃ।
4504,"ʃe͡ɪ̯ kɔt̪hɐ ʃubɦ bole ɟe, d̪eho meɟo mɐʃɪ kɪ ʃɔho koɾe, kɪ koɾe, t̪umɐge d̪ɦo͡ɪ̯ɾg nɐ͡ɪ̯।"
4505,ehon t̪o ɟɐ͡o̯wɐɾ pɔɾe khɐ͡o̯wɐ-gɦum ʃɔb hɐɾɐm।
4506,ɐmɐɾ ʃe kɪ khɐɾɐp lɐge।
4507,e koɾt̪ɪ koɾt̪ɪ ɐmɪ ʃe ɾuge d̪ɦo͡ɪ̯ɾe gechɪ।
4508,"ɐɾ o͡ɪ̯ ɟɐ͡ɪ̯ʃ nɐ, t̪u͡ɪ̯ ɛkɐ, t̪oɾ bɐbɐ nɐ͡ɪ̯।"
4509,t̪u͡ɪ̯ co͡ɪ̯le gelɪ t̪oɾ mɐ ʃeʃ।
4510,kɪɾom lɐge?
4511,e͡ɪ̯ɟe ɛkhon buɟɦɪ।
4512,kono kɪchu khet̪e gelɪ khet̪e pɐɾt̪ɪchɪ nɐ।
4513,"e͡ɪ̯ ʃɔnd̪ɦɐ lɐglɪ mɐ tɪphɪn ko͡ɪ̯ɾe d̪e͡o̯, edɐ ettu koɾo, odɐ ettu koɾo bɐɽɪ ɐʃɐɾ ʃɐt̪he।"
4514,"e ɾɐnnɐ nɐ koɾlɪ khɐbo nɐne, kɪ ɟɔlɐn ɟɐlɐ͡ɪ̯che!"
4515,ehon e͡ɪ̯ khɐ͡o̯wɐjɔɾ lok ne͡ɪ̯।
4516,t̪oɾ meʃo t̪o emnɪt̪e khɐe̯ nɐ bɦɐlo ettɐ kono kɪchu।
4517,kono ʃumɐ moneɾ bɦɪt̪ɔɾ bɦɐlo lɐge nɐ।
4518,t̪oɾ meʃoɾe t̪ɐ͡ɪ̯ kɔcchɪ ettu pɐʃpoɾt ko͡ɪ̯ɾe d̪ɪjene।
4519,lɐ͡ɪ̯nɪ ɐchɪʃ?
4520,"ɐmɪ ko͡ɪ̯chɪ, pɐʃpoɾt ko͡ɪ̯ɾe d̪ɪjene, bɐbɐɾ bɦɪtedɐ mɔɾɐɾ ɐge d̪e͡ɪ̯khe ɐʃɔb।"
4521,"kɐɾon ɐmɐge kono gɪɾɐntɪ nɐ͡ɪ̯, kon ʃumɐ stɔk mɪstɔk koɾɪ।"
4522,bɐ͡ɪ̯d̪e pɔɽɐɾ pɔɾet̪t̪e kɪɾom ɟɛnu ʃɐɾɪldɐ d̪uɾbol d̪uɾbol chɐɽɐcche nɐ।
4523,o e͡o̯n ɔt̪ɪɾɪkt̪o o͡ɪ̯je gɪchɪlo।
4524,d̪u͡ɪ̯ʃo phucɐʃɪ mɐne t̪ɐl khɐ͡ɐ̯ phoɽɪchɪlo
4525,mo͡ɪ̯ɾe gelɪ t̪o bɐ͡ɪ̯ce gɪlo।
4526,<> co͡ɪ̯le gelɪ t̪o bɐ͡ɪ̯ce gelɐm kɪnt̪u bɦogtɐ͡ɪ̯ t̪o bɦɔe̯ pɐ͡ɪ̯।
4527,ɐmɐɾ kɔt̪hɐ͡o̯ t̪ɐ͡ɪ̯।
4528,"t̪oɾ d̪ɪd̪ɪmɐɾe t̪o ʃɔbɐ͡ɪ̯ d̪ekht̪ɪche, ɐmɐɾe kɪdɐ d̪ekhbe bɔl?"
4529,d̪ekhɐɾ lok ho͡ɪ̯je ɟɐ͡u̯।
4530,"kɪnt̪u ɐʃole o͡ɪ̯ ɟe koʃto, nɪɟɪɾ ɟe koʃto o͡ɪ̯tuk ʃɐmlɐnɪ͡ɪ̯ t̪o।"
4531,"ɐmɾɐ d̪ekhɪ, ɐmɐd̪eɾ ʃugɦo nɪje ɐmɾɐ d̪ekhɪ, ɐɾ ɾɪt̪e d̪ɛkhe bɦɐb ɐlɐd̪ɐ।"
4532,ɐmɾɐ t̪o e͡ɪ̯ ɟe pesent eɾ kɐɟ koɾɪ।
4533,ɐmɐge ɟut̪ mɔt̪on ɐmɾɐ ko͡ɪ̯ɾe ɐʃɪ।
4534,nɪɟeɾ d̪ɛkhɐ ɐɾ pɔɾeɾ lok d̪ɛkho konod̪ɪn ɛk hɔe̯ nɐ।
4535,ʃubɐɾt̪ɐ kɪ koɾe ɟɐnɪʃ?
4536,<> bon।
4537,ɛmon ɐche pesentɾe mɐne bɔjoʃko lokɾe lɐthɪ d̪ɪje pɪtɐt̪ɪ co͡ɪ̯le ɟɐe̯।
4538,bɐbɐɾe!
4539,o bekɐjd̪ɐ।
4540,ɐmɐɾ d̪ɾɐɾɐ oʃɔb-esbo hɔbe nɐ।
4541,ɐmɪ pɐɾɪ nɐ bo͡ɪ̯le t̪o ɐmɪ d̪uɾe ɟɐ͡ɪ̯ nɐ।
4542,"o bekɐjd̪ɐ, bɦugɪ bɐlɐɾ mɐ͡ɪ̯jeɾ hocche bɪʃɐl ʃɐhʃ।"
4543,"bɦo͡ɪ̯ge bɐlɐɾ t̪o meje ettɐ ɐche, ɟɔʃoɾ t̪hɐke।"
4544,"oɾɐ d̪ujo bun ɔɾpɔnɐ o d̪ɐ̃ɽɐe̯ geche, ʃund̪ɔɾɐ o e͡ɪ̯ ɐjɐɾ kɐɟ ko͡ɪ̯ɾe <>।"
4545,"bekɐjd̪ɐ, ɔ͡ɪ̯t̪ɪ oɾ mɐ͡ɪ̯je o bekɐjd̪ɐ ɟɪnɪʃ।"
4546,"cɪnt̪ɐ koɾt̪ɪ pɐɾɪs, oɾ bɦɐ͡ɪ̯ɾɪ ektu ʃɔmpot̪t̪ɪ d̪ɪ nɪ, choto bontɐɾe͡o̯ d̪ɪ nɪ।"
4547,ɛkɐ ɛkɐ d̪ɔkhɔl ko͡ɪ̯ɾe kheje necche।
4548,"hum, o͡ɪ̯ ɔɾpɔnɐɾ"
4549,ɔɾpɔnɐɾ mɐ͡ɪ̯jeɾe choto belɐ mɐ d̪ehɪchɪlo t̪o।
4550,"mɐ bole mone mone ɐmɐɾ ɟonnɪ thɪk ko͡ɪ̯ɾe ɾɐhɪchɪlo, ebɐɾ bɐbɐɾ xɔɾze ɐ͡ɪ̯che hɛ, ʃe ɐbɐɾ genɟɪ hɐph pɛnt chɐɽɐ pɔɾe nɐ।"
4551,o͡ɪ̯ d̪e͡ɪ̯he mɐ।
4552,e͡ɪ̯ d̪eʃe ɐʃe t̪o mɐɟɦe mɐɟɦe।
4553,"hɔe̯, o͡ɪ̯ d̪eʃe ɟɐe̯ t̪o mɐɟɦe mɐɟɦe।"
4554,"pɔɾe mɐ o͡ɪ̯ d̪e͡ɪ̯he bɦɔe̯ pɐ͡ɪ̯che, kɔe̯ oɾe bɐbɐ!"
4555,ɐmɪ ɟe͡ɪ̯hɪnɪ ɟɐ͡ɪ̯ ʃehɪnɪ ɐbɐɾ ɐʃɔɾ ɟɔmɐe̯ phelɐt̪ɪ pɐɾɪ।
4556,ehone kɔjd̪ɪn ɐge।
4557,"hɛ̃, o ɔɾpɔnɐɾ meje͡o̯ bɪʃɐl cɐlu, t̪umɪ͡o̯ eɾom o t̪ɛmon।"
4558,"t̪umɪ ɪttu ɐmɐɾ kɔt̪hɐ ʃu͡ɪ̯ne, ɟod̪ɪ konod̪ɪn d̪ehɐ hɔe̯।"
4559,ɟe guddu ɾe ceno?
4560,d̪e͡ɪ̯hene kɪ kɔe̯।
4561,"ɟe o hocche bɐnd̪ɔɾ, bɐnd̪ɔɾ kɔe̯।"
4562,o͡ɪ̯ chobɪt̪ɪ d̪ekhɪchɪ ɐmɐɾe ɪdɐ mɐne kɔbɪt̪ɐ͡o̯ bolɪchɪlo।
4563,kɔbɪt̪ɐ bolɪchɪlo ɟe ɪdɐ cɔnd̪oneɾ ʃɐt̪he ɔɾpɔnɐɾ mɐ͡ɪ̯je।
4564,"ɐmɪ kɔcchɪ oge ɟɐt̪, oge t̪ɔlɐe̯ thɪk ɐche, t̪oɾ o͡ɪ̯ nɪje tenʃɔn koɾt̪ɪ hɔbe nɐ।"
4565,"ɐɾe nɐ, o mɐ pɛkɐɾ pɛkɐɾ koɾɪchelo।"
4566,"ɐmɐɾ ʃɐt̪he emnɪ mɛlɐ kɔt̪hɐ-t̪hɐ hot̪o, phone kɔt̪hɐ kɔt̪ɐm, t̪ɐɾpɔɾe e͡ɪ̯ɟe d̪ehɐ tehɐ koɾt̪ɪ ɟɐt̪ɐm।"
4567,o͡ɪ̯ poɾɟont̪o͡ɪ̯ t̪ɐɾpɔɾe ɐɾ ɔɾɪ ne͡ɪ̯।
4568,ɛkhon cɪhɐɾɐ kɛmon ho͡ɪ̯che?
4569,d̪olɐɾ cɪhɐɾɐ kɛmon ho͡ɪ̯che?
4570,"cɪhɐɾɐ t̪o mutɐmutɪ mɐne uco-lɔmbɐ, bɔdɪ phɪgɐɾ bɦɐlo mɐne mɛlɐ uco।"
4571,"o mɐ-bɐbɐ t̪o uco-lɔmbɐ, o͡ɪ̯de t̪o hɔbe͡ɪ̯।"
4572,emnɪ gɐ'ɾoɾ ɾɔŋ ot̪o phɔɾʃɐ nɐ।
4573,"ʃɐɟlɪ, ʃɐɽɪ-tɐɾɪ poɽɪlɪ bɦɐlo d̪ehɐ ɟɐe̯ kɪnt̪u ot̪o bɦɐlo cɪhɐɾɐ nɐ।"
4574,ettu ɐmʃɔt̪t̪o।
4575,d̪u͡ɪ̯ʃo phucɐʃɪ ho͡ɪ̯je gɪchɪlo bu͡ɪ̯chɪʃ?
4576,"t̪ɐɾfɔɾe, mɐpɐɾ pɔɾe d̪ɦoɾɐ phoɽlɪ bɛm ɐtɐ cɔlɐɾ pɔɾe phɪɾe"
4577,kɪnt̪u ucco lɔmbɐ।
4578,bɔdɪ phɪgɐɾ bɦɐlo।
4579,e͡ɪ̯ ʃɪkkɪt̪o t̪o ɐche।
4580,kɪnt̪u ɪje nɐ͡ɪ̯।
4581,mɐne ɔt̪o cɪjɐɾɐ bɦɐlo nɐ।
4582,cɪjɐɾɐ mɪʃtɪ bɦɐb nɐ͡ɪ̯।
4583,ɔnek ɐche nɐ?
4584,kɐlo olɪ͡o̯ ettɐ mɪʃtɪ bɦɐb t̪hɐje t̪ɐ nɐ eɾ ettɐ bɪtɐ bɪtɐ bɦɐb।
4585,"hɔe̯, u oɾ mɐɾe t̪o d̪ekht̪ɪ khɐɾɐp ɐ ɔɾpɐɾe ɛkd̪ɔm khɐɾɐp lɐge nɐ d̪ekht̪ɪ।"
4586,o͡ɪ̯ ɐmɐɾ mɐ t̪o।
4587,ɐmɐɾ mɐ ɐbɐɾ ettu kɛmon kɛmon nɐ?
4588,"ʃe ʃɔɾoʃɪ ɛkd̪ɪn ɔɾpɐn mɐʃɪɾe kɔcche, t̪ot̪t̪o t̪ot̪t̪o kɔphɐl bɦɐlo।"
4589,o͡ɪ̯ guphɐl ɐ͡ɪ̯chelo।
4590,guphɐlɾe konphɪlɪ ɪje͡ɪ̯ɾe phɛlɐ͡ɪ̯chɪʃ।
4591,bɐge ɐ͡ɪ̯ne phɛlɐ͡ɪ̯chɪʃ nɐ͡ɪ̯t̪o t̪oɾe bɪje ɔt̪t̪o kɪdɐ?
4592,t̪oɾɐ ɟɐ d̪ɪhɐ ɟɐt̪o।
4593,ɐmɐɾ mɐ kɔe̯ mɐɟɦe mɐɟɦe oɾe।
4594,ʃɐmonɐʃɐmonɪ bo͡ɪ̯le phe͡ɪ̯le d̪ee̯।
4595,"ho, ɐmɐɾ mɐɾ ɐbɐɾ e͡ɪ̯ bɔd̪ ɔboʃʃɐʃ ɐche।"
4596,"kɪ kot̪ɪ kɪ kɔe̯, ko͡ɪ̯je phelɐe̯ d̪ee̯।"
4597,bɐbɐgo bɐ।
4598,"kɔpɐle ɟɐ t̪hekɐ͡e̯, kɔpɐle ɟod̪ɪ ʃund̪ɔɾ bɔɾ t̪hɐke t̪ɐ͡ɪ̯ ɟote।"
4599,nɐ͡ɪ̯le ʃot̪t̪o kɔt̪hɐ kɪ
4600,d̪ɪlɐm।
4601,d̪ɪjɐɾ pɔɾe ɛkʃo ʃɔt̪t̪uɾɪ ɐ͡ɪ̯che khɐ͡o̯wɐɾ phɔɾe।
4602,ɐɾ nɐ khɐ͡o̯wɐɾ phɔɾe ecche nɐ khɐ͡o̯ pẽte ɔcche ɛkʃo t̪ɪɾɪʃ buɟɦɪchɪʃ?
4603,o͡ɪ̯ bɛjɐm
4604,ɐm ɐɾ ɐm ʃokt̪o।
4605,ɐmɐɾ ʃɐt̪he emnɪ bɦɐlo ʃɔmpoɾko।
4606,pɔɾe ene ɐbɐɾ kɪ koɾe?
4607,ɐmɪ ɐbɐɾ
4608,hɔe̯ t̪oɾ
4609,kɪ ɔɾot̪ɪcho?
4610,"pɔɽt̪ɪchɪ, t̪umɪ kɪ ɔɾot̪ɪcho?"
4611,t̪umɐɾ pɾɪkkhɐ ɾo͡ɪ̯che kɐ͡ɪ̯lke?
4612,"ho, kɐ͡ɪ̯lke bɐjolɟɪ pɾɪkkhɐ।"
4613,"ɐpɐt̪o kɪchu koɾt̪ɪchɪ nɐ, ɐpɐt̪o ɐmɪ t̪umɐɾ ʃɐt̪he kɔt̪hɐ kɔcchɪ।"
4614,ɟɐno kɪ ho͡ɪ̯che?
4615,"ɐɟke ɐmɐge meʃe ɐbɐɾ ɟɦɐmelɐ ho͡ɪ̯che, boɟɦcho?"
4616,mɐne o͡ɪ̯ bɐtɪ d̪ɪje ɐ͡ɪ̯chɪ t̪ɔɾkɐɾɪ ɾɐnnɐɾ ɟonnɪ ʃe͡ɪ̯ bɐtɪt̪ɪ t̪ɔɾkɐɾɪ d̪eche।
4617,ʃe t̪ɔɾkɐɾɪ hocche ɔnno ɛkɟon nɪje geche ɐmɐɾ bɐtɪ d̪ɦo͡ɪ̯ɾe।
4618,"eɾpɔɾ eʃem͡e̯s d̪ɪchɪ guɾupɪ ɟe, kɪdɐ neche, kɪdɐ neche t̪ɐ͡ɪ̯ ʃunɐɾ ɟonnɪ"
4619,pɔɾe ɟɐ͡ɪ̯je kɐloke mone hɔe̯ meʃeɾ mɪtɪŋ ɾo͡ɪ̯che।
4620,"ɟod̪ɪ bɦɐlo thehe t̪ɐlɪ ɟɐbɐnɪ, ɟod̪ɪ bɦɐ nɐ thehe t̪ɐlɪ ɟɐbo nɐne।"
4621,"kɐɾon, ɐmɐɾ pɾɪkkhɐ।"
4622,e͡ɪ̯ t̪ɐl bɐhɐn ko͡ɪ̯ɾe lɐbɦ ɐche?
4623,"ɐɾ ɟod̪ɪ d̪ɐd̪ɐɾ kɐche ɐbɐɾ nɐlɪʃ d̪ee̯, ebɐɾ d̪ɐd̪ɐ ɟod̪ɪ ɐmɐɾe dɐhe d̪ɐd̪ɐɾ ʃɐt̪he cɪllɐbɐnɪ,mɪɟɐɟtɐ khɐɾɐp ho͡ɪ̯je ɟɐe̯, pɾot̪ekbɐɾ ɛkek t̪ɐl bɐhɐnɐ h"
4624,"nɐ, ebɐɾ t̪o oɾ mɐɾ beʃɪ kɔt̪hɐ ʃonobe।"
4625,"ɛk hocche, ɐpnɐɾ t̪ɐ t̪o neche, sɪnɪjoɾeɾ muhɪ muhɪ t̪ɔɾko"
4626,t̪ɔɾko koɾe ɔ͡ɪ̯t̪o।
4627,"t̪ɐpɔɾe nɪɟɪ not̪o ʃɪkɐɾ koɾbe nɐ, nɪɟɪɾ <>।"
4628,"hɔe̯, e͡ɪ̯de hocche kɔt̪hɐ।"
4629,mɐne ʃund̪ɔɾbɦɐbe bɦɐlo phɪle kolɪ kɪnt̪u bɦɐlo bɦɐbe cu͡ɪ̯ke ɟɐe̯ ɟɪnɪʃtɐ।
4630,"nɐ, oɾ t̪ɔɾko ɔɾot̪ɪ hɔbe।"
4631,<> mejɐɟtɐ khɐɾɐp hoje geche।
4632,kebol ho͡ɪ̯che ɪntɐɾ phɐɾst ɪjɐɾe pɔɽe t̪ɐ͡o̯।
4633,t̪u͡ɪ̯ ɐbɐɾ muhɪ muhɪ t̪ɔɾko ɔɾɪʃ keno?
4634,kɪ ʃɐhoʃ!
4635,"ʃɐhʃ nɐ mɐne, bɦɐɾɪ ɛkkhɐn ɪ d̪ehɐcche।"
4636,<> khɐlɐmonɪɾ <>।
4637,"t̪ɐ͡ɪ̯ khɐlɐmonɪɾe kɔlɐm kemol, t̪ɐ͡ɪ̯ khɐlɐmonɪ hocche o͡ɪ̯ɟɐgɐ kɔt̪hɐ kɔcche।"
4638,t̪ɐ kɔcche t̪u͡ɪ̯ ettu kɔt̪hɐ kot̪ɪ t̪hɐk।
4639,kɪ ɔ͡ɪ̯ɾe mo͡ɪ̯ɾe geche?
4640,"mɐne, khulnɐ-xubonɐ nɐ ɟɔʃoɾ"
4641,ɐd̪-d̪ɪnɪ ho͡ɪ̯che।
4642,holɪ oɾɐ kɐ̃ceɾ gɦɔɾe ɾɐ͡ɪ̯he mɛlɐ tɐkɐ neche।
4643,nɪje-tɪje ɛkd̪ɪn d̪upuɾɪ t̪ɐ͡ɪ̯ chɐɽɪche।
4644,kɔbe chɐɽɪche t̪ɐ ɟɐnɪ nɐ।
4645,"kɔjd̪ɪn pɔɾe mone hɔe̯, cɐɾ-pɐ̃c d̪ɪn pɔɾe chɐɽɪche।"
4646,"d̪upuɾ belɐe̯ hɔthɐt̪ ko͡ɪ̯ɾe kɔcche ɟe, nɪje ɟɐn ɐpnɐge bɐccɐ।"
4647,ɐɽɐ͡ɪ̯ keɟɪ ho͡ɪ̯che।
4648,ʃust̪ho।
4649,kɪchu kɔe̯ nɐ͡ɪ̯ ɟe kono ʃɔmoʃʃɐ ho͡ɪ̯che bɐ kɪ?
4650,"emnɪ kɐ̃ceɾ gɦɔɾe ɾɐkhɪche, ɐge ɐge ho͡ɪ̯chɪlo mone hɔe̯ ʃeɟonnɪ।"
4651,kɔt̪o bɐccɐge͡ɪ̯ t̪o kɐ̃ceɾ gɦɔɾe ɾɐhe।
4652,"ɐnɐnɾe ʃe kɐ̃ceɾ gɦɔɾe ɾɐkhlo, ʃɪʃu hoʃpɪtɐle nɪt̪ɪ holo, kɔt̪o ɟɦɐmelɐ holo।"
4653,t̪ɐ pɔɾe
4654,kɪ eɾɪche।
4655,ɔʃust̪ho t̪ɐ kɔcche ɟe nɪje ɟɐn।
4656,t̪ɐ͡ɪ̯ kolɪ nɪjɐ͡ɪ̯che।
4657,ɐnɐɾ phɔɾe ɪsɪ ʃɔnd̪ɦɐɾ phɔɾe mɐɾɐ geche।
4658,ɪʃ d̪uphuɾɪ nɪje geche bɐɽɪ।
4659,emnɪ͡ɪ̯ goɾɪb mɐnuʃ t̪ɐɾfɔɾe ɔt̪o kɔɾu tɐkɐ nɪje gɛlo।
4660,k kɪɾom lɐge?
4661,cɔbbɪʃ hɐɟɐɾ nɐ kɔe̯ tɐkɐ neche।
4662,ɐɾe ɐllɐh ɾe!
4663,t̪ɐɾfɔɾe ɐɾ ɔcche ɔnek ɟɐneɾ kɔʃto d̪eche।
4664,"hummo, bɐɽɪ nɪjɐ͡ɪ̯che?"
4665,"hɔe̯, o͡ɪ̯d̪ɪn bɐɽɪ nɪjɐ͡ɪ̯chelo।"
4666,ɐnɐɾ pɔɾe mɐɾɐ geche।
4667,pɔɾe thɪk
4668,ʃe͡ɪ̯de ɟɐnɪ nɐ।
4669,t̪ɐ khɐlɐmonɪ ʃunt̪ɪche।
4670,t̪ɐ͡ɪ̯ ʃu͡ɪ̯ne kɔcche t̪ɐ͡ɪ̯ ɐmɪ ettu kɔt̪ɐ ko͡ɪ̯।
4671,ɐɾ ɾonɪɾ bɐccɐ thɪk ɐche?
4672,kɪ e͡ɪ̯che ʃonoben?
4673,ɐmɐɾ d̪ɛkhlɐm ɟe kɔphɐldɐ͡ɪ̯ puɽɐ।
4674,bɐnd̪obɪge bɪje ɔcche thɪkɪ
4675,kɪnt̪u ɐmɐɾ kɔphɐle ɟutt̪ɪche nɐ।
4676,d̪ɐ͡o̯jɐt̪ o phɐcchɪ nɐ।
4677,bɐnd̪obɪge bɪje khɐ͡o̯wɐɾ et̪o ʃɔk।
4678,e͡ɪ̯ɟe e͡ɪ̯ ɪdɐɾe bɪje d̪ɪje d̪elo।
4679,ɐbɐɾ e͡ɪ̯ t̪ɪn t̪ɐɾɪkɪ ɔcche ɐɾetɐɾ bɪje।
4680,phon d̪echelo ɟe kɔbe bɐɽɪ ɟɐbo।
4681,gɪlɪ ɐmɐge bɐɽɪ d̪ɐjɐt̪ kɔt̪t̪ɪ ɟɐbe।
4682,kɔcche kɪ t̪oɾ kɪnt̪u ɐʃt̪ɪ hɔbene।
4683,nɐ kot̪ɪ pɐɾbɪ nɐ।
4684,ɾɐnɪɾ bɪjet̪e ucholɔt̪
4685,t̪ɐ pɔɾe ɟɐ͡ɪ̯je kono ɾesponʃo nɐ͡ɪ̯।
4686,"pɔɾe ɟɐ͡ɪ̯je ɟe mejedɐ meʃeɾ d̪ɐjɪt̪t̪e ɾo͡ɪ̯che d̪u͡ɪ̯t̪ɐlɐe̯, ʃe eʃem͡e̯s d̪eche, kɔcche ɟe ɐpu ɐmɪ t̪o eɾom bɦɐbe d̪ehɪchɪlɐm mɐne d̪ot̪ɐlɐɾ ke͡u̯ neche kɪnɐ?"
4687,t̪ɐ mɐɾ mone hɔe̯ nɐ d̪u͡ɪ̯ t̪ɐlɐɾ- t̪ɪn t̪ɐlɐɾ ke͡u̯ neche।
4688,d̪ɛhɐlɪ ɟe bɦɐ͡ɪ̯ɾ bɪje।
4689,ebɐɾ kɪnt̪u kono ucholɔt̪ d̪ɛhɐt̪ɪ pɐɾbɪ nɐ।
4690,t̪ɪn t̪ɐɾɪkɪ ɪjɐʃmɪnɪɾ o mone ɔe̯ bɪje phɛlɐ͡ɪ̯che।
4691,ɪjɐʃmɪnɪɾ ɐbɐɾ bɪje thɪk?
4692,ɪjɐʃmɪnɪɾ bɪje ɐʃole hɔbdɐ kon ɟɐgɐ ɐmɐɾe ettu t̪ɐ͡ɪ̯ k d̪ɪn?
4693,"t̪ɐ͡ɪ̯ ʃu͡ɪ̯ne nɪ͡ɪ̯jɐʃmɪnɪɾ bɪje ,ɪjɐʃmɪnɪɾ bɪje ot̪ɪ ot̪ɪ ɐmɾɐ bɽɪ ho͡ɪ̯je gɪlɐm।"
4694,"kɔbet̪t̪e d̪ɦo͡ɪ̯ɾe ʃunt̪ɪchɪ khɐlɪ ɪjɐʃmɪnɪɾ bɪje , ɪjɐʃmɪnɪɾ bɪje।"
4695,khɐlɐmonɪkhɐlɐmonɪ buɟɦt̪ɪ pɐt̪t̪ɪchɪ nɐ।
4696,khɐlɐmonɪ t̪hɐklɪ nete ɟɐmelɐ ɔcche।
4697,khɐlɐmonɪ nɪɟɪ͡ɪ̯ bɐd̪ɦɐɾ ʃɾɪʃtɪ kɔt̪t̪ɪche ne͡ɪ̯ nete?
4698,et̪o bɐ͡ɪ̯d̪e bɐ͡ɪ̯d̪e ɟɐʃʃe!
4699,"ɟɐnnɐt̪ɪ, t̪u͡ɪ̯ t̪hɐ͡ɪ̯he t̪hɐ͡ɪ̯he eɾom phɪlɪ t̪hɐ͡ɪ̯me ɟɐcchɪʃ।"
4700,ɔʃɔd̪ɦo d̪ɦo͡ɪ̯ɾe ɟɐʃʃe।
4701,"ɐɾ kɔt̪okkhon d̪ɐ̃t̪ bɐ͡ɪ̯ɾ ko͡ɪ̯ɾe, t̪u͡ɪ̯ kɪ kɔt̪hɐ ʃunt̪ɪ pɐt̪t̪ɪchɪʃnɐkɪ kɔt̪hɐ ʃunt̪ɪ pɐt̪t̪ɪchɪʃ nɐ?"
4702,ɐ͡ɪ̯ɟke ɐmɪ ɐbɐɾ ɐmɐɾ kɪɾɐʃ ke mɛʃeɟ d̪ɪchɪlɐm।
4703,t̪ɐɾ o͡ɪ̯ɟe ʃobuɟ tɪʃɐɾt phɔɾɐ?
4704,ɪʃtoɾɪ d̪e͡ɪ̯he
4705,<> ho ho!
4706,ettɐ ɟɐɾsɪ pho͡ɪ̯ɾe chobɪ d̪eche।
4707,oɾe bɦɐbɐ ɾe bɦɐbɐ!
4708,ɐ͡ɪ̯ɟke kɪɾɐm ɟɛnu mone ɔlo kɪ ɟe ɪʃɪt̪t̪e ɐʃɐɾ ʃumɐe̯ khulɐnt̪t̪e ɐʃɐɾ ʃumɐe̯ oɾ ʃɐt̪he d̪ɛkhɐ ho͡ɪ̯chelo।
4709,mɐne d̪ɛhɐ ɔlo ʃeɾom mone ɔlo।
4710,cɔnd̪on ɐbɐɾ dɐk d̪elo।
4711,ɟoɾe ɟoɾe ɐpnɪ et̪o kɪ͡u̯t kɛn?
4712,t̪ɐ bolt̪ɪche
4713,kɪ kɪ?
4714,buɟɦɪ nɐ͡ɪ̯ pɪchone।
4715,d̪ehɪ dɐtɐ ɔn ko͡ɪ̯ɾe nɪ।
4716,hɛ̃ lo।
4717,t̪ɐ͡ɪ̯ d̪ɐɽɐ͡u̯ d̪ɪ kɐnekt ɔcche ɐʃolɪ ɐbɐɾ co͡ɪ̯le
4718,ɐɾe t̪umɪ ɐʃolɪ net et̪o phoɾɪmɐn bɐd̪t̪ɪche kɪʃɪɟɔnnɪ?
4719,e!
4720,kɪ phoɾɪmɐn bɐd̪t̪ɪche।
4721,o mɐ।
4722,nɐ ɐɾe t̪umɐge net
4723,ʃɔmoʃʃɐ nɐ ɐmɐɾ nete ʃɔmoʃʃɐ ɾe mɐ!
4724,ɐmɐɾ nete ʃɔmoʃʃɐ ɔcche।
4725,e͡ɪ̯ ɟonnɪ kɔt̪hɐ kot̪ɪ kɪchu ʃunt̪ɪ pɐt̪t̪ɪchɪ nɐ।
4726,nɐ t̪umɪ ʃunt̪ɪ pɐt̪t̪ɪcho।
4727,nɐ ɐmɪ ʃunt̪ɪ pɐt̪t̪ɪchɪ।
4728,kɔt̪hɐ co͡ɪ̯d̪d̪oʃo bɐɾ bɐd̪t̪ɪ͡ɪ̯ ɐche ɛt̪t̪obɐɾ bɐ͡ɪ̯d̪e ɟɐʃʃe।
4729,ɐmɐge <>
4730,nɐ ehono khɐ͡ɪ̯nɪ।
4731,khɐbɐnɪ ettu pɔɾe।
4732,ɾɐnnɐ koɾɪ nɐ͡ɪ̯ ehono।
4733,ɾɐnnɐ koɾbɐnɪ ettu pɔɾe।
4734,ɐ͡ɪ̯ɟke ɐbɐɾɐ ʃe͡ɪ̯ kɐɟ koɾbo।
4735,et̪o kɐɟ koɾbo।
4736,nɐmɐɟ phɪɽe ɐ͡ɪ̯ʃe bo͡ɪ̯chɪ।
4737,ɐ͡ɪ̯che o͡ɪ̯ benu ɐɾ ʃud̪ɪnɪɾ bɔ͡u̯।
4738,ʃe kɔt̪ɐ kot̪ɪ kot̪ɪ kot̪ɪ t̪ɐɾɐ kɐɾent co͡ɪ̯le geche।
4739,t̪ɐ othle nɐ।
4740,ɐmɐɾ ejɛɾ bɪkel mɐne ʃo͡ɪ̯nd̪ɦedɐ͡ɪ̯ bɔɾbɐd̪ o͡ɪ̯je gɛlo।
4741,kono kɐɟ ɔlo nɐ।
4742,ko͡ɪ̯jet̪t̪ɪ ɐ͡ɪ̯chelo uɾɐ?
4743,o͡ɪ̯ɟe bɦɪtɐmɪn khɐ͡ɐ̯t̪ɪ ɐ͡ɪ̯chelo।
4744,kundɐɾe?
4745,"benuɾ mɐ͡ɪ̯jeɾe, ɐ?"
4746,becuɾ bɦɪtɐmɪn khɐ͡ɐ̯t̪ɪ ɐ͡ɪ̯chelo?benuɾ mɐ͡ɪ̯jeɾe bɦɪtɐmɪn khɐ͡ɐ̯t̪ɪ ɐ͡ɪ̯chelo?
4747,ɐmɐɾ hocche mone hɔe̯ cɐɾ t̪ɐlɐɾ bɦet̪ɔɾe ke͡u̯ neche।
4748,"ɐpnɪ ɪttu ɪ kɔɾen, xõɟ nɪje d̪ehen।"
4749,t̪ɐ ɐmɪ kɔcchɪ ɟe ɐcchɐ thɪk ɐche।
4750,pɔɾe ɟɐ͡ɪ̯je cɐɾ t̪ɐlɐe̯ t̪o beʃɪ mɐ͡ɪ̯je khɐe̯ nɐ meʃe।
4751,t̪ɪnɟɔn kɪ cɐɾɟɔn।
4752,pɔɾe pɐʃeɾ ɾumɪ ɟɪggɐʃ koɾlɐm।
4753,ɐɾ ɪdɐɾɐ hɛmɐɾɐ khɐ͡ɐ̯e̯ nɪje geche।
4754,"o, t̪umɪ bɐɽɪ nɪjɐ͡ɪ̯chɪle bɦɪtɐmɪn?"
4755,"ɐɾ ɔcche, hɔe̯।"
4756,e͡ɪ̯ɟe ko͡u̯tɐ d̪ɦo͡ɪ̯ɾe nɪjɐ͡ɪ̯chɪ।
4757,d̪ɐd̪ɐɾe kɔcchɪlɐm kɔjdɐ d̪ɪje d̪ɛn।
4758,t̪ɐ kɔcche ɟe ko͡u̯tɐ d̪ɦo͡ɪ̯ɾe nɪje ɟɐn d̪ɪ।
4759,ɐmɪ kɔcchɪ t̪ɐlɪ khɐ͡ɐ̯j-tɐ͡ɐ̯j nɪjɐʃphɐnɪ।
4760,kɔe̯ ɟɐn।
4761,kɔe̯ ko͡u̯tɐ͡o̯ ɐfnɐɾ bɦɪtɐmɪn
4762,bɦɪtɐmɪno ɐphnɐɾ।
4763,ɐmɪ kɔcchɪ o ko͡u̯tɐ d̪ɪje ɐmɪ kɪ ejɐɾbo?
4764,o ko͡u̯tɐ ɐmɪ bɪbɦɐh koɾɪ nɐ।
4765,kɔt̪o gɦɔɾgɽɪ khɐ͡ɪ̯je beɽɐcche।
4766,ehon ɐɾ ko͡u̯tɐ-ko͡u̯tɪ lɐgbe nɐ।
4767,ehon o͡ɪ̯ ʃɔb phɛlɐe̯ d̪ɪt̪ɪ ɔbe ɐɾ ɔcche bɐɾɐnd̪ɐe̯ o͡ɪ̯ɟe ɟe͡ɪ̯ ʃɔb tebɪl-tubɪl ɾo͡ɪ̯che।
